status_id,status_message,link_name,status_type,status_link,status_published,num_reactions,num_comments,num_shares,num_likes,num_loves,num_wows,num_hahas,num_sads,num_angrys,num_special
167115176655082_687515961447009,"It's wet and weird, and people seem to like that.",,video,https://www.facebook.com/VICE/videos/687515961447009/,2017-08-25 00:00:00,269,17,26,245,22,2,0,0,0,0
167115176655082_1560203030702997,"Matty Matheson shows us how to make the best, cheesiest burgers.

(via Munchies)",How to Make the Perfect Cheeseburger,video,https://www.facebook.com/VICE/videos/1560203030702997/,2017-08-24 17:30:00,4077,633,943,3513,321,19,218,2,4,0
167115176655082_1560511277338839,This 6-year-old is already better at Instagram than you'll probably ever be.,"Meet Coco, Japan's Young Instagram Icon",video,https://www.facebook.com/VICE/videos/1560511277338839/,2017-08-24 14:00:00,6348,1783,818,5031,798,81,99,306,33,0
167115176655082_1832946203686087,"Game of Thrones mega fan Big Narstie aka Lord of Base, gets to live out his medieval dreams with a bunch of history nuts.",Big Narstie: The Real Game Of Thrones,video,https://www.facebook.com/VICE/videos/1832946203686087/,2017-08-24 13:30:00,2530,1058,464,2107,101,6,316,0,0,0
167115176655082_1560198077370159,This veteran protects millions of dollars worth of weed.,Meet the Veteran Who Guards Colorado's Weed,video,https://www.facebook.com/VICE/videos/1560198077370159/,2017-08-24 11:30:00,1947,73,318,1813,109,10,14,0,1,0
167115176655082_1832845983696109,"Why does coke make me feel so nice? Does purity make a big difference? What are the risks?

Here's everything you need to know about taking cocaine safely.",Always Practise Safe Sesh: Cocaine,video,https://www.facebook.com/VICE/videos/1832845983696109/,2017-08-24 06:30:10,2508,491,539,2171,83,28,219,1,6,0
167115176655082_487252658306657,"Meet Nonna Marijuana, the 94-year-old weed chef.

(via VICELAND)",Cooking Cannabis Dinners with Nonna Marijuana,video,https://www.facebook.com/VICE/videos/487252658306657/,2017-08-23 19:30:00,11853,1364,3516,9815,1602,111,323,0,2,0
167115176655082_487250674973522,"Explore the real cost of pink salt in Peru.

(via VICELAND)",The Economics of Pink Salt in Peru,video,https://www.facebook.com/VICE/videos/487250674973522/,2017-08-23 17:30:00,8202,798,2216,6158,83,692,15,1002,252,0
167115176655082_1559357610787539,These Germans shove tobacco up their noses for sport.,We Try Competitive Tobacco Snorting in Bavaria,video,https://www.facebook.com/VICE/videos/1559357610787539/,2017-08-23 16:00:00,7277,15252,6694,3894,91,982,2158,115,37,0
167115176655082_1795040600529190,Meet a mom who was paid to eat by men who fetishize large women.,This 600 Pound Mom Was Paid to Eat,video,https://www.facebook.com/VICE/videos/1795040600529190/,2017-08-23 09:00:00,2588,2607,703,1217,29,668,387,222,65,0
167115176655082_1557406824315951,"YG responds to comments on his ""Fuck Donald Trump"" video.

(via Noisey)","Watch YG Respond to Comments on ""Fuck Donald Trump""",video,https://www.facebook.com/VICE/videos/1557406824315951/,2017-08-22 17:30:00,3444,473,344,2541,393,2,487,2,19,0
167115176655082_1831935163787191,Here is everything you need to know about taking ecstasy safely.,Always Practise Safe Sesh: Ecstasy,video,https://www.facebook.com/VICE/videos/1831935163787191/,2017-08-22 06:58:37,10398,2850,3929,9116,519,80,649,9,25,0
167115176655082_486351165063473,"""We should be connected, more than building a wall.""

(via VICELAND)",Understanding American Politics in Mexico,video,https://www.facebook.com/VICE/videos/486351165063473/,2017-08-21 19:00:00,2427,85,362,2016,372,5,28,3,3,0
167115176655082_856682827825002,"From the neo-Nazi protests at Emancipation Park to a white supremacist’s hideaway outside of Virginia, VICE News had exclusive access from the front-lines of Charlottesville.

(via HBO)",Charlottesville: Race and Terror | VICE News Tonight,video,https://www.facebook.com/VICE/videos/856682827825002/,2017-08-21 17:30:00,1907,557,383,947,19,123,229,76,513,0
167115176655082_856660794493872,Guess who looked directly at the sun during the eclipse?,Trump Looks Directly at Sun During Eclipse,video,https://www.facebook.com/VICE/videos/856660794493872/,2017-08-21 15:39:07,12854,1994,1527,6146,278,93,6281,28,28,0
167115176655082_1555933777796589,"Border officials say about 230 people per day are making asylum claims to enter Canada from the US.

(via VICE News Canada)",Canadian Officials Doubling Capacity of Refugee Camp,video,https://www.facebook.com/VICE/videos/1555933777796589/,2017-08-21 14:30:00,798,180,241,504,17,131,81,46,19,0
167115176655082_1490932280963406,"This is technically a breakfast hash, but also makes for a perfect lunch or dinner: http://bit.ly/2s2OJBN

From our good pals at Munchies.",How to Make Breakfast Hash with Matty Matheson,video,https://www.facebook.com/VICE/videos/1490932280963406/,2017-06-28 14:30:00,1146,226,106,1046,80,14,2,0,1,3
167115176655082_1489647214425246,"Meet some of the last surviving members of Los Frikis, members of Cuba's punk movement who purposefully infected themselves with HIV.

More VICE docs on the HIV epidemic: http://bit.ly/2rYxHFa",The Cuban Punks Who Infected Themselves with HIV in Protest,video,https://www.facebook.com/VICE/videos/1489647214425246/,2017-06-27 20:30:00,7149,1298,4001,4406,77,1799,62,759,42,4
167115176655082_1489603017762999,"This guy hacked Myspace, and as a result, was banned from the Internet for three years.

Here's how he took it down: http://bit.ly/2rYnHM9 (via MOTHERBOARD)",Inside the Hack that Blew Up Myspace,video,https://www.facebook.com/VICE/videos/1489603017762999/,2017-06-27 17:30:00,10097,621,2396,7158,148,699,2070,9,5,8
167115176655082_1728133000553284,"A ""beer suicide"" is the perfect drink if you want everyone at the bar to hate you.",Drink a Beer Suicide If You Want Everyone to Hate You,video,https://www.facebook.com/VICE/videos/1728133000553284/,2017-06-27 14:30:00,2021,749,470,1650,66,42,250,7,4,2
167115176655082_10155601322073933,"Syria. Ukraine. China. North Korea.

What do we do about a world in disarray? A VICE on HBO Special Report: A World in Disarray premieres July 21.",World in Disarray: VICE on HBO,video,https://www.facebook.com/VICE/videos/10155601322073933/,2017-06-27 11:30:00,485,53,144,453,5,7,3,14,2,1
167115176655082_1802123153435059,"Wait, what sort of person likes Ed Sheeran again?",Who Actually Listens to Ed Sheeran?,video,https://www.facebook.com/VICE/videos/1802123153435059/,2017-06-26 13:30:00,3637,1244,514,2741,108,5,762,4,10,7
167115176655082_660176967514242,"Australians drink 36 million litres of cask wine —aka ""goon""— a year. One mega factory produces nearly half of it.

Read more about where parties come from: http://bit.ly/2t77ck6",Inside a Mega Cask Wine Factory,video,https://www.facebook.com/VICE/videos/660176967514242/,2017-06-25 22:00:00,4088,3086,904,3695,136,67,177,5,1,7
167115176655082_1485531528170148,"Members of Russia’s LGBTQ community are looking for a way to leave the country.

Activist Lyosha Gorshnov tells VICELAND's Ian Daniel the steps to gaining asylum: http://bit.ly/2t3j0UY",An LGBTQ Activist Explains How to Gain Asylum,video,https://www.facebook.com/VICE/videos/1485531528170148/,2017-06-25 14:30:00,398,33,41,270,26,2,5,7,2,86
167115176655082_818495484977070,"These Puerto Rican artists are risking jail time to get their message out.

(via VICE News)",Puerto Rico's Protest Art,video,https://www.facebook.com/VICE/videos/818495484977070/,2017-06-24 20:30:00,1102,90,565,959,81,11,2,39,6,4
167115176655082_1485498851506749,"Watch what happens when $200,000 worth of cocaine gets destroyed.

We visited the cocaine labs hidden in the Peruvian mountains: http://bit.ly/2t4kuhR","Destroying $200,000 Worth of Peruvian Cocaine",video,https://www.facebook.com/VICE/videos/1485498851506749/,2017-06-24 14:30:00,9932,1186,2345,8368,164,567,105,640,79,9
167115176655082_1485544098168891,"Gay men are being targeted, arrested, and tortured in Russia's Chechnya region.

Despite international outrage, Putin and Chechen leaders have remained obstinate: http://bit.ly/2t3j0UY",The Dangers of Anti-Gay Sentiments in Chechnya,video,https://www.facebook.com/VICE/videos/1485544098168891/,2017-06-24 11:30:00,891,80,175,457,9,9,23,87,203,103
167115176655082_1800460153601359,"""Peel 'em, boil 'em, put 'em in the f**king oven.""

We asked Liam Gallagher how he likes his potatoes.",British Masters: Liam Gallagher Cooks Potatoes,video,https://www.facebook.com/VICE/videos/1800460153601359/,2017-06-24 05:30:00,4965,1333,886,4223,173,4,558,2,2,3
167115176655082_817858771707408,"Your weed might not be as sticky as advertised. (via VICE News)

What else is behind the legal weed industry? http://bit.ly/2rHsfX2",Weed Fraud: Are You Getting Cheated?,video,https://www.facebook.com/VICE/videos/817858771707408/,2017-06-23 19:00:00,2011,218,902,1826,48,101,10,10,14,2
167115176655082_1484451694944798,"Meet the hitmen who are part of Pablo Escobar's legacy.

We follow them through the criminal underworld of Lima: http://bit.ly/2t0mpDS",These Hitmen Are Pablo Escobar's Legacy,video,https://www.facebook.com/VICE/videos/1484451694944798/,2017-06-22 17:30:00,9834,993,4155,8127,74,1018,88,488,38,1
167115176655082_1484422218281079,"A former heroin addict explains the struggle of wanting to use 24 hours a day.

Watch the full Tonic documentary here: http://bit.ly/2rHfH1S",Maine's Fishing Community Is Battling Heroin Abuse,video,https://www.facebook.com/VICE/videos/1484422218281079/,2017-06-22 14:30:00,14761,1695,6900,11128,274,815,113,2375,51,5
167115176655082_1484248101631824,"During the summer solstice, Romanian witches have the power to predict the future.

Find out how they cast curses on Broadly: http://bit.ly/2sZGSIX",These Romanian Witches Have the Power to Predict the Future,video,https://www.facebook.com/VICE/videos/1484248101631824/,2017-06-22 10:41:00,4098,2194,1545,3089,428,75,438,7,48,13
167115176655082_1799343957046312,"Tom Jones, Guinness and Partridge: Liam Gallagher talks us through a naughty night out with Steve Coogan. (via Noisey)",The British Masters: Liam Gallagher,video,https://www.facebook.com/VICE/videos/1799343957046312/,2017-06-21 07:30:00,15244,4555,3249,13687,465,9,1073,1,2,7
167115176655082_453925388306051,"Roll a big, fat sushi blunt with VICELAND.

More from the high-end world of weed here: http://bit.ly/2rAtd76",How to Roll a Sushi Blunt,video,https://www.facebook.com/VICE/videos/453925388306051/,2017-06-20 20:30:00,20754,15818,35363,15724,2092,1736,1091,21,36,54
167115176655082_1481336778589623,"Katy Perry isn't the same person she was four months ago.

Watch her open up about her struggle with fame: http://bit.ly/2sPFYie",Katy Perry Opens Up About Her Past,video,https://www.facebook.com/VICE/videos/1481336778589623/,2017-06-19 17:30:00,3724,1458,371,2488,377,23,756,41,20,19
167115176655082_1454012517993505,"This woman makes a living out of stuffing dead animals. 

Broadly finds out why taxidermy is making a comeback among young women: http://bit.ly/2sPhfKR",Stuffing Dead Animals for a Living,video,https://www.facebook.com/VICE/videos/1454012517993505/,2017-06-19 14:30:00,306,121,59,233,30,29,6,3,4,1
167115176655082_1750231221941083,"How much should legal weed cost?

Here's what you could be paying: http://bit.ly/2t8xjVs (via VICE Money)",How Much Should Legal Weed Cost?,video,https://www.facebook.com/VICE/videos/1750231221941083/,2017-06-18 17:30:00,942,127,223,887,32,13,1,2,2,5
167115176655082_1477193575670610,"This guy has been injecting himself with snake venom for 20 years in a quest for immortality.

Full video: http://bit.ly/2mukox5",Meet the Venom Superman,video,https://www.facebook.com/VICE/videos/1477193575670610/,2017-06-18 14:30:00,3345,976,693,2581,43,414,184,33,85,5
167115176655082_813830235443595,"The VA overpaid tens of thousands of veterans, and now it says they have to give the money back: http://bit.ly/2t8yiEU

(via VICE News)",When the VA is your debt collector,video,https://www.facebook.com/VICE/videos/813830235443595/,2017-06-17 20:30:00,1724,218,697,514,4,173,14,95,922,2
167115176655082_1452624684799029,"Matty Matheson knows how to make the perfect steak sandwich.

See the full how-to on Munchies: http://bit.ly/2t8NAtl",Watch Matty Matheson Make a Steak Sandwich,video,https://www.facebook.com/VICE/videos/1452624684799029/,2017-06-17 17:30:00,2042,280,192,1883,119,31,3,3,2,1
167115176655082_451748591857064,"Artie Lange had to play a pig, but he needed a little, um, motivation. 

Read the full story on how cocaine ruined this costume, here: http://bit.ly/2teN3WV",That Time Artie Lange Destroyed a Pig Costume for Drugs,video,https://www.facebook.com/VICE/videos/451748591857064/,2017-06-17 17:00:00,299,27,28,217,11,1,68,1,0,1
167115176655082_1477185829004718,"Is a penis implant actually worth it?

We decided to ask a urologist: http://bit.ly/2t8pwXA",What It's Worth to Get a Penis Implant,video,https://www.facebook.com/VICE/videos/1477185829004718/,2017-06-17 14:30:00,1335,458,288,949,21,113,224,5,15,8
167115176655082_1967372670163134,"Just pop, jump, and land.

More skate videos from around the world: http://bit.ly/2t8NphZ",How to Do a Kickflip,video,https://www.facebook.com/VICE/videos/1967372670163134/,2017-06-17 11:30:00,1190,145,120,1120,45,1,20,2,0,2
167115176655082_10154992344187561,"Throw away your phone without ruining the environment. (via MOTHERBOARD)

Here's why it's far from a piece of junk: http://bit.ly/2rlBsnw",How to Throw Away Your Old Cell Phone,video,https://www.facebook.com/VICE/videos/10154992344187561/,2017-06-16 17:30:00,1757,75,654,1657,63,30,3,1,0,3
167115176655082_1714801228553128,"Hyperrealistic paintings of women in water.

This artist wants them to encourage body positivity: http://bit.ly/2svd0DP (via Creators)",Reisha Perlmutter's Hyperrealistic Aquatic Portraits,video,https://www.facebook.com/VICE/videos/1714801228553128/,2017-06-16 11:40:15,6630,306,984,5317,950,335,10,1,2,15
167115176655082_1476762082380426,"Mike Bolkovic has been injecting himself with testosterone for the past eight years.

More on what steroids do to your body from VICE Sports here: http://bit.ly/2sE1oi2",What It's Like to Take Steroids,video,https://www.facebook.com/VICE/videos/1476762082380426/,2017-06-15 16:00:00,3304,1598,1012,2583,18,409,178,86,22,8
167115176655082_1713486175351300,"They have guns, hate for immigrants, and a complete distrust of the Canadian government.

Inside the rise of an anti-Islam militia: http://bit.ly/2sfIDip",The Rise Of Canada's Anti-Islam Militia,video,https://www.facebook.com/VICE/videos/1713486175351300/,2017-06-15 15:00:00,3539,1242,6755,2276,407,128,214,87,417,10
167115176655082_1713442185355699,VICE's first English language film The Bad Batch hits theaters June 23rd.,The Bad Batch Trailer,video,https://www.facebook.com/VICE/videos/1713442185355699/,2017-06-15 14:00:00,1756,154,267,1614,66,69,4,0,2,1
167115176655082_1796413400672701,"""No kicks on the carpet, man"":  SECTION BOYZ show Mike Skinner around their country pile – 'Don't Call It Road Rap', Out Now on Noisey.",A Year Exploring the Hidden World of Hard UK Rap,video,https://www.facebook.com/VICE/videos/1796413400672701/,2017-06-15 06:56:53,618,103,56,589,20,3,6,0,0,0
167115176655082_1712426072123977,"For war veterans dealing with PTSD, virtual reality can help.

Here's how VR is being used as treatment: http://bit.ly/2sBvfYx (via MOTHERBOARD)",Using Virtual Reality to Treat PTSD,video,https://www.facebook.com/VICE/videos/1712426072123977/,2017-06-14 18:10:57,1375,124,458,1211,83,76,1,2,1,1
167115176655082_812683305558288,Watch a Trump cabinet meeting turn into a bizarre ass-kissing contest: http://bit.ly/2s0AZKm,Cabinet Meeting Turns Into Ass-Kissing Content,video,https://www.facebook.com/VICE/videos/812683305558288/,2017-06-14 08:56:58,7304,1830,2354,2178,50,344,3464,189,1032,47
167115176655082_1795877520726289,"Schoolchildren in the UK are missing class because they can't afford tampons and sanitary pads.

Find out how a group of activists is trying to change that.",The Activists Making Sure Kids Don't Miss School Because of Th...,video,https://www.facebook.com/VICE/videos/1795877520726289/,2017-06-14 05:30:00,449,38,89,331,23,18,2,68,6,1
167115176655082_1795462874101087,Mike Skinner investigates the explosion of UK ‘gangster’ rap and follows some of the scene's most important MCs. 'Don't Call It Road Rap' – Coming soon to Noisey.,Don't Call It Road Rap (Trailer),video,https://www.facebook.com/VICE/videos/1795462874101087/,2017-06-13 13:30:00,518,106,58,497,21,0,0,0,0,0
167115176655082_10154983771997561,"Water cremation is an environmentally-friendly way to leave Earth.

Find out why dying is so bad for the environment here: http://bit.ly/2rktAXr",Greener Human Disposal: Water Cremation,video,https://www.facebook.com/VICE/videos/10154983771997561/,2017-06-12 17:30:00,4398,450,1650,3689,270,427,5,2,2,3
167115176655082_1473126896077278,"Jonathan Gallagher uses live action role-playing as a form of therapy for his Asperger's.

Here's how LARPing changed his life: http://bit.ly/2suej65",Can LARPing Save Your Life?,video,https://www.facebook.com/VICE/videos/1473126896077278/,2017-06-12 14:30:00,4275,1000,1660,3562,566,26,106,4,2,9
167115176655082_1795079964139378,"""People are enthused and excited about the kind of politics that they've never experienced before in their lives.""",PODCAST: The British Dream,video,https://www.facebook.com/VICE/videos/1795079964139378/,2017-06-12 13:30:00,87,7,9,83,4,0,0,0,0,0
167115176655082_1563156220402803,"If you don't know who Cam Kirk is, find out.

See more of his work here: http://bit.ly/2rknuBu",Noisey Meets Cam Kirk,video,https://www.facebook.com/VICE/videos/1563156220402803/,2017-06-11 17:00:00,5569,359,1627,5264,243,17,29,2,3,11
167115176655082_810280582465227,"Churches are hiding undocumented immigrants from ICE. We followed one family trying to make it to Canada.

More on the story from VICE News and HBO here: http://bit.ly/2rMG8FF",Churches Are Hiding Undocumented Immigrants,video,https://www.facebook.com/VICE/videos/810280582465227/,2017-06-11 09:00:00,2416,157,414,1581,281,38,17,450,40,9
167115176655082_1470166579706643,"The sweetest way to get high.

Head to the mountains of Nepal and taste hallucinogenic honey: http://bit.ly/2nBTtjA",This Honey Makes You High,video,https://www.facebook.com/VICE/videos/1470166579706643/,2017-06-10 17:34:50,35951,9725,14962,31031,2036,2073,687,12,15,97
167115176655082_1469942673062367,"In 2014, ACLU Nationwide challenged an anti-abortion law with a woman who runs the only abortion clinic in Montgomery, Alabama.

Learn the history behind more landmark cases: http://bit.ly/2r3COmQ",ACLU and U: Reproductive Rights,video,https://www.facebook.com/VICE/videos/1469942673062367/,2017-06-09 14:30:00,445,52,77,358,54,10,2,10,9,2
167115176655082_447369315628325,"Ice-T's wildest partying days happened with Prince. (via VICELAND)

More behind Ice-T's legacy: http://bit.ly/2sjWpTM",Stripping Butt Naked at Parties with Ice-T,video,https://www.facebook.com/VICE/videos/447369315628325/,2017-06-08 19:30:00,12237,1093,3961,8182,375,62,3610,4,1,3
167115176655082_1963156770584724,"These bodybuilding champions are fighting to keep the competition alive. 

VICE Sports meets the women behind the muscles: http://bit.ly/2sgMwWF",Meet the Women Keeping Bodybuilding Alive,video,https://www.facebook.com/VICE/videos/1963156770584724/,2017-06-08 16:30:00,2615,4451,1063,1638,149,418,284,82,39,5
167115176655082_229205774246860,"Could you afford to live in Toronto? 

VICE Money looks at the cost of living in big cities: http://bit.ly/2sgoOtW",Making It: Cost of Living in Toronto,video,https://www.facebook.com/VICE/videos/229205774246860/,2017-06-08 12:30:00,799,339,228,616,12,95,17,53,6,0
167115176655082_1734909463191500,"This 6-year-old is already better at Instagram than you'll probably ever be.

Meet Coco, Japan's youngest fashion icon: http://bit.ly/2sDSeQ1 (via Creators)",How a Six-Year-Old Became One of Japan's Instagram Icons,video,https://www.facebook.com/VICE/videos/1734909463191500/,2017-06-07 15:30:00,8373,2091,2002,6793,1243,166,69,70,32,0
167115176655082_1792795697701138,"From the hidden homeless to rich oligarchs and the renting crisis. 

We went on an election road trip to find the problems UK politicians aren't talking about. More in-depth coverage from VICE Reports: http://bit.ly/2qX2UIh",The 2017 UK Election Road Trip,video,https://www.facebook.com/VICE/videos/1792795697701138/,2017-06-07 13:37:31,449,30,93,421,18,5,2,2,1,0
167115176655082_1792652181048823,"""Jeremy Corbyn you're moist.""

Could Supreme hype beasts win the election for the Tories?",QOTD: Do kids queueing for the Supreme drop care about the ele...,video,https://www.facebook.com/VICE/videos/1792652181048823/,2017-06-07 08:00:18,7697,5343,4042,6117,187,48,1182,68,95,0
167115176655082_807580419401910,"""People got sick and died, but no one knew what they were dying from."" 

Via VICE News Tonight on HBO",Russia's Radioactive Past Haunts Its Citizens: VICE News Tonight,video,https://www.facebook.com/VICE/videos/807580419401910/,2017-06-06 17:30:00,6931,708,1817,4342,23,1385,11,1026,144,0
167115176655082_1701981699835081,"For some, kidnapping is the ultimate sexual fantasy.

See what goes into a successful BDSM abduction: http://bit.ly/2scASwf",The Dangerous Business of BDSM Abduction Fantasies,video,https://www.facebook.com/VICE/videos/1701981699835081/,2017-06-06 14:30:00,290,184,56,199,17,28,42,3,1,0
167115176655082_1702095136490404,"This Canadian cop is extremely Canadian. 

Watch more: http://bit.ly/2rx4m6F",The Nicest Cop You’ll Ever See,video,https://www.facebook.com/VICE/videos/1702095136490404/,2017-06-06 11:30:00,470637,31496,314045,397463,49063,3096,20771,64,60,120
167115176655082_1701235196576398,"Bored with your 9-5 job? Valentine Thomas probably can't relate.

Here's how she uses spearfishing to survive: http://bit.ly/2qRo8qV (via VICE Sports)",Valentine Thomas Fights Sharks for Food,video,https://www.facebook.com/VICE/videos/1701235196576398/,2017-06-05 21:00:00,4116,453,573,3639,278,178,8,4,9,0
167115176655082_806349519525000,"""I have many friends. Many, many friends."" -Donald Trump

And keep up with the president's latest antics in the VICE News Trump Tracker: http://bit.ly/2rzbyh7",Trump Lists His Many Friends,video,https://www.facebook.com/VICE/videos/806349519525000/,2017-06-04 17:30:00,7602,1590,2679,4470,129,37,2910,22,34,0
167115176655082_1461862847203683,"Cassandro isn't just a luchador—he's an 'exotico,' a fighter who takes to the ring in drag.

Spend a few days with the Liberace of Lucha Libre in his home town of El Paso, Texas, to hear about the fighters who inspired him, his battle with addiction, and what it takes to fight the best in the business.",How a Gay Pro Wrestler Became Mexico's 'Liberace of Lucha Libre',video,https://www.facebook.com/VICE/videos/1461862847203683/,2017-06-04 11:30:00,336,49,96,263,57,12,3,1,0,0
167115176655082_1461689220554379,"In Japan, single women are turning away from relationships and renting boyfriends instead.

See how gender norms in the country are shifting: http://bit.ly/2s2F8ON",Want to Rent a Boyfriend?,video,https://www.facebook.com/VICE/videos/1461689220554379/,2017-06-03 11:30:00,3809,1808,913,2749,212,155,665,23,5,0
167115176655082_1696839183682666,"When you wanted a dog, but you got a pig instead. Meet La Chata 🐽 📷

See more cute pets here: http://bit.ly/2qn8gw9",This Instagram Famous Pig Thinks He's a Dog,video,https://www.facebook.com/VICE/videos/1696839183682666/,2017-06-02 11:30:00,7900,1974,2607,6169,1446,33,249,2,1,0
167115176655082_1460634780659823,"Meet Javier Botet, the actor playing the tall and freaky xenomorph in 'Alien: Covenant'

More behind the deranged history of Alien films: http://bit.ly/2rYs2C2",Meet the Actor Behind Hollywood's Weirdest Creatures,video,https://www.facebook.com/VICE/videos/1460634780659823/,2017-06-01 17:30:00,15462,1827,10101,13030,1713,700,11,6,2,0
167115176655082_1460470314009603,"Know which states let you smoke weed and which say you can't.

More behind the government's push for legalization: http://bit.ly/2rYd9zG",Know Your Rights: Marijuana Laws,video,https://www.facebook.com/VICE/videos/1460470314009603/,2017-06-01 11:00:00,374,41,119,304,2,4,3,22,39,0
167115176655082_1565133543507203,"Meet Ghostrider -- a legend in Toronto's luxury car scene who's had his fair share of run-ins with police.

Watch more: http://bit.ly/2qGjKtI",Smoke Show: Meet Ghostrider,video,https://www.facebook.com/VICE/videos/1565133543507203/,2017-05-31 17:30:00,47,7,6,45,0,2,0,0,0,0
167115176655082_1459157120807589,"What happens on a lesbian Mormon porn set?

And watch the full Mormon porn doc here: http://bit.ly/2qBmOsa",Inside the Mormon War on Porn,video,https://www.facebook.com/VICE/videos/1459157120807589/,2017-05-31 16:00:00,4510,480,473,4094,77,108,205,5,21,0
167115176655082_803940489765903,"Donald Trump tweeted a new word that's baffling newscasters: covfefe.

And of course the internet is still confused: http://bit.ly/2qBH6BM (via VICE News)",Newscasters Try To Pronounce Trump's New Made-up Word,video,https://www.facebook.com/VICE/videos/803940489765903/,2017-05-31 15:00:00,5990,1867,2089,3620,144,15,2175,17,19,0
167115176655082_1459089574147677,"""They took advantage of my fears to possess me, and then I blacked out.""

This is what an exorcism in Mexico looks like: http://bit.ly/2qBflcn",The Rise of Exorcism in Mexico,video,https://www.facebook.com/VICE/videos/1459089574147677/,2017-05-31 14:30:00,509,267,104,334,5,45,110,4,11,0
