status_id,status_message,link_name,status_type,status_link,status_published,num_reactions,num_comments,num_shares,num_likes,num_loves,num_wows,num_hahas,num_sads,num_angrys,num_special
167115176655082_1924898154210100,"Could Britain, somehow, end up under American rule?",Who Would Have to Die for Meghan Markle to Be the Queen of England?,link,https://news.vice.com/story/who-would-have-to-die-for-meghan-markle-to-be-the-queen-of-england?utm_source=vicefbus,2017-11-28 17:30:13,598,184,50,369,22,4,197,3,3,0
167115176655082_1924862354213680,Now that's what I call movie magic!,Armie Hammer's Balls Had to Be Digitally Edited Out of 'Call Me By Your Name',link,https://www.vice.com/en_us/article/59ynvq/armie-hammers-balls-had-to-be-digitally-edited-out-of-call-me-by-your-name-vgtrn?utm_source=vicefbus,2017-11-28 17:02:01,170,72,18,113,9,3,42,3,0,0
167115176655082_1923088824391033,An exhibition of detainee art has the Pentagon riled.,The Military Is Burning Art from Guantanamo That the World Should See,link,https://www.vice.com/en_us/article/7x4y4x/the-military-is-burning-art-from-guantanamo-that-the-world-should-see?utm_source=vicefbus,2017-11-28 16:30:03,2580,88,965,1671,22,125,20,367,375,0
167115176655082_1924780664221849,And it's all caught on video.,A Bunch of Teens Snitched on Their Teacher for Doing Coke in Class,link,https://www.vice.com/en_us/article/59yneq/a-bunch-of-teens-snitched-on-their-teacher-for-doing-drugs-in-class-vgtrn?utm_source=vicefbus,2017-11-28 16:01:57,6115,1559,1142,3451,48,853,1552,124,87,0
167115176655082_1668611649862134,"Soju—a.k.a. Korean firewater—is the world's most popular spirit, selling twice as much as vodka each year. 

(via Munchies)",Getting Soju Drunk in Seoul,video,https://www.facebook.com/VICE/videos/1668611649862134/,2017-11-28 15:30:01,11726,5674,4597,10046,910,129,629,6,6,0
167115176655082_1924697384230177,"""The first lady has decked the halls of the White House to match her haunted heart.""","Melania Is Planning the Christmas from Hell, and I Am Loving It",link,https://www.vice.com/en_us/article/evbjxn/melania-is-planning-the-christmas-from-hell-and-i-am-loving-it?utm_source=vicefbus,2017-11-28 15:01:50,6145,438,655,3587,334,63,2132,14,15,0
167115176655082_1924656397567609,Good.,"Morrissey Says He’s No Longer Doing Print Interviews, World Rejoices",link,https://noisey.vice.com/en_uk/article/vb35zb/morrissey-says-hes-no-longer-doing-print-interviews-world-rejoices?utm_campaign=global&utm_source=vicefbuk,2017-11-28 14:30:22,1821,146,116,1334,67,4,411,3,2,0
167115176655082_1924621370904445,"""The eternal hourglass of existence is turned upside down again and again, and you with it, speck of dust!"" - Friedrich Nietzsche",MTV Is Bringing Back 'Jersey Shore' for Some Reason,link,https://www.vice.com/en_us/article/evbj7w/mtv-is-bringing-back-jersey-shore-for-some-reason-vgtrn?utm_source=vicefbus,2017-11-28 14:02:51,467,270,68,258,29,10,117,35,18,0
167115176655082_1924395860926996,,Tonic: Yes Man,video,https://www.facebook.com/tonicyesman/videos/191366414746264/,2017-11-28 13:30:01,1381,327,0,972,89,17,284,7,12,0
167115176655082_1924550307578218,"Yes, 2017 is real and it's still happening.",The Mooch Is Threatening to Sue a College Kid Who Called Him 'Unethical',link,https://www.vice.com/en_us/article/9kqe58/the-mooch-is-threatening-to-sue-a-college-kid-who-called-him-unethical-vgtrn?utm_source=vicefbus,2017-11-28 13:10:08,622,50,39,284,3,30,276,8,21,0
167115176655082_1668632199860079,"These tattoo artists care more about pain than art.

More behind the brutal tattoo ritual: https://vice.video/2ied9sD",Inside the Brutal Tattoo Ritual Built on Pain,video,https://www.facebook.com/VICE/videos/1668632199860079/,2017-11-28 12:37:00,13986,14415,25282,8353,452,2735,1688,260,497,1
167115176655082_1924499464249969,,Noisey,video,https://www.facebook.com/Noisey/videos/1734014306650326/,2017-11-28 12:24:03,41,3,0,37,3,0,1,0,0,0
167115176655082_1924440740922508,Apparently Trump suggested recently that the tape might be fake.,"'Access Hollywood' Just Reminded Us That, Yeah, the Trump Tape Is Real",link,https://www.vice.com/en_us/article/vb35xa/access-hollywood-reminded-everyone-that-yeah-the-trump-tape-is-real-vgtrn?utm_source=vicefbus,2017-11-28 11:32:50,1313,83,133,1026,37,20,207,5,18,0
167115176655082_1924407354259180,A wooden boat carrying the skeletal remains of eight people washed up on a Japanese beach Monday.,Why Wooden Boats Crewed by Skeletons Keep Beaching on Japanese Shores,link,https://news.vice.com/story/north-korea-ghost-ships?utm_source=vicefbus,2017-11-28 11:04:03,482,26,106,348,3,78,3,50,0,0
167115176655082_1924368217596427,"""My friends and I carry pepper spray in our bags at all times, in case we have to defend ourselves."" (via عربية VICE)",Arab Women Talk About What It's Like to Walk Alone at Night,link,https://www.vice.com/en_uk/article/d3dnqy/arab-women-talk-about-what-its-like-to-walk-alone-at-night?utm_campaign=global&utm_source=vicefbuk,2017-11-28 10:30:46,290,74,28,206,5,8,12,54,5,0
167115176655082_1924334854266430,"New York, take note.",What New York Can Learn from London's Underground,link,https://www.vice.com/en_us/article/bj7qv4/what-can-new-york-learn-from-londons-underground?utm_source=vicefbus,2017-11-28 10:02:21,70,10,8,66,2,2,0,0,0,0
167115176655082_1924298924270023,"It is a pop masterpiece, after all.",A Fan Actually Hung Lorde's 'Melodrama' in the Louvre,link,https://noisey.vice.com/en_uk/article/59ynyk/lorde-fan-hung-melodrama-louvre?utm_campaign=global&utm_source=vicefbuk,2017-11-28 09:30:19,1915,408,221,1473,293,4,141,2,2,0
167115176655082_1924265517606697,"No matter how hard I try, it makes me feel like shit.",I Tried to Figure Out Why Weed Isn't Fun for Me,link,https://www.vice.com/en_uk/article/ywbanb/i-tried-to-figure-out-why-weed-isnt-fun-for-me?utm_campaign=global&utm_source=vicefbuk,2017-11-28 09:01:13,918,306,67,797,21,5,62,32,1,0
167115176655082_1924232604276655,NOBODY PANIC.,"Good News, Frank Ocean Has Made Another Album",link,https://i-d.vice.com/en_uk/article/pa37zz/good-news-frank-ocean-has-made-another-album?utm_campaign=global&utm_source=vicefbuk,2017-11-28 08:30:47,12527,1617,940,10551,1668,279,20,7,1,1
167115176655082_1924203240946258,No shit.,Study Proves Link Between Voting for Brexit and Being Xenophobic,link,https://www.vice.com/en_uk/article/3kvx5v/study-proves-brexit-voters-really-are-xenophobes?utm_campaign=global&utm_source=vicefbuk,2017-11-28 08:02:03,1306,231,131,969,9,28,290,4,6,0
167115176655082_1924111174288798,Here's what happened when I unleashed chaos onto the most predictable show on television.,I Went on the Gameshow 'Eggheads' Just to Mess With Them,link,https://www.vice.com/en_uk/article/gy5dvx/i-went-on-eggheads-just-to-fuck-with-them?utm_source=vicefbuk&utm_campaign=global,2017-11-28 07:00:55,73,14,5,64,3,0,6,0,0,0
167115176655082_1877050675942306,We got 20 strangers who aren't models to kiss each other.,Awkward First Kisses,video,https://www.facebook.com/VICE/videos/1877050675942306/,2017-11-28 06:34:35,6918,2508,1866,4337,565,131,1849,21,15,0
167115176655082_1924079474291968,"""The worst part about the job is having to carry around a weapon the whole time and having to stab people.""",What It's Really Like 'Going Country' as a Young Drug Dealer,link,https://www.vice.com/en_uk/article/gyjzbw/what-its-really-like-going-country?utm_campaign=global&utm_source=vicefbuk,2017-11-28 06:00:58,136,26,22,116,2,4,11,1,1,1
167115176655082_1924029744296941,"""It’s not alcohol consumption that’s the problem. It’s the perpetrator and their choice to use those things in order to perpetuate sexual assault.""",How Bartenders Are Learning to Stop Sexual Assault on the Job,link,https://broadly.vice.com/en_us/article/43nkyj/how-bartenders-are-learning-to-stop-sexual-assault-on-the-job?utm_campaign=global&utm_source=vicefbuk,2017-11-28 05:30:01,1045,25,147,972,65,1,6,1,0,0
167115176655082_1923990400967542,Please say yes.,Can You Reverse the Horrible Long-Term Effects of Booze and Drugs?,link,https://www.vice.com/en_uk/article/exkvdk/drugs-exercise-clean-eating-recovery?utm_campaign=global&utm_source=vicefbuk,2017-11-28 05:06:43,136,37,13,114,2,0,19,1,0,0
167115176655082_1923962810970301,"“In my eyes, they’re punk. We are definitely similar.""",Björk Secretly Wrote Songs With Wu-Tang,link,https://i-d.vice.com/en_uk/article/7x4ggy/bjork-secretly-wrote-songs-with-wu-tang?utm_campaign=global&utm_source=vicefbuk,2017-11-28 04:48:23,9259,409,1599,7582,1198,412,63,1,2,1
167115176655082_1923894800977102,"I'm a Muslim Brit-Pakistani, but my pale skin and hair make everyone assume I'm white European – and yes, it's weird.",What It's Like to Be Albino When Everyone Thinks You're White,link,https://www.vice.com/en_uk/article/53gqpx/albinism-race-ethnicity-white-passing?utm_campaign=global&utm_source=vicefbuk,2017-11-28 04:00:35,357,108,63,265,2,16,70,4,0,0
167115176655082_1923848307648418,"“We fucking built that scene,” says ex-editor Conor McNicholas. “It doesn’t appear by itself.”",Never Forget How NME Created an Indie Scene Out of Thin Air in 2002,link,https://noisey.vice.com/en_uk/article/9kqpx3/nme-2002-oral-history-indie-strokes-libertines-scene?utm_source=vicefbus,2017-11-28 03:30:01,215,42,16,185,11,1,17,1,0,0
167115176655082_2042969389271045,"Meet Arthur, one of the last inhabitants of a 70s hippie commune in New Zealand's wilderness: http://bit.ly/2rvdPwL",The Last Man of Mahana,video,https://www.facebook.com/VICE/videos/2042969389271045/,2017-11-28 03:00:01,4269,771,661,3815,286,109,18,41,0,0
167115176655082_1923715860994996,"North Korea has been accused of stealing the cryptocurrency, hoarding it, and even mining it.",North Korea's Bitcoin Crash Course Has Experts Worried,link,https://news.vice.com/story/north-koreas-bitcoin-crash-course-has-experts-worried?utm_source=vicefbus,2017-11-28 02:00:37,331,103,80,242,2,30,55,1,1,0
167115176655082_1923662024333713,Greta Gerwig's semi-autobiographical film just set a new record.,'Lady Bird' Is Rotten Tomatoes' Freshest Movie of All Time,link,https://i-d.vice.com/en_us/article/zmzjxw/lady-bird-is-rotten-tomatoess-freshest-movie-of-all-time?utm_source=vicefbus,2017-11-28 01:30:01,2135,264,119,1933,165,30,7,0,0,0
167115176655082_1923613647671884,"Snake II, ringtone composer, and infinite battery life.","The Rise and Fall of Nokia 3310, the Funnest Phone Ever",link,https://www.vice.com/en_au/article/3kvxd9/the-rise-and-fall-of-nokia-3310-the-funnest-phone-ever?utm_source=vicefbanz&utm_campaign=global,2017-11-28 01:00:21,614,23,63,575,27,2,8,2,0,0
167115176655082_1923560327677216,"Is Systemspace an ""anime suicide cult"" or an elaborate prank?",The Obscure 4chan Religion That Promises a Cyberpunk Afterlife,link,https://motherboard.vice.com/en_us/article/ne3p9z/the-obscure-4chan-religion-that-promises-a-cyberpunk-afterlife?utm_source=vicefbus,2017-11-28 00:30:01,386,64,130,288,15,22,57,4,0,0
167115176655082_1923496457683603,A baby's basically like a tiny person on too many shrooms—literally anything can blow its mind.,What to Do with a Baby,link,https://www.vice.com/en_au/article/zngz95/so-you-had-a-baby-333?utm_source=vicefbanz&utm_campaign=global,2017-11-28 00:00:12,2718,415,442,1822,181,3,711,1,0,0
167115176655082_1923442341022348,They're not just shipping supplies over. They are on the ground changing the way things run.,"Sidestepping Trump, These People Are Rebuilding Puerto Rico",link,https://impact.vice.com/en_us/article/9kq4ye/activists-and-locals-are-using-giant-hurricane-relief-aid-ships-to-rebuild-puerto-rico?utm_source=vicefbus,2017-11-27 23:30:01,1156,26,327,1004,134,3,14,0,1,0
167115176655082_1923081217725127,Photos of life aboard an oil tanker: http://bit.ly/2zyeei0,Photos from VICE's post,photo,https://www.facebook.com/VICE/photos/a.167348959965037.36403.167115176655082/1923078687725380/?type=3,2017-11-27 23:00:00,391,5,24,355,25,11,0,0,0,0
167115176655082_1923381997695049,"There is not much else to say, really.",Today Was Another Dark Day For Canadian Media,link,https://www.vice.com/en_ca/article/xwaez7/another-dark-day-for-canadian-media-part-3456?utm_source=vicefbca&utm_campaign=Global,2017-11-27 22:30:02,37,6,10,25,0,1,1,7,3,0
167115176655082_1667367959986503,"This is what happens when your first live performance is opening for Drake. 

Watch more: https://vice.video/2BjWTKl",What It's Like Opening for Drake,video,https://www.facebook.com/VICE/videos/1667367959986503/,2017-11-27 22:00:00,334,18,20,317,11,2,4,0,0,0
167115176655082_1923118384388077,"Homemade sriracha that's sweet, spicy, and tangy.",Munchies,video,https://www.facebook.com/munchies/videos/1660561690667130/,2017-11-27 21:30:01,1979,1978,1,1771,155,47,5,0,0,1
167115176655082_1923290267704222,Dr. Roger Leir claimed to remove extraterrestrial implants from the bodies of abductees.,Watch This Film on a Doctor Who Claimed to Remove Alien Implants,link,https://motherboard.vice.com/en_us/article/43nzng/roger-leir-alien-implant-ufo-abduction?utm_source=vicefbus,2017-11-27 21:01:16,396,84,111,319,5,29,43,0,0,0
167115176655082_1923259081040674,"Retirement is just for Baby Boomers, right?",Your 401(k) Is Pretty Bullshit,link,https://www.vice.com/en_us/article/j5j3nx/your-401k-is-kinda-bullshit?utm_source=vicefbus,2017-11-27 20:30:12,224,37,63,195,3,1,2,16,7,0
167115176655082_1923231251043457,"That whole ""it'll give you arthritis"" threat is BS.",Crack Your Knuckles All You Damn Well Please,link,https://tonic.vice.com/en_us/article/kz39dw/knuckle-cracking-arthritis?utm_source=vicefbus,2017-11-27 20:00:52,1786,249,624,1583,115,8,79,0,1,0
167115176655082_1923200367713212,"According to police, the plan was to ""shoot and kill as many people as possible.""",Police Have Foiled a NYE Terror Plot In Australia,link,https://www.vice.com/en_au/article/43nkwj/police-have-foiled-an-nye-terror-plot-in-melbourne?utm_source=vicefbanz&utm_campaign=global,2017-11-27 19:30:14,488,59,53,365,5,78,2,29,8,1
167115176655082_1923166407716608,"Bourdain cooked for McGowan, Asia Argento and Annabella Sciorra.",Anthony Bourdain Cooked for Rose Mcgowan and Other Weinstein Accusers,link,https://i-d.vice.com/en_uk/article/vb39wd/anthony-bourdain-cooked-for-rose-mcgowan-harvey-weinstein-accusers?utm_campaign=global&utm_source=vicefbus,2017-11-27 19:01:27,7200,197,335,6134,1016,14,32,0,3,1
167115176655082_920143004812317,"White House Press Secretary Sarah Sanders defends the ""Pocahontas"" comment President Trump made at an event honoring Navajo code talkers.","White House Defends Trump's ""Pocahontas"" Comment",video,https://www.facebook.com/VICE/videos/920143004812317/,2017-11-27 18:30:00,18460,7937,15990,5074,294,977,2666,491,8957,1
167115176655082_1923100241056558,"Julia Poff allegedly made an explosive device using black powder, a salad dressing cap and a cigarette pack.",Cat Hair Leads FBI to Woman Who Allegedly Sent a Bomb to Obama,link,https://www.vice.com/en_us/article/ne38wg/cat-hair-leads-fbi-to-woman-who-allegedly-sent-a-bomb-to-obama-vgtrn?utm_source=vicefbus,2017-11-27 18:00:44,666,98,110,345,9,109,185,2,16,0
167115176655082_1923060291060553,"Almost five years ago, 26-year-old Emma Fillipoff vanished without a trace.","A Young Woman Was Last Seen by Police, Then Never Again",link,https://www.vice.com/en_ca/article/8x5wag/a-young-woman-was-last-seen-by-police-then-never-again?utm_source=vicefbca&utm_campaign=Global,2017-11-27 17:30:38,107,6,28,66,0,8,1,31,1,0
167115176655082_1923012907731958,Trump somehow managed to turn a short speech about gratitude into a racist joke.,"Yes, Trump Just Made a Pocahontas Joke to Navajo Code Talkers",link,https://www.vice.com/en_us/article/43nkdj/yes-trump-just-made-a-pocahontas-joke-to-navajo-code-talkers-vgtrn?utm_source=vicefbus,2017-11-27 16:45:08,3589,569,908,1011,31,200,364,168,1813,2
167115176655082_1667242349999064,"For those who just want tattoos to look like tattoos.

Inside a traditional New York tattoo parlor: https://vice.video/2k38All",The Unique Look of Smith Street Tattoos,video,https://www.facebook.com/VICE/videos/1667242349999064/,2017-11-27 16:30:01,1032,127,129,958,60,0,13,1,0,0
167115176655082_1922966707736578,What have you kept?,People Showed Us the Stuff from Their Exes They Couldn't Bear to Throw Away,link,https://www.vice.com/en_us/article/vb3xw9/people-showed-us-stuff-from-old-relationships-they-couldnt-throw-away?utm_source=vicefbus,2017-11-27 16:01:56,68,19,6,55,1,0,8,4,0,0
167115176655082_919998891493395,"1. Trump just called Elizabeth Warren ""Pocahontas"" at an event honoring Native American code talkers.

2. He did it in front of a portrait of Andrew Jackson, who kicked off the Trail of Tears with the Indian Removal Act.",Trump Makes 'Pocahontas' Joke at Event for Navajo Code Talkers,video,https://www.facebook.com/VICE/videos/919998891493395/,2017-11-27 15:27:16,13456,3335,8477,2396,147,1155,1433,579,7745,1
167115176655082_1922896067743642,You can't trust humans with anything.,‘Pokémon Go’ Players May Have Caused Billions in Damages,link,https://www.vice.com/en_ca/article/evbjgk/pokemon-go-players-may-have-caused-billions-in-damages-economists-say?utm_source=vicecanadafbca&utm_campaign=global,2017-11-27 15:03:17,267,70,38,175,6,5,79,0,2,0
167115176655082_1922843837748865,Creepy.,Private Memories Don't Exist in This New 'Black Mirror' Teaser,link,https://www.vice.com/en_us/article/xwaneq/private-memories-dont-exist-in-this-new-black-mirror-teaser-vgtrn?utm_source=vicefbus,2017-11-27 14:30:58,2990,726,260,2662,173,145,4,5,0,1
167115176655082_1922807521085830,"NBC is auctioning off hundreds of props from the set of ""Parks and Recreation""",You Can Buy Your Favorite Props from 'Parks and Rec' Right Now,link,https://www.vice.com/en_us/article/j5jw73/you-can-buy-your-favorite-props-from-parks-and-rec-right-now-vgtrn?utm_source=vicefbus,2017-11-27 14:01:05,10404,8374,3515,8446,1039,837,74,6,0,2
167115176655082_1922642487769000,,How-To,video,https://www.facebook.com/munchieshowto/videos/1848231078735174/,2017-11-27 13:30:00,993,147,2,854,100,1,35,0,3,0
167115176655082_1922746497758599,"“Basically, psychotherapy was created by men to treat women.""",Here's Why it's Still Really Hard to Get Men to Go to Therapy,link,https://tonic.vice.com/en_us/article/43nzag/men-dont-go-therapy-mental-health?utm_source=vicefbus,2017-11-27 13:02:57,386,77,106,330,5,16,29,3,3,0
167115176655082_1661610470562252,Meet the nearly 500 people—and puppets—who gather at the world's largest ventriloquist convention every year.,The World's Biggest Ventriloquist Convention,video,https://www.facebook.com/VICE/videos/1661610470562252/,2017-11-27 12:30:00,460,285,133,380,25,18,35,2,0,0
167115176655082_1922684011098181,They're not telling us anything.,Everyone Needs To Start Ignoring Trump's Tweet,link,https://www.vice.com/en_us/article/gyjavm/the-case-for-ignoring-trumps-tweets?utm_source=vicefbus,2017-11-27 12:04:09,616,161,62,536,32,2,43,0,2,1
167115176655082_1922650744434841,🐮💥🍑,What Being Gored by a Bull Taught Me About Healthcare,link,https://www.vice.com/en_us/article/mb3ybp/what-being-gored-by-a-bull-taught-me-about-healthcare?utm_source=vicefbus,2017-11-27 11:30:36,634,115,77,472,3,30,123,3,3,0
167115176655082_1922620381104544,👎👎,Gerard Butler Is a Terrible Actor,link,https://www.vice.com/en_us/article/8x5kkx/gerard-butler-is-a-terrible-actor?utm_source=vicefbus,2017-11-27 11:03:45,1621,459,44,1104,17,12,431,34,22,1
167115176655082_1922589944440921,"It's the only place you’ll find people from around the globe coming together to wave flags at someone thrusting to ""Pretty Fly For a White Guy"".",I Went to the Karaoke World Championships as Soon as I Found Out It Was a Thing,link,https://www.vice.com/en_uk/article/pa35nn/i-went-to-the-karaoke-world-championships-as-soon-as-i-found-out-it-was-a-thing?utm_source=vicefbuk&utm_campaign=global,2017-11-27 10:37:25,293,365,64,242,17,1,31,1,0,1
167115176655082_1922554964444419,Research shows the pursuit of happiness may be the road to misery.,Obsessing Over Finding Happiness May Just Lead to More Sadness,link,https://tonic.vice.com/en_us/article/bj7b9v/trying-to-be-happy?utm_source=vicefbus,2017-11-27 10:04:05,1371,90,360,1227,35,10,76,21,1,1
167115176655082_1922521301114452,"""It was a horrible experience. It was like, because he had a badge, it was okay—he could just do it.""",Police Are Allegedly Sleeping with Sex Workers Before Arresting Them,link,https://broadly.vice.com/en_us/article/59mbkx/police-are-allegedly-sleeping-with-sex-workers-before-arresting-them?utm_source=vicefbuk&utm_campaign=global,2017-11-27 09:33:30,1517,229,541,508,8,82,49,124,745,1
167115176655082_1922491894450726,"""I sometimes still find myself identifying as mixed-race, but it's a bad habit.""",Why Do We Still Call People 'Mixed-Race'?,link,https://www.vice.com/en_uk/article/av9abj/mixed-race-dual-heritage-young-brits-experience?utm_source=vicefbuk&utm_campaign=global,2017-11-27 09:04:50,1009,512,180,881,29,4,80,10,3,2
167115176655082_1922458581120724,"""It’s just as sketchy as smoking.""",Can You Be Straight Edge and Vape? An Investigation,link,https://noisey.vice.com/en_us/article/rjxjx4/is-vaping-straight-edge-or-nah?utm_source=vicefbuk&utm_campaign=global,2017-11-27 08:30:25,483,236,156,246,4,9,223,1,0,0
167115176655082_1922431097790139,Just asking for a friend.,How to Know When You're Masturbating Too Much,link,https://www.vice.com/en_uk/article/5gqz3d/how-much-masturbation-is-too-much-masturbation?utm_source=vicefbuk&utm_campaign=global,2017-11-27 08:02:18,482,427,130,290,9,3,174,4,2,0
167115176655082_1876586239322083,"Hey cheapskates, here's how to get into the cinema for free (and have a hot date at the same time). 

Welcome to our new series 'Life Hacks with Oobah Butler'.",How to Get into the Cinema for Free,video,https://www.facebook.com/VICE/videos/1876586239322083/,2017-11-27 07:31:38,4641,1000,553,3071,190,15,1357,5,3,0
167115176655082_1922377444462171,"""You took me back to yours, then you went back to the party. I was left lying in your bed listening to your roommates having sex.""",I Asked My Tinder Dates Why It Didn't Work Out Between Us,link,https://www.vice.com/en_uk/article/zmzwe9/i-asked-my-tinder-dates-why-it-didnt-work-out-between-us?utm_source=vicefbuk&utm_campaign=global,2017-11-27 07:01:17,107,17,6,75,5,0,26,0,0,1
167115176655082_1922355971130985,"""I once woke up caked in my own sick, naked in bed with a man I barely knew, with a large piece of pink chewing gum stuck between my arse cheeks.""","Sex, Snow and Cocaine: My Life As a Ski Resort 'Chalet Bitch'",link,https://www.vice.com/en_uk/article/znw34w/belle-de-neige-ski-underbelly?utm_source=vicefbuk&utm_campaign=global,2017-11-27 06:34:17,488,206,50,376,20,2,90,0,0,0
167115176655082_1876547825992591,"Meet the UK's No. 1 Royal Family super-fan. 

We sent Alhan Gençay to ask her about Prince Harry, Meghan Markle and her huge memorabilia collection.",Why Should I Care About The Royal Family?,video,https://www.facebook.com/VICE/videos/1876547825992591/,2017-11-27 06:00:00,1347,388,169,980,64,4,292,2,5,0
167115176655082_1922305527802696,THE TRUTH HAS BEEN STARING US RIGHT IN THE FACE.,The Tom Delonge Wikileaks Conspiracy Goes Deeper Than We Thought,link,https://noisey.vice.com/en_us/article/wje9w5/the-tom-delonge-wikileaks-conspiracy-goes-deeper-than-we-thought?utm_source=vicefbuk&utm_campaign=global,2017-11-27 05:33:08,163,45,69,132,7,4,20,0,0,0
167115176655082_1922280067805242,A hazy day out in Britain's cannabis capital.,This Area Smokes the Most Weed in the UK,link,https://www.vice.com/en_uk/article/9a4kq7/a-hazy-day-out-in-the-uks-weed-smoking-capital-weedweek2017?utm_source=vicefbuk&utm_campaign=global,2017-11-27 04:58:54,45,7,6,42,2,1,0,0,0,0
167115176655082_1922240124475903,"The ""effect"" can last anywhere between two and three years. Then things get bad. Really, really bad.",These Men Are Pumping Their Dicks Full of Coconut Oil and Regretting It Forever,link,https://www.vice.com/en_uk/article/yvx7wg/burmese-men-are-pumping-their-dicks-full-of-coconut-oil-and-regretting-it-forever?utm_source=vicefbuk&utm_campaign=global,2017-11-27 04:00:52,299,138,82,134,4,48,99,13,1,0
167115176655082_1922124164487499,"She was so deeply embedded, she even served as a bridesmaid in one woman's wedding.",The Ongoing Trauma of the Muslim Students an Undercover Cop Spied on For 4 Years,link,https://broadly.vice.com/en_us/article/bjgz4z/the-ongoing-trauma-of-the-muslim-students-an-undercover-cop-spied-on-for-4-years?utm_source=vicefbanz&utm_campaign=global,2017-11-27 01:00:17,577,32,156,315,2,84,15,37,124,0
167115176655082_1922103804489535,"Japan's baby hotels are expensive, unregulated, and staffed with unqualified workers—and they're perfectly legal.",Inside Japan's Dangerous 'Baby Hotels',link,https://broadly.vice.com/en_us/article/evgdea/inside-japans-dangerous-unregulated-baby-hotel-childcare-industry?utm_source=vicefbus,2017-11-27 00:30:05,209,25,52,105,1,37,2,54,10,0
167115176655082_1922083901158192,"'Given the current climate, I think we can all use a little more glitter, don’t you?'",Intimate Portraits of Boys Breaking the Binary,link,https://i-d.vice.com/en_us/article/evxzxw/tyler-udalls-radically-honest-photos-of-teen-boys?utm_source=vicefbanz&utm_campaign=global,2017-11-27 00:00:23,1032,229,78,766,155,5,91,6,8,1
167115176655082_1922063687826880,"""Your grandpa loved prostitutes; he used to come see me every weekend.""","My Grandma, the Sex Worker",link,https://broadly.vice.com/en_us/article/ypa97x/my-grandma-the-sex-worker?utm_source=vicefbus,2017-11-26 23:30:03,375,27,51,262,27,39,44,2,1,0
