status_id,status_message,link_name,status_type,status_link,status_published,num_reactions,num_comments,num_shares,num_likes,num_loves,num_wows,num_hahas,num_sads,num_angrys,num_special
167115176655082_1917560208277228,Turns out Pulp Fiction is still super popular amongst the youth!,Here’s What College Students Have On Their Dorm Walls,link,https://www.vice.com/en_ca/article/xwab33/heres-what-university-students-have-on-their-dorm-walls?utm_source=vicecanadafbca&utm_campaign=global,2017-11-23 13:06:16,62,8,3,60,1,1,0,0,0,0
167115176655082_1917515491615033,That idealized notion that it was a moment for Native Americans and European settlers to break bread together is a lie.,Thanksgiving is Just as Offensive as Columbus Day,link,https://impact.vice.com/en_us/article/j5jpx3/for-native-americans-fall-can-be-a-painful-reminder-of-the-past-and-struggles-of-today?utm_source=vicefbus,2017-11-23 12:30:31,4618,542,1289,4024,189,37,291,51,26,0
167115176655082_1917480121618570,"""You see both the light and dark sides of humanity as chaos sets in.""",Working at Cracker Barrel on Thanksgiving Is Pure Insanity,link,https://munchies.vice.com/en_us/article/xymybn/working-at-cracker-barrel-on-thanksgiving-is-pure-insanity?utm_source=vicefbus,2017-11-23 12:15:24,563,177,161,442,4,18,90,7,2,0
167115176655082_1917464494953466,😡⚡⚡⚡,"Man Screams 'I'm a Legend' in a Train Station, Gets Tasered",link,https://www.vice.com/en_uk/article/59yx8b/man-screams-im-a-legend-in-a-train-station-gets-tasered?utm_source=vicefbuk&utm_campaign=global,2017-11-23 12:06:15,2759,455,245,1657,64,26,996,7,9,0
167115176655082_1917418221624760,Choose life.,"If You’re Online Right Now, Log Off",link,https://www.vice.com/en_us/article/9kqpbv/log-off?utm_source=vicefbus,2017-11-23 11:31:14,371,74,64,301,19,1,44,4,2,0
167115176655082_1917335541633028,The sex toys and weed tools our exes gave us that we can't bear to throw away.,People Showed Us the Things They Kept from Old Relationships,link,https://www.vice.com/en_uk/article/vb3xw9/people-showed-us-stuff-from-old-relationships-they-couldnt-throw-away?utm_source=vicefbuk&utm_campaign=global,2017-11-23 10:31:02,61,8,4,54,5,0,2,0,0,0
167115176655082_1917298411636741,Keep your wits about you today.,How to Tell if Your Alt-Right Relative Is Trying to Redpill You at Thanksgiving,link,https://www.vice.com/en_us/article/nnk3bm/how-to-tell-if-your-alt-right-relative-is-trying-to-redpill-you-at-thanksgiving?utm_source=vicefbus,2017-11-23 10:02:39,1122,337,157,659,6,20,428,3,6,0
167115176655082_1874678616179512,"Meet David Icke, the world’s most controversial conspiracy theorist, who believes that 12 foot lizards secretly rule the planet.",Inside the Lizard Illuminati Conspiracy,video,https://www.facebook.com/VICE/videos/1874678616179512/,2017-11-23 09:34:38,6736,3772,1726,4933,249,144,1380,25,5,0
167115176655082_1917236964976219,"""I felt really different to everybody else, but in my head I knew I was the same. The teachers made me feel so different, like I was an alien.""",The UK's 'Last Acceptable Form of Racism' Isn't Going Away,link,https://www.vice.com/en_uk/article/a37byb/the-uks-last-acceptable-form-of-racism-isnt-going-away?utm_source=vicefbuk&utm_campaign=global,2017-11-23 09:06:52,351,80,48,194,1,6,7,99,44,0
167115176655082_1917197614980154,"""I've had discrimination or harassment on almost everything I've ever worked on in some way.""","Natalie Portman Could Share ""100 Stories"" of Sexual Harassment",link,https://i-d.vice.com/en_au/article/zmzdgj/natalie-portman-could-share-100-stories-of-sexual-harassment-in-hollywood?utm_source=vicefbuk&utm_campaign=global,2017-11-23 08:30:22,2453,159,177,1827,23,45,25,396,137,0
167115176655082_1917170444982871,Everything you ever wanted to know about pills (but were too afraid to ask).,This Ecstasy Review Site is a Hotbed of Perfect Pinger-Related Prose,link,https://www.vice.com/en_uk/article/59yxqb/this-ecstasy-review-site-is-a-hotbed-of-perfect-pinger-related-prose?utm_source=vicefbuk&utm_campaign=global,2017-11-23 08:04:36,62,16,24,56,0,0,5,1,0,0
167115176655082_1917135688319680,"""She looks at me and says, “Is it okay if I kiss your boyfriend now?” My gut is twisting, and I can’t really look, but I also have to look.""",I Had a Threesome with My Boyfriend and the Girl He Was Cheating on Me with,link,https://broadly.vice.com/en_us/article/ywb8gb/my-first-time-podcast-threesomes-boyfriend-cheating?utm_source=vicefbuk&utm_campaign=global,2017-11-23 07:31:09,1809,394,262,1136,33,196,278,128,38,0
167115176655082_1917104494989466,"""I hate it when people call me a hooker. It's belittling.""",The World's Best Male Escort Is More Than His Ten-Inch Penis,link,https://www.vice.com/en_uk/article/qbxkp3/the-worlds-best-male-escort-is-more-than-his-10-inch-penis-100?utm_source=vicefbuk&utm_campaign=global,2017-11-23 07:07:02,1232,344,93,837,34,57,301,1,2,0
167115176655082_1874254766221897,"What happens if you take ketamine, ecstasy, cocaine, acid or NOS at the same time?",Everything You Need to Know About Combining Different Drugs,video,https://www.facebook.com/VICE/videos/1874254766221897/,2017-11-23 06:30:00,1465,287,341,1272,49,24,115,3,2,0
167115176655082_1917055661661016,"I met angry drunks, happy drunks and a vegan wearing fur.",I Spent a Day Actually Speaking to People On Public Transport,link,https://www.vice.com/en_uk/article/evbkde/i-spent-a-day-actually-speaking-to-people-on-public-transport?utm_source=vicefbuk&utm_campaign=global,2017-11-23 06:02:01,164,36,10,127,9,4,24,0,0,0
167115176655082_1874582966189077,"There's more to making a sandwich than just putting stuff between two slices of bread. 

Chef Max Halley heads to the coast of North East England in search of inspiration for a new fish sandwich.",The Sandwich Show: Max’s Fish Sarnie,video,https://www.facebook.com/VICE/videos/1874582966189077/,2017-11-23 05:36:00,391,70,25,354,10,2,25,0,0,0
167115176655082_1917007608332488,"""Oh shit, I've been brainwashed my whole life. I hadn't really thought about this stuff before.""",I Went to a Feminism Class for Private School Boys,link,https://www.vice.com/en_uk/article/mvk7x3/i-went-to-a-feminism-class-for-private-school-boys?utm_source=vicefbuk&utm_campaign=global,2017-11-23 05:04:08,1217,103,167,1058,101,8,45,3,2,0
167115176655082_1916964895003426,"""People offer me drugs – ketamine. I mean, I don't do drugs anyway, but who does ketamine when they're driving?""",A Taxi Driver Took These Amazing Photos of People In His Cab,link,https://www.vice.com/en_uk/article/5gkez5/mike-harvey-south-wales-taxi-photos-101?utm_source=vicefbuk&utm_campaign=global,2017-11-23 04:00:21,181,7,12,166,7,0,8,0,0,0
167115176655082_1916947065005209,RIP,Lil Peep's Videographer Made Him a Beautiful Tribute Video,link,https://noisey.vice.com/en_us/article/d3dmpw/lil-peeps-videographer-made-him-a-beautiful-tribute-video?utm_source=vicefbus,2017-11-23 03:30:15,1674,379,211,1291,224,3,95,59,2,0
167115176655082_1916925478340701,"""They are showoffs.""",Actual Old School Barbers Think the 'Ye Olde' Barber Trend Is Lame,link,https://www.vice.com/en_au/article/ywb9d5/actual-old-school-barbers-think-the-ye-olde-barber-trend-is-lame?utm_source=vicefbanz&utm_campaign=global,2017-11-23 03:00:54,621,37,45,557,22,1,40,1,0,0
167115176655082_1916880051678577,"""That's the most saccharine American shit I've ever heard in my life.​""",An Englishman Explains Thanksgiving to Americans,link,https://www.vice.com/en_us/article/avyam4/an-englishman-explains-thanksgiving-to-americans?utm_source=vicefbus,2017-11-23 02:01:01,266,47,29,164,13,1,85,1,2,0
167115176655082_1916855315014384,"Mothers say they were drugged, lied to, and physically assaulted while they were in labour.",Stolen at Birth: The Painful Legacy of Australia's Forced Adoption Policy,link,https://broadly.vice.com/en_us/article/evgxx7/stolen-at-birth-the-painful-legacy-of-australias-forced-adoption-policy?utm_source=vicefbus,2017-11-23 01:30:07,378,20,102,149,1,33,3,100,92,0
167115176655082_1916836805016235,Seeing women walking men like dogs on leashes in their underwear became a normal part of the day.,The Women of an Infamous Japanese S&M Love Hotel,link,https://www.vice.com/en_au/article/9bzzbe/nathalie-daoust-photographs-the-nsfw-women-of-japans-infamous-sm-love-hotel-111?utm_source=vicefbanz&utm_campaign=global,2017-11-23 01:00:18,195,18,21,170,14,6,5,0,0,0
167115176655082_1916809528352296,Dressed to kill. Literally.,"The Long, Strange History of Women Wearing Deadly Clothing",link,https://broadly.vice.com/en_us/article/ywmvpy/the-long-strange-history-of-women-wearing-deadly-clothing?utm_source=vicefbus,2017-11-23 00:30:01,101,14,15,87,1,7,1,4,1,0
167115176655082_1916787528354496,💪🍆,I Tried a Four-Week Workout Regimen to Strengthen My Dick,link,https://www.vice.com/en_au/article/yvxz45/i-tried-a-four-week-workout-regimen-to-strengthen-my-dick-507?utm_source=vicefbanz&utm_campaign=global,2017-11-23 00:00:14,403,126,48,241,1,18,141,2,0,0
167115176655082_1916765588356690,Evolution has programmed us to die—and that reprogramming isn’t off the table.,Humans Could Live Ten Times Longer,link,https://motherboard.vice.com/en_us/article/3dkw9b/the-math-that-shows-humans-could-live-ten-times-longer?utm_source=vicefbus,2017-11-22 23:30:08,655,127,209,567,31,47,6,1,3,0
167115176655082_1916742078359041,"53% of people are still embarrassed by dating apps, even though the exact same number have used them.",Turns Out You’re Not the Only One Hiding Tinder in a Folder,link,https://www.vice.com/en_au/article/8x5y5p/turns-out-youre-not-the-only-one-hiding-tinder-in-a-folder?utm_source=vicefbanz&utm_campaign=global,2017-11-22 23:00:25,59,19,5,43,1,1,14,0,0,0
167115176655082_1916716398361609,"“We need to continue to defend net neutrality.""",Justin Trudeau Is ‘Very Concerned’ With FCC’s Plan to Roll Back Net Neutrality,link,https://motherboard.vice.com/en_us/article/ywb83y/justin-trudeau-is-very-concerned-with-fcc-plan-to-roll-back-net-neutrality-donald-trump?utm_source=vicefbus,2017-11-22 22:30:01,3027,110,373,2814,165,8,27,5,7,1
167115176655082_1660166040706695,"Save yourself a couple hours in the kitchen this Thanksgiving by spatchcocking your turkey. 

(via Munchies)",The Perfect Turkey in Under an Hour,video,https://www.facebook.com/VICE/videos/1660166040706695/,2017-11-22 16:00:02,2405,1095,913,2077,107,75,34,94,18,0
167115176655082_1595829673811788,"Welcome to the biggest lesbian party on Earth.

Watch more here: http://bit.ly/2AYJya6",The Biggest Lesbian Party In The World,video,https://www.facebook.com/VICE/videos/1595829673811788/,2017-11-21 10:02:52,5889,3035,1151,4464,938,104,360,6,15,2
167115176655082_915754071917877,Pundits love saying Trump's gaffes and policy disasters are really part of an elaborate game of 3D chess. We talked to 3D chess experts to find out if that's true.,Trump's Game of 3D Chess,video,https://www.facebook.com/VICE/videos/915754071917877/,2017-11-20 19:30:01,971,110,185,707,42,2,215,1,4,0
167115176655082_1659208454135787,"This art installation captures what nuclear war would feel like.

Go behind the scenes of its premiere at Tribeca Film Festival: https://vice.video/2hOQcMv",What Nuclear War Would Feel Like,video,https://www.facebook.com/VICE/videos/1659208454135787/,2017-11-20 17:00:00,889,75,189,816,29,29,7,7,0,1
167115176655082_1659097677480198,"""Your city has to rock with you before anybody else will rock with you.""

6IX RISING, Noisey's new doc on Toronto rap, is here.

Watch it now: http://bit.ly/2B86C79",Noisey Presents: 6IX RISING,video,https://www.facebook.com/VICE/videos/1659097677480198/,2017-11-20 15:30:01,160,7,10,151,5,1,3,0,0,0
167115176655082_1658874420835857,"Visit InGalera, a critically acclaimed restaurant staffed by convicted felons.

(via Munchies)",These Prisoners Became Italian Chefs,video,https://www.facebook.com/VICE/videos/1658874420835857/,2017-11-20 12:30:00,5955,403,1389,5197,586,168,4,0,0,0
167115176655082_1655731277816838,These European artists want to introduce the animal world to performance art.,Meet the European Artists Performing for Pets,video,https://www.facebook.com/VICE/videos/1655731277816838/,2017-11-19 21:00:00,5618,8284,4007,3032,381,141,1979,57,29,-1
167115176655082_1655743577815608,"""If you try to eat big pieces, it can get caught in your throat. And that's when you have an accident and die."" 

(via Munchies)",How to Eat Live Octopus,video,https://www.facebook.com/VICE/videos/1655743577815608/,2017-11-19 18:30:00,8927,4008,1664,3418,235,567,101,1198,3409,-1
167115176655082_1655646797825286,"Welcome to the longest (and drunkest) speedboat race on Earth.

Watch the full doc here: https://vice.video/2jygBON",Speedboat Racing with Venezuela's Wealthiest Sailors,video,https://www.facebook.com/VICE/videos/1655646797825286/,2017-11-19 12:30:00,1631,731,780,1452,37,46,89,1,6,0
167115176655082_1909462375753678,"“What’s the weirdest thing a client has requested?”

We asked a feminist sex worker the questions you always wanted to know the answers to.",10 Questions You Always Wanted To Ask A Feminist Sex Worker,video,https://www.facebook.com/VICE/videos/1909462375753678/,2017-11-19 11:00:00,6125,891,1537,5116,518,82,372,19,17,1
167115176655082_1655313204525312,"Lana Rain is a cosplay cam girl with a huge anime fanbase.

But how sexy is too sexy for cosplay? http://bit.ly/2AV5iV3",Cosplay Cam Girl,video,https://www.facebook.com/VICE/videos/1655313204525312/,2017-11-18 19:30:02,1750,204,499,1459,194,20,66,7,4,0
167115176655082_913526022140682,"Exiled Chinese billionaire Guo Wengui uses YouTube to wage a war on government corruption from his Manhattan apartment.

(via HBO)",Exiled Chinese Billionaire Uses YouTube to Fight Corruption,video,https://www.facebook.com/VICE/videos/913526022140682/,2017-11-18 15:30:00,4108,288,928,3705,121,228,49,0,5,0
167115176655082_1655719907817975,"Roll a big, fat sushi blunt with VICELAND

More from the high-end world of weed here: http://bit.ly/2APWTSh",How to Roll a Sushi Blunt,video,https://www.facebook.com/VICE/videos/1655719907817975/,2017-11-18 11:30:01,5073,2359,1180,3942,503,162,451,10,4,1
167115176655082_1654954057859511,"In the fourth episode of GRIMENET, the artists discuss dick dunking, post-sex conversations, and doing your make-up in public.","In the fourth episode of GRIMENET, the artists discuss dick du...",video,https://www.facebook.com/VICE/videos/1654954057859511/,2017-11-18 06:30:00,300,20,12,258,5,0,37,0,0,0
167115176655082_914195518740399,"We visited an Alaskan village being killed by climate change. In just four days there, we saw the loss of 10 feet of land. (via HBO)",Climate Change Is Making This Alaskan Town Disappear: VNT,video,https://www.facebook.com/VICE/videos/914195518740399/,2017-11-17 18:30:01,1421,93,663,718,4,201,7,450,41,0
167115176655082_914088318751119,Protect Ferdinand the rare white Moose at all costs.,A Rare White Moose Narrowly Avoided Death,video,https://www.facebook.com/VICE/videos/914088318751119/,2017-11-17 17:00:01,6566,861,659,5632,682,88,8,143,12,1
167115176655082_1871734753140565,This is what it's like to tattoo a huge ice cream cone onto Gucci Mane's face.,Meet the Guy Who Did Gucci Mane's Ice Cream Face Tattoo,video,https://www.facebook.com/VICE/videos/1871734753140565/,2017-11-17 08:30:00,2726,413,515,2385,95,8,236,1,1,0
167115176655082_1732957396724816,"""Nobody gives a fuck about what you say, your fucking article means nothing, you fucking victim, so fuck off.""

Here's what happened when we spoke to the alleged owner of a shady weed dispensary. 

Read more: http://bit.ly/2jvuZY7",Phone Call With Alleged Shady Dispensary Owner,video,https://www.facebook.com/VICE/videos/1732957396724816/,2017-11-16 16:00:01,2266,789,215,1278,48,248,644,10,38,0
167115176655082_1871286316518742,"Over 200,000 Syrians remain in the Assad government's notorious prison system where inmates face a regime of torture and secret executions. 

We met members of Families for Freedom, a campaign by Syrian women fighting to raise awareness for those still detained.",Fighting for Syria's Disappeared,video,https://www.facebook.com/VICE/videos/1871286316518742/,2017-11-16 09:10:13,530,68,687,292,13,7,5,175,38,0
167115176655082_721819271350011,"As the refugee blockade on Papua New Guinea’s Manus Island stretches into its second week, a leader speaks out in a VICE exclusive: http://bit.ly/2jti7BL",Message From Manus,video,https://www.facebook.com/VICE/videos/721819271350011/,2017-11-16 03:00:00,220,39,46,133,2,6,2,49,28,0
167115176655082_1653255021397797,How fruits and veggies make video games sound extra gory.,Using Food to Create Gross Sound Effects,video,https://www.facebook.com/VICE/videos/1653255021397797/,2017-11-15 18:30:00,3043,544,463,2725,167,34,117,0,0,0
167115176655082_721322988066306,"With Australia voting in favour of marriage equality today, Prime Minister Malcolm Turnbull has promised to bring the same-sex marriage bill to a vote in Parliament by Christmas.

More here: http://bit.ly/2AGKL5N",Yes to Marriage Equality,video,https://www.facebook.com/VICE/videos/721322988066306/,2017-11-15 01:00:00,3030,76,177,2326,684,3,9,3,5,0
167115176655082_526504257714830,Wearing gold? Sure. Eating gold? Absolutely.,MOST EXPENSIVEST: Golden Donut,video,https://www.facebook.com/VICE/videos/526504257714830/,2017-11-14 20:00:00,2254,783,543,1813,79,44,272,13,33,0
167115176655082_911963038963647,Why it's so damn hard to take your eyes and ears off Trump: http://bit.ly/2hsZfyA,Public speaking tips from Donald Trump,video,https://www.facebook.com/VICE/videos/911963038963647/,2017-11-14 19:30:00,2753,398,857,2318,83,46,241,28,36,1
167115176655082_525996451098944,Big things on big wings with 2 Chainz and Action Bronson.,"$4,900 Luxury Chicken Wings",video,https://www.facebook.com/VICE/videos/525996451098944/,2017-11-13 20:30:00,11336,5962,3992,8925,295,558,1438,35,85,0
167115176655082_1650831021640197,"Inside the secret, psychic world of Indigo Children.",This Teen Believes She Has Special Powers,video,https://www.facebook.com/VICE/videos/1650831021640197/,2017-11-13 15:00:00,1917,797,282,1204,114,47,515,25,12,0
167115176655082_1869807093333331,"Enter the superhuman world of empaths - gifted people who can feel the emotional, mental, or physical state of those around them.",Are You An Empath?,video,https://www.facebook.com/VICE/videos/1869807093333331/,2017-11-13 08:00:10,4933,1332,867,3823,440,27,622,13,8,0
167115176655082_1577255529016938,Natasha Lyonne and the Orange Is the New Black share their crazy strip club story.,That Time Natasha Lyonne Went to a Strip Club,video,https://www.facebook.com/VICE/videos/1577255529016938/,2017-11-12 19:00:00,3530,247,322,2755,332,3,439,1,0,0
167115176655082_1648512958538670,How to make your bed like a real adult.,How to Make Your Bed Like a Real Adult,video,https://www.facebook.com/VICE/videos/1648512958538670/,2017-11-12 15:30:00,3008,1313,607,2489,205,15,288,6,5,0
167115176655082_523350794696843,Action Bronson explains his 13 steps to rolling a successful blunt.,How to Roll a Blunt with Action Bronson,video,https://www.facebook.com/VICE/videos/523350794696843/,2017-11-12 13:30:00,4790,1215,797,3552,278,9,923,22,6,0
167115176655082_1648529695203663,"""It frustrates you beyond anything that you can imagine.""

What it's like to experience the nightmare world of gang stalking: https://vice.video/2i5X8RY",This Man Explains the Terrifying World of Gang Stalking,video,https://www.facebook.com/VICE/videos/1648529695203663/,2017-11-12 12:30:00,764,421,152,370,10,38,126,204,16,0
167115176655082_522881101410479,A racist explains why he isn't a racist.,A Racist Explains Why He Isn't a Racist,video,https://www.facebook.com/VICE/videos/522881101410479/,2017-11-12 12:00:00,10885,2443,5809,5982,83,527,2624,252,1417,0
167115176655082_1647384285318204,"A former pot hauler on how he smuggled millions of pounds of weed.

More on Florida's drug network: https://vice.video/2hrkNiF",Smuggling Weed in the Florida Everglades,video,https://www.facebook.com/VICE/videos/1647384285318204/,2017-11-12 10:00:01,13191,956,5259,11802,546,706,121,9,7,0
167115176655082_1647384941984805,"The way we talk about suicide could be a matter of life and death.

(via Tonic)",We Need to Get Comfortable Talking About Suicide,video,https://www.facebook.com/VICE/videos/1647384941984805/,2017-11-11 18:30:00,1358,30,571,1197,97,2,1,59,2,0
167115176655082_1648497321873567,"Danica Roem made history as the first openly transgender person to be elected to a state house—unseating an anti-trans Republican and inspiring people across the US.

Inside her historic victory on Broadly: https://vice.video/2i7gwyh",Inside Danica Roem's Historic Victory,video,https://www.facebook.com/VICE/videos/1648497321873567/,2017-11-11 15:30:01,22014,696,4472,15646,6186,57,106,3,14,2
167115176655082_1647351241988175,This all-women car crew found a way out of misogyny.,Meet an All-Women Car Crew,video,https://www.facebook.com/VICE/videos/1647351241988175/,2017-11-10 15:13:07,1068,150,114,909,131,2,25,1,0,0
167115176655082_1647789625242621,"In the third episode of GRIMENET, the artists discuss names, what the world will be like in 100 years, and making pirate noises during sex.",GRIMENET: Episode 3,video,https://www.facebook.com/VICE/videos/1647789625242621/,2017-11-10 05:32:18,203,29,16,179,4,0,20,0,0,0
167115176655082_523856044646318,"Weed-infused matzo ball soup to keep you warm.

(via VICELAND)",How to Make Weed-Infused Matzo Ball Soup,video,https://www.facebook.com/VICE/videos/523856044646318/,2017-11-09 21:30:01,3949,3196,1758,3160,402,64,315,1,6,1
167115176655082_1646055122117787,White Castle now has its own designer collection.,White Castle's New Uniforms Are High Fashion,video,https://www.facebook.com/VICE/videos/1646055122117787/,2017-11-09 18:30:00,996,259,138,839,85,9,61,1,1,0
167115176655082_1645896168800349,What ever happened to Darwin the IKEA monkey?,What Happened to the IKEA Monkey?,video,https://www.facebook.com/VICE/videos/1645896168800349/,2017-11-09 15:30:01,3070,1194,551,1961,117,37,14,921,20,0
167115176655082_1726005630753326,"Holly Wolf is one of the first Playboy models to cosplay professionally.

Watch more: http://bit.ly/2yKptaV",From Playboy To Cosplay,video,https://www.facebook.com/VICE/videos/1726005630753326/,2017-11-09 14:00:05,4383,363,1286,3725,494,48,103,4,8,1
167115176655082_1867916470189060,A 93-year-old jazz pianist suffering from dementia and depression was given a new lease of life when his care home discovered his talent.,Reunited: A Short Film about Music and the Human Spirit,video,https://www.facebook.com/VICE/videos/1867916470189060/,2017-11-09 07:27:29,54899,4601,95152,35049,18991,738,24,91,4,2
167115176655082_1645079198882046,"Dominatrix Mistress Couple is here to punish ashamed Trump voters.

See what's inside her BDSM dungeon: http://bit.ly/2rAaKuX",Inside the BDSM Dungeon of a Hillary Dom,video,https://www.facebook.com/VICE/videos/1645079198882046/,2017-11-08 21:30:00,4754,2370,1760,2322,414,72,1928,6,12,0
167115176655082_1645095522213747,"Danica Roem just made history for trans people.

Read about the historic win on Broadly: https://vice.video/2jaDRCp",Meet Virginia's First Openly Transgender Elected Official,video,https://www.facebook.com/VICE/videos/1645095522213747/,2017-11-08 17:30:28,5189,169,613,3916,1210,14,35,2,13,-1
167115176655082_522880624743860,"""I think there should be another genocide.""",Face-to-Face with American Neo-Nazis,video,https://www.facebook.com/VICE/videos/522880624743860/,2017-11-08 13:00:00,5547,2495,2870,1617,38,893,299,383,2316,1
167115176655082_907490936077524,Trump was elected president one year ago today. But it feels more like...,All of Trump's Billions,video,https://www.facebook.com/VICE/videos/907490936077524/,2017-11-08 10:00:00,9327,2973,3121,4733,136,54,3817,460,127,0
167115176655082_1867450186902355,Meet the border force officers who check your mail for drugs.,Trying to Stop Ecstasy Coming to the UK,video,https://www.facebook.com/VICE/videos/1867450186902355/,2017-11-08 08:29:58,1379,249,189,1188,17,39,115,8,11,1
167115176655082_2035345886699145,Toronto Raptors president Masai Ujiri tells us what it means to be the first African-born executive in North American sports.,Masai Ujiri Talks Basketball Development in Africa,video,https://www.facebook.com/VICE/videos/2035345886699145/,2017-11-07 23:30:00,1023,35,183,941,75,6,1,0,0,0
167115176655082_907405936086024,"Trump's reactions to the NYC attack, which killed 8, and the Texas mass shooting, which killed 26, were pretty different. Read more on Trump's culture war here: http://bit.ly/2yfffv3",How Trump Reacted to Recent Attacks,video,https://www.facebook.com/VICE/videos/907405936086024/,2017-11-07 16:30:00,3420,406,1071,1972,21,91,255,97,985,-1
167115176655082_906040676222550,"The viral mastermind behind the Harlem Shake, Filthy Frank, wrote an album about heartbreak.

(via HBO)",Viral Star Filthy Frank Releases An Album On Heartbreak,video,https://www.facebook.com/VICE/videos/906040676222550/,2017-11-05 21:30:00,10818,1747,6944,7879,2280,67,525,56,9,2
167115176655082_905024839657467,"Kekistan isn't a real country, but it's become an online haven for alt-right trolls.",Big Man Tyrone: The President of Kekistan,video,https://www.facebook.com/VICE/videos/905024839657467/,2017-11-05 13:00:00,2325,698,407,1713,124,18,450,4,15,1
167115176655082_1639201022803197,"How Antifa fights the alt-right.

Watch the full doc on America's hard left here: https://vice.video/2xYmurb",Meet an Antifa Member Fighting Nazis,video,https://www.facebook.com/VICE/videos/1639201022803197/,2017-11-05 11:00:00,13290,5180,10506,8243,1498,146,2939,42,422,0
