status_id,status_message,link_name,status_type,status_link,status_published,num_reactions,num_comments,num_shares,num_likes,num_loves,num_wows,num_hahas,num_sads,num_angrys,num_special
167115176655082_1932228613477054,"""Have I ever shopped for porn and looked up 'black' or 'Latino'? Yes, I have. But it's such a muddy gray area.""",The Gay Porn Industry Is Still Super Racist,link,https://www.vice.com/en_us/article/434y4j/the-gay-porn-industry-is-still-super-racist?utm_source=vicefbus,2017-12-03 16:30:01,32,18,3,23,0,2,5,0,2,0
167115176655082_1932195883480327,We have two weeks to save the internet.,How America Rolling Back Net Neutrality Will Affect the Rest of the World,link,https://www.vice.com/en_ca/article/a375pb/how-america-rolling-back-net-neutrality-will-affect-the-rest-of-the-world?utm_source=vicefbca&utm_campaign=Global,2017-12-03 16:01:10,287,12,119,255,13,1,6,3,9,0
167115176655082_1932110433488872,*mic drop*,‘Alien: Resurrection’ Is The Best 'Alien' Movie,link,https://www.vice.com/en_ca/article/pa377y/alien-resurrection-is-a-franchise-high-pointfight-me?utm_source=vicefbca&utm_campaign=Global,2017-12-03 15:00:28,404,236,32,263,27,15,78,0,21,0
167115176655082_1672506632805969,"""It's crazy [Floyd Mayweather's] working out to my record.""

This is how you turn a USB stick into a huge endorsement.

Full Noisey doc: http://bit.ly/2AdRBmE",When Your Music Reaches Floyd Mayweather,video,https://www.facebook.com/VICE/videos/1672506632805969/,2017-12-03 15:00:00,395,23,21,360,27,8,0,0,0,0
167115176655082_303206120180158,"Could you afford to live in San Francisco? Or is the city too expensive?

Via VICE Money",Making It: The Cost of Living In San Francisco,video,https://www.facebook.com/VICE/videos/303206120180158/,2017-12-03 14:30:00,1187,340,271,870,11,193,12,94,7,0
167115176655082_1932015900164992,"Cheese. Cheese. Cheese. It's all cheese, stacked. No meat. Just cheese.",This 'Cheeseburger' Is Made Entirely of 9 Different Cheeses,link,https://munchies.vice.com/en_us/article/595mw8/this-cheeseburger-is-made-entirely-of-9-different-cheeses?utm_source=vicefbus,2017-12-03 14:00:56,3076,3095,545,2363,403,187,76,28,19,0
167115176655082_1931969923502923,"Carys Cragg was 11 when a stranger killed her dad.

20 years on, she yearned for understanding.",Why I Reached Out to My Father’s Murderer,link,https://www.vice.com/en_ca/article/ywnzn7/why-i-reached-out-to-my-fathers-murderer?utm_source=vicefbca&utm_campaign=Global,2017-12-03 13:30:20,24,1,8,21,0,1,0,2,0,0
167115176655082_1931936093506306,This is the final print interview Sturgill Simpson will ever do.,"The Final Interview with Sturgill Simpson, According to Sturgill Simpson",link,https://noisey.vice.com/en_us/article/mb9jjq/the-final-interview-with-sturgill-simpson-according-to-sturgill-simpson?utm_source=vicefbus,2017-12-03 13:00:15,115,14,21,107,5,0,3,0,0,0
167115176655082_1672245026165463,"And maybe your penis, too.",This Fish Will Destroy Your Butthole,video,https://www.facebook.com/VICE/videos/1672245026165463/,2017-12-03 12:30:01,1277,474,281,975,7,191,89,8,8,-1
167115176655082_1931875083512407,"ok ok ok ok ok, read it before you comment.","Actually, Adam Sandler Is a Genius",link,https://www.vice.com/en_us/article/vbzg53/actually-adam-sandler-is-a-genius?utm_source=vicefbus,2017-12-03 12:03:27,213,81,16,177,9,1,25,0,1,0
167115176655082_1931837003516215,When liberals laugh first and ask questions later.,Let's Take a Look at Some Anti-Trump Fake News,link,https://www.vice.com/en_us/article/j5dxwy/lets-take-a-look-at-some-anti-trump-fake-news?utm_source=vicefbus,2017-12-03 11:30:35,289,69,46,203,2,3,77,4,0,0
167115176655082_1931783506854898,"Withdrawal is not a psychological longing, it is a physical demand.",Quitting Opioids Cold Turkey Made Me Want to Die,link,https://tonic.vice.com/en_us/article/xwan5n/quitting-opioids-cold-turkey-made-me-want-to-die?utm_source=vicefbus,2017-12-03 11:01:54,338,136,87,269,6,1,22,38,2,0
167115176655082_1931747460191836,"Pay attention, dudes.",How to Get with Girls on Tinder: A Guide By Girls for Boys,link,https://www.vice.com/en_uk/article/bnjkd5/the-vice-guide-to-tinder-for-men-by-a-woman?utm_source=vicefbuk&utm_campaign=global,2017-12-03 10:30:01,72,48,15,54,1,1,15,1,0,0
167115176655082_1931710920195490,Men are waking up to the benefits of prostate massage.,Butt Play Could Keep the Doctor Away,link,https://www.vice.com/en_us/article/vbzg38/butt-play-could-keep-the-doctor-away?utm_source=vicefbus,2017-12-03 10:00:52,137,78,37,76,6,6,48,0,1,0
167115176655082_1931671220199460,"""It creates a different anxiety, an anxiety that isn't about me.""",Why Some Anxious People Find Comfort in Horror Movies,link,https://broadly.vice.com/en_us/article/a3wdzk/why-some-anxious-people-find-comfort-in-horror-movies?utm_source=vicefbuk&utm_campaign=global,2017-12-03 09:30:13,464,59,102,431,29,1,3,0,0,0
167115176655082_1931608140205768,"""Meat-eating and eating food is a way to reconnect, and eating meat that you've sourced is the ultimate experience.""",Meet the 'Ethical Carnivore' Who Only Eats Animals That She Kills Herself,link,https://munchies.vice.com/en_us/article/4x5nd3/meet-the-ethical-carnivore-who-spent-a-year-only-eating-animals-she-killed-herself?utm_source=vicefbuk&utm_campaign=global,2017-12-03 08:30:05,1306,192,103,1133,92,12,50,6,13,0
167115176655082_1931579733541942,They won't suspect a thing.,Life Hack! Here's How to Get Into the Cinema for Free,link,https://www.vice.com/en_uk/article/zmzj88/watch-life-hacks-with-oobah-how-to-get-into-the-cinema-for-free?utm_source=vicefbuk&utm_campaign=global,2017-12-03 08:00:42,48,9,2,35,1,0,12,0,0,0
167115176655082_1931544136878835,What if the drop never comes?,This Video of Confused Clubbers Waiting for the Drop is Amazing,link,https://www.vice.com/en_uk/article/7xk7qe/this-video-of-confused-clubbers-is-an-ode-to-the-beautiful-disappointment-of-life?utm_source=vicefbuk&utm_campaign=global,2017-12-03 07:30:19,393,62,29,274,17,0,102,0,0,0
167115176655082_1931516730214909,"""When microdosing I feel like a fucking wizard. I literally do exactly what I need to do and there is no problem with doing it.""",Meet the Banker Who Microdosed His Way to the Top on LSD and Mushrooms,link,https://www.vice.com/en_uk/article/5g9a4q/we-interviewed-a-corporate-banker-who-won-the-national-sales-award-while-microdosing-mushrooms?utm_source=vicefbuk&utm_campaign=global,2017-12-03 07:00:11,1393,85,210,1250,64,18,59,1,1,0
167115176655082_1931491373550778,Sorry.,Unicorns Were Real and Ugly as Hell,link,https://broadly.vice.com/en_us/article/9aexzd/unicorns-were-real-and-ugly-as-hell?utm_campaign=global&utm_source=vicefbuk,2017-12-03 06:30:11,265,53,98,185,6,15,57,2,0,0
167115176655082_1931457310220851,Warning: one of these vibrators is so good you will never want to have sex with a man again.,I Tested Cheap and Expensive Vibrators to See How They Compare,link,https://www.vice.com/en_uk/article/mgvpay/wibrator-za-piataka?utm_source=vicefbuk&utm_campaign=global,2017-12-03 06:01:12,129,54,12,92,3,3,29,1,1,0
167115176655082_1931430616890187,The IRL impact and relatability of Miyazaki's most extraordinary heroines.,Girlhood and Girl Power in Studio Ghibli Films,link,https://i-d.vice.com/en_us/article/wjdqzm/girlhood-and-girl-power-in-studio-ghibli-films?utm_campaign=global&utm_source=vicefbuk,2017-12-03 05:30:01,668,13,118,550,118,0,0,0,0,0
167115176655082_1931406453559270,"The ""sexist surcharge"" on the morning after pill means it can cost around £35 in Britain.",I Went to Paris to Buy the Morning After Pill Because It's Cheaper,link,https://www.vice.com/en_uk/article/8g33ap/i-went-to-paris-and-back-to-buy-the-morning-after-pill-because-its-cheaper-than-getting-it-here?utm_source=vicefbuk&utm_campaign=global,2017-12-03 05:00:21,360,109,30,259,3,43,16,24,15,0
167115176655082_1931382143561701,His 143rd creation? A mac-and-cheese-stuffed sausage.,We Spoke to a Chef Who Has Made 143 Types of Mac and Cheese,link,https://munchies.vice.com/en_us/article/z48yw5/we-spoke-to-the-chef-who-has-made-143-types-of-mac-and-cheese?utm_source=vicefbuk&utm_campaign=global,2017-12-03 04:30:04,1080,549,212,917,84,60,14,5,0,0
167115176655082_1931359866897262,Maybe read this before you go out and get pissed again next weekend.,How Your Casual Drink and Drug Habit Affects Your Life Expectancy,link,https://www.vice.com/en_uk/article/vvven9/how-your-casual-drink-and-drug-habit-is-affecting-your-life-expectancy?utm_source=vicefbuk&utm_campaign=global,2017-12-03 04:00:48,135,83,35,112,2,5,12,4,0,0
167115176655082_1931314500235132,"People with ADHD end up searching for excitement in cocaine, ecstasy, and alcohol.",The Disturbing Relationship Between Addiction and ADHD,link,https://www.vice.com/en_uk/article/qbxe3v/the-disturbing-relationship-between-addiction-and-adhd-511?utm_source=vicefbanz&utm_campaign=global,2017-12-03 03:00:04,911,125,326,783,14,33,10,69,2,0
167115176655082_1931235003576415,Fuck algorithms. Make music great again.,College Radio is Great Because Nobody's Trying to Make Money,link,https://noisey.vice.com/en_us/article/xy9bg3/fuck-algorithms-college-radio-is-a-reminder-of-how-great-music-can-be-when-nobodys-trying-to-make-money?utm_source=vicefbanz&utm_campaign=global,2017-12-03 01:00:24,2750,73,214,2563,164,3,18,1,1,0
167115176655082_1931213263578589,💸💸💸,The Idea of Luxury Is Increasingly Meaningless in 2017,link,https://i-d.vice.com/en_us/article/d3ppba/what-do-we-talk-about-when-we-talk-about-luxury?utm_source=vicefbus,2017-12-03 00:30:09,245,23,22,226,10,2,7,0,0,0
167115176655082_1931190240247558,You can thank this guy for saving your childhood.,Meet the Man Who Made All Your Favourite Cartoons,link,https://www.vice.com/en_uk/article/z49d9e/you-can-thank-genndy-tartakovsky-for-the-cartoon-network-holy-trinity?utm_source=vicefbanz&utm_campaign=global,2017-12-03 00:00:03,693,21,117,598,89,4,2,0,0,0
167115176655082_1931140980252484,"""If you've made it this far by not listening to it I would advise you to never do so. Fucking go outside or something. Smile.""","Radiohead's 'OK Computer' – Just an Album About Shit, Really",link,https://noisey.vice.com/en_uk/article/xy9p5n/radiohead-ok-computer-just-an-album-about-shit?utm_source=vicefbanz&utm_campaign=global,2017-12-02 23:00:25,599,396,35,307,16,9,141,5,121,0
167115176655082_1931140120252570,"""If you've made it this far by not listening to it I would advise you to never do so. Fucking go outside or something. Smile.""","Radiohead's 'OK Computer' – Just an Album About Shit, Really",link,https://noisey.vice.com/en_uk/article/xy9p5n/radiohead-ok-computer-just-an-album-about-shit?utm_source=vicefbanz&utm_campaign=global,2017-12-02 23:00:05,265,179,24,137,9,3,61,1,54,0
167115176655082_924024571090827,"Trump says he doesn't benefit from the GOP tax plan, but that's not true. 

(via HBO)",How the GOP Tax Plan Benefits Trump: VICE News Tonight,video,https://www.facebook.com/VICE/videos/924024571090827/,2017-12-02 22:30:00,1189,213,449,618,9,23,81,17,441,0
167115176655082_1931085100258072,"""My hope was to sell four or five to some close friends. I woke up to over 10,000 orders.""",Meet the Woman Who Made the 'Nasty Woman' Shirt That Accidentally Went Viral,link,https://impact.vice.com/en_us/article/bjdg7w/i-made-the-nasty-woman-t-shirt-that-became-a-symbol-of-anti-trump-resistance?utm_source=vicefbus,2017-12-02 22:00:16,436,18,15,374,45,4,13,0,0,0
167115176655082_924022367757714,"The Earth was flat in North Carolina, at least for a few days. 

(via HBO)",We Went to the First Flat Earth Conference: VICE News Tonight,video,https://www.facebook.com/VICE/videos/924022367757714/,2017-12-02 21:30:00,3694,1942,1766,1519,46,123,1727,234,45,0
167115176655082_1931003963599519,"Let the image of the men, children, and women jubilantly display on the lawn they built remind us of how central this narrative is to American politics.",How Kendrick Lamar's 'To Pimp a Butterfly' Artwork Is the Lasting Document of America's Hip-Hop President,link,https://noisey.vice.com/en_us/article/vvz45j/how-kendrick-lamars-to-pimp-a-butterfly-artwork-is-the-lasting-document-of-americas-hip-hop-president?utm_source=vicefbus,2017-12-02 21:00:52,1059,39,100,936,104,8,8,2,0,1
167115176655082_1930972786935970,"On October 27, 1961, 19-year-old Kentuckian Betty Gail Brown was found dead in her car, strangled by her own brassiere.",The Bizarre Unsolved Murder of Harry Dean Stanton's Niece,link,https://www.vice.com/en_us/article/j5j9yd/the-bizarre-unsolved-murder-of-harry-dean-stantons-niece?utm_source=vicefbus,2017-12-02 20:30:07,50,9,14,33,1,8,0,8,0,0
167115176655082_1930943130272269,"Pull this up the next time someone asks ""where are you from?""",Here’s a Global Heatmap of People with Your Last Name,link,https://motherboard.vice.com/en_us/article/mg7qwb/heres-a-global-heatmap-of-people-with-your-last-name?utm_source=vicefbus,2017-12-02 20:00:36,119,9,54,111,5,0,3,0,0,0
167115176655082_1930915346941714,This has huge implications for who gets elected to public office.,Why Nearly 2 Million People Are Banned From Voting in Florida,link,https://impact.vice.com/en_us/article/7x45me/why-nearly-2-million-people-are-banned-from-voting-in-florida?utm_source=vicefbus,2017-12-02 19:30:10,160,29,85,85,3,11,3,3,55,0
167115176655082_1930886023611313,"Yup, safer than smoking weed.",Shrooms Are the Safest Drug You Can Take,link,https://tonic.vice.com/en_us/article/43gey3/mushrooms-are-the-safest-drug-you-can-take?utm_source=vicefbus,2017-12-02 19:00:30,9346,985,1537,8174,653,303,195,4,17,0
167115176655082_1672635732793059,"An authentic, mosquito-filled Amazon experience.

More from a new season of HAMILTON'S PHARMACOPEIA: https://vice.video/2khdJGl","""Surviving"" in the Amazon",video,https://www.facebook.com/VICE/videos/1672635732793059/,2017-12-02 18:30:00,1005,175,76,862,33,11,96,0,3,0
167115176655082_1930831156950133,It's not as impossible as it sounds.,Republicans and Democrats Could End Childhood Hunger if They Work Together,link,https://impact.vice.com/en_us/article/59ynmn/californias-bipartisan-support-could-transform-school-breakfast-and-lunch-nationwide?utm_source=vicefbus,2017-12-02 18:00:15,360,183,89,302,16,5,33,2,2,0
167115176655082_1930800570286525,At least 11 Louisiana defendants facing the death penalty have no defense team.,"In Louisiana, the Poor Face the Death Penalty Without a Lawyer",link,https://www.vice.com/en_us/article/j5dedk/in-louisiana-the-poor-face-the-death-penalty-without-a-lawyer?utm_source=vicefbus,2017-12-02 17:30:03,391,29,143,139,1,25,4,59,163,0
167115176655082_1930800540286528,"""Spice Girl slash James Bond slash casual.""",People Show Us The Outfits They Wear to Get Laid,link,https://broadly.vice.com/en_us/article/qvddkb/people-show-us-the-outfits-they-wear-to-get-laid?utm_source=vicefbus,2017-12-02 17:30:01,59,14,6,48,3,0,8,0,0,0
167115176655082_1930773156955933,Cool as fuck.,This Is What Our Generation Will Look Like When We Retire,link,https://www.vice.com/en_us/article/mvxgjp/leisurewear-fashion-shoot-393?utm_source=vicefbus,2017-12-02 17:00:49,6261,385,564,5036,512,5,705,2,1,0
167115176655082_1930744463625469,The Great Lakes contain approximately one-fifth of the world's fresh water supply.,Massive Great Lakes Pipeline Threatens Drinking Water of 40 Million People,link,https://impact.vice.com/en_us/article/a3jwk4/great-lakes-citizens-demand-shutdown-of-underwater-pipeline-threatening-their-water-supply?utm_source=vicefbus,2017-12-02 16:30:01,2507,129,1681,887,9,151,27,225,1208,0
167115176655082_1930714616961787,What we know about America’s elite forces now operating in 33 African countries,The U.S. Is Fighting a Shadow War in Almost Two-Thirds of African Nations.,link,https://news.vice.com/story/everything-we-know-about-u-s-special-ops-are-doing-in-33-african-nations?utm_source=vicefbus,2017-12-02 16:00:20,922,76,571,621,1,85,6,33,176,0
167115176655082_1672317482824884,"Get high on your own (air) supply.

(via Tonic)",Here's How Breathing Can Get You Stoned,video,https://www.facebook.com/VICE/videos/1672317482824884/,2017-12-02 15:30:01,3351,492,1305,3003,250,80,18,0,0,0
167115176655082_1930613443638571,"Get it together, dudes!",Women Sum Up the Grossest Thing They've Seen in a Man's Apartment in Six Words,link,https://www.vice.com/en_au/article/59z77z/single-mens-apartments-are-completely-disgusting?utm_source=vicefbus,2017-12-02 14:30:01,178,75,29,127,0,13,34,4,0,0
167115176655082_1930581646975084,"10 years, 2 girls, 1 cup: Revisiting the video that collectively broke us.","Ten Years of '2 Girls 1 Cup,' the Most Memorable Brazilian Shit on the Internet",link,https://motherboard.vice.com/en_us/article/vbgdem/ten-years-of-2-girls-1-cup-the-most-memorable-brazilian-shit-on-the-internet?utm_source=vicefbus,2017-12-02 14:01:40,4512,1356,1206,2583,152,88,1613,44,32,0
167115176655082_1930542510312331,"""The change in dietary advice to promote low-fat foods is perhaps the biggest mistake in modern medical history.""",We’re All Guinea Pigs in a Failed Decades-Long Diet Experiment,link,https://tonic.vice.com/en_us/article/3bkaan/were-all-guinea-pigs-in-a-failed-decades-long-diet-experiment?utm_source=vicefbus,2017-12-02 13:30:21,2169,102,663,2018,47,52,17,19,16,0
167115176655082_1930505936982655,"""I have gone away to walk aboard an alien spaceship, as recurring dreams assured a 42-month interstellar voyage to explore the vast universe, then return.""",The Man Who Went to Space and Disappeared,link,https://www.vice.com/en_us/article/yvwjkv/the-man-who-went-to-space-and-disappeared-the-story-of-granger-taylor?utm_source=vicefbus,2017-12-02 13:02:17,220,22,45,197,3,11,8,1,0,0
167115176655082_1672505059472793,"Sepak Takraw is basically volleyball with your feet, and it's awesome.

(via VICE Sports)",What the Hell Is Sepak Takraw?,video,https://www.facebook.com/VICE/videos/1672505059472793/,2017-12-02 12:30:00,6342,1120,1194,5632,262,432,16,0,0,0
167115176655082_1672570549466244,These Germans shove tobacco up their noses for sport.,We Try Competitive Tobacco Snorting in Bavaria,video,https://www.facebook.com/VICE/videos/1672570549466244/,2017-12-02 12:00:00,6581,13465,3446,3704,82,761,1902,98,34,0
167115176655082_1930395976993651,"Are you sitting on a goldmine of pogs, Beanie Babies, and Pokémon Cards?",Is the Junk I Collected as a 90s Kid Actually Worth Money Today?,link,https://www.vice.com/en_us/article/gqm889/here-are-the-things-in-your-childhood-bedroom-that-are-still-worth-money-1022?utm_source=vicefbus,2017-12-02 11:30:21,137,34,33,120,2,2,13,0,0,0
167115176655082_1930365333663382,Welcome to our next weekly crisis.,Oh Great: Congress Has One Week to Prevent a Government Shutdown,link,https://www.vice.com/en_us/article/mb9jmn/oh-great-congress-has-one-week-to-prevent-a-government-shutdown?utm_source=vicefbus,2017-12-02 11:03:11,686,99,125,408,4,15,143,14,102,0
167115176655082_1930329497000299,Time to grow up.,25 Things You're Too Old for Now That You're 25,link,https://www.vice.com/en_uk/article/znw7ej/joel-golby-things-youre-too-old-at-25-609?utm_source=vicefbuk&utm_campaign=global,2017-12-02 10:30:01,315,103,28,235,1,0,59,16,4,0
167115176655082_1930298963670019,👋👋👋,It's Time for Nancy Pelosi to Go,link,https://www.vice.com/en_us/article/eva4vk/its-time-for-nancy-pelosi-to-go?utm_source=vicefbus,2017-12-02 10:00:53,2862,245,242,2585,174,9,36,4,54,0
167115176655082_1930266230339959,"Sadly, being compassionate will bum you out.",Unselfish People Are More Likely to Wind Up With Depression,link,https://motherboard.vice.com/en_us/article/43a5y9/unselfish-people-are-more-likely-to-wind-up-with-depression?utm_source=vicefbuk&utm_campaign=global,2017-12-02 09:30:24,3458,155,871,2924,47,28,63,392,4,0
167115176655082_1930229317010317,"""When a woman has an orgasm, techno music is playing in her head. If it's not techno, you know she's faking it.""",Men Talk About What They Think Women Feel During an Orgasm,link,https://www.vice.com/en_uk/article/xydvwz/men-imagine-female-orgasm-876?utm_source=vicefbuk&utm_campaign=global,2017-12-02 09:00:35,308,80,21,160,2,1,142,1,2,0
167115176655082_1930201233679792,Watch your back.,The Rich and Their Robots Could Make Half the World's Jobs Disappear,link,https://motherboard.vice.com/en_us/article/3dknk5/the-rich-and-their-robots-are-about-to-make-half-the-worlds-jobs-disappear?utm_source=vicefbuk&utm_campaign=global,2017-12-02 08:30:11,632,223,306,518,18,28,34,14,20,0
167115176655082_1930170257016223,How gentrified has it all become?,What the Locations from the Original 'Trainspotting' Look Like Today,link,https://www.vice.com/en_uk/article/mg5mzb/just-how-gentrified-are-all-the-places-in-the-original-trainspotting-film-now?utm_source=vicefbuk&utm_campaign=global,2017-12-02 08:01:16,468,41,55,421,10,13,0,23,1,0
167115176655082_1930140587019190,This is a real thing. A thing that actually exists.,"There's an Actual, Literal ‘Animal Shelter’ for Computer Mice",link,https://motherboard.vice.com/en_us/article/nz73bk/cern-has-an-actual-literal-animal-shelter-for-computer-mice?utm_source=vicefbuk&utm_campaign=global,2017-12-02 07:30:12,842,121,115,549,31,13,243,5,1,0
167115176655082_1930113480355234,You all (dudes) need to relax.,Here's Why We Lie About the Number of People We've Slept With,link,https://www.vice.com/en_uk/article/jma4e7/why-do-women-lie-about-how-many-men-theyve-slept-with?utm_source=vicefbuk&utm_campaign=global,2017-12-02 07:00:19,190,104,16,165,2,0,20,1,2,0
167115176655082_1930088687024380,These beats slap.,The ‘Ecco the Dolphin’ Soundtrack Is Tight As Hell,link,https://motherboard.vice.com/en_us/article/mg7g7y/the-ecco-the-dolphin-soundtrack-is-a-goddamned-masterpiece?utm_source=vicefbuk&utm_campaign=global,2017-12-02 06:30:04,1204,96,191,1084,77,4,39,0,0,0
167115176655082_1930066883693227,"Suddenly, there was more sex and drug taking than at any house party I'd been to before.",Remembering the Teenage Phenomenon of 'Skins Parties',link,https://www.vice.com/en_uk/article/535pda/remembering-the-british-teenage-phenomenon-of-skins-parties?utm_source=vicefbuk&utm_campaign=global,2017-12-02 06:00:04,429,22,12,382,29,2,16,0,0,0
167115176655082_1930042457029003,Does it actually work?,Why People Smoke Weed to Treat Depression,link,https://broadly.vice.com/en_us/article/bmwwmz/why-people-smoke-weed-to-treat-depression?utm_source=vicefbuk&utm_campaign=global,2017-12-02 05:30:02,1142,137,186,1065,58,7,9,2,1,0
167115176655082_1930019870364595,I got a lot of sexually aggressive messages from men.,Portraits of the People I Met On 'Alternative' Sex Websites,link,https://www.vice.com/en_uk/article/xyyz44/portraits-of-the-people-i-met-on-alternative-sex-websites?utm_source=vicefbuk&utm_campaign=global,2017-12-02 05:00:39,65,12,8,60,1,0,2,2,0,0
167115176655082_1929968893703026,What they didn't teach you in school about Britain's disgraceful past.,Britain Has Never Faced Up to the Horrible Shame of Empire,link,https://www.vice.com/en_uk/article/3d9jdw/britain-has-never-faced-up-to-the-shame-of-empire?utm_source=vicefbuk&utm_campaign=global,2017-12-02 04:00:16,2222,424,473,1982,59,16,131,10,24,0
167115176655082_1929931420373440,"""And bingo! Three of the most beautiful rings you ever saw.""",Those Guys with Metal Detectors At the Beach Actually Find a Lot of Gold,link,https://www.vice.com/en_au/article/mvnpxq/those-guys-with-metal-detectors-at-the-beach-actually-find-a-lot-of-gold-vice-weekends?utm_source=vicefbanz&utm_campaign=global,2017-12-02 03:00:06,159,28,16,144,1,7,7,0,0,0
167115176655082_1929850873714828,You'll need a pencil and a Bible.,An Ex-Con Explains How to Make Cigarettes From Nicotine Patches,link,https://www.vice.com/en_au/article/8g3v5a/a-maximum-security-inmate-taught-us-how-to-make-contraband-cigarettes?utm_source=vicefbanz&utm_campaign=global,2017-12-02 01:00:01,294,49,51,215,4,21,52,1,1,0
167115176655082_1929803283719587,The human race has many positive attributes (probably) but honesty is not one of them.,Learning How to Detect a Lie is Easier Than You Think,link,https://www.vice.com/en_au/article/zn8745/detecting-a-lie-v-skills?utm_source=vicefbanz&utm_campaign=global,2017-12-02 00:00:06,237,8,70,233,3,1,0,0,0,0
167115176655082_1929778703722045,"Yeah, this one is NSFW.",Anal Sex in Porn Is Much More Complex Than You Realize,link,https://www.vice.com/en_us/article/8qwkmg/how-to-do-anal-like-a-porn-star,2017-12-01 23:30:03,244,61,39,204,5,4,30,1,0,0
167115176655082_1929778667055382,So much for the city that never sleeps.,The Days of New York’s 24/7 Subway May be Numbered,link,https://www.vice.com/en_us/article/pazygk/the-days-of-new-yorks-247-subway-may-be-numbered?utm_source=vicefbus,2017-12-01 23:30:01,119,12,14,67,0,11,0,23,18,0
167115176655082_1929749190391663,"In the 1990s someone put a single lawn gnome next to a tree. Twenty years later, it's exploded into a sprawling ceramic vista called Gnomesville.",Nothing Is Weirder Than This Village of Garden Gnomes,link,https://www.vice.com/en_au/article/av9nga/we-visited-perths-hyper-weird-village-of-gnomes?utm_source=vicefbanz&utm_campaign=global,2017-12-01 23:00:01,587,230,136,439,40,7,98,1,2,0
167115176655082_1929717300394852,Let's be honest.,"Smoking Weed Can Be a Lot of Fun, but Let's Not Pretend It Doesn't Fuck You Up",link,https://www.vice.com/en_us/article/ppm59z/smoking-weed-can-be-a-lot-of-fun-but-lets-not-pretend-it-doesnt-fuck-you-up?utm_source=vicefbus,2017-12-01 22:30:03,1192,247,68,1030,31,6,118,2,5,0
167115176655082_1929686120397970,"""YEEHAW!""",Watch This Guy Blow Up a Fridge Filled with Explosives and Almost Die,link,https://motherboard.vice.com/en_us/article/payad8/watch-this-guy-blow-up-a-fridge-filled-with-explosives-and-almost-die?utm_source=vicefbus,2017-12-01 22:00:29,305,40,32,236,5,12,51,0,1,0
