status_id,status_message,link_name,status_type,status_link,status_published,num_reactions,num_comments,num_shares,num_likes,num_loves,num_wows,num_hahas,num_sads,num_angrys,num_special
1143803202301544_394028414303528,That's one way to eat eggs... 😱,1972: Nationwide: Whole Egg Eater,video,https://www.facebook.com/bbc/videos/394028414303528/,2017-04-16 11:26:00,54,15,57,23,0,18,13,0,0,0
1143803202301544_10156157829369968,This diver got a bit of a shock when a MASSIVE whale shark swam by. 😱,"Whale Shark spotted off West Palm Beach, Florida",video,https://www.facebook.com/bbc/videos/10156157829369968/,2017-04-16 09:06:00,361,22,64,276,29,55,1,0,0,0
1143803202301544_1325889144161962,"""It's about time, isn't it?""

#DoctorWho is about to be joined by his first openly gay companion. A brand-new series starts tonight on BBC One at 7.20pm.",Doctor Who,video,https://www.facebook.com/bbc/videos/1325889144161962/,2017-04-15 09:32:00,87,14,41,78,8,0,0,1,0,0
1143803202301544_1852745788084213,"Goldfrapp wowed the Later with Jools Holland audience this week. 

Watch the full set here 👉 bbc.in/2owZI7E",Goldfrapp - Systemagic - Later... with Jools Holland,video,https://www.facebook.com/bbc/videos/1852745788084213/,2017-04-14 14:45:00,33,4,18,30,3,0,0,0,0,0
1143803202301544_1728851380463387,"In a world first, footage is captured of a giant armadillo baby leaving its burrow. 😍",Natural World: Armadillo Hotel,video,https://www.facebook.com/bbc/videos/1728851380463387/,2017-04-14 05:01:00,440,11,68,356,72,11,0,1,0,0
1143803202301544_1675535539142871,A Scottish 3 year old's take on Easter... Mark Nelson's daughter wants to get a few things straight.,News at 3: Easter Special,video,https://www.facebook.com/bbc/videos/1675535539142871/,2017-04-13 13:05:00,11637,1110,16433,7894,1240,15,2484,3,1,0
1143803202301544_1728444060504119,"Spice Girls, Oasis, Blur, The Prodigy, Outkast... the list goes on.",,video,https://www.facebook.com/bbc/videos/1728444060504119/,2017-04-13 07:30:00,375,52,34,353,19,0,1,1,1,0
1143803202301544_10156149801544968,"Two thirds of the Australia's Great Barrier Reef has been seriously damaged by ""unprecedented"" bleaching...",Great Barrier Reef damaged by bleaching,video,https://www.facebook.com/bbc/videos/10156149801544968/,2017-04-12 01:12:00,102,7,32,28,0,2,0,58,14,0
1143803202301544_10154938472445659,"""The more we talk about it, the more we can figure out how to move through it together."" 

Singer Laura Mvula on why she is talking openly about her struggles with anxiety.",Living with anxiety,video,https://www.facebook.com/bbc/videos/10154938472445659/,2017-04-11 11:05:00,96,3,28,82,14,0,0,0,0,0
1143803202301544_1888856284705492,"Ricky may look like a ordinary postman. But to Angela, he is her ""guardian angel"".",Meet the 'guardian angel' postman,video,https://www.facebook.com/bbc/videos/1888856284705492/,2017-04-10 13:01:00,87,6,60,70,16,1,0,0,0,0
1143803202301544_1444875488866198,Just a massive sea lion interrupting an interview. Nothing to see here. 😂,"Sea Lion Interruption, Galapagos",video,https://www.facebook.com/bbc/videos/1444875488866198/,2017-04-08 10:23:38,246,15,65,202,31,0,13,0,0,0
1143803202301544_1399385203456229,"Participants helped create a huge 'living' art installation at Pen y Fan in Wales today! 

Discover more ➡️ bbc.co.uk/getcreative","In the foothills of Pen y Fan, something is stirring…",video,https://www.facebook.com/bbc/videos/1399385203456229/,2017-04-07 13:58:34,49,7,49,43,3,3,0,0,0,0
1143803202301544_1719476451400880,"We're live from Swiss Cottage Library, London for Get Creative Weekend, with Big Painting Challenge mentors Pascal Anson and Diana Ali. 🎨",Get Creative Painting Masterclass,video,https://www.facebook.com/bbc/videos/1719476451400880/,2017-04-07 09:48:38,92,59,20,61,25,5,0,0,1,0
1143803202301544_10154922412375659,Sharon has knitted hundreds of woollen breasts for women who've had mastectomies.,"""I’ve knitted hundreds of woollen breasts”",video,https://www.facebook.com/bbc/videos/10154922412375659/,2017-04-07 01:05:00,7293,301,5981,5575,1594,97,18,2,2,5
1143803202301544_10154652626755787,"Fay kept the homeless warm with this simple idea. Kindness is catching, spread the message.

(via BBC Three)",Amazing Humans: Coat Exchange,video,https://www.facebook.com/bbc/videos/10154652626755787/,2017-04-05 09:38:00,537,13,179,460,72,5,0,0,0,0
1143803202301544_1537146119637842,"""The night of the hurricane was a nightmare"". 

Six months ago, Haiti was hit by the worse Caribbean storm in a decade. BBC World Service flew back to one hospital to hear how the medical team coped.",Hurricane Matthew in Haiti,video,https://www.facebook.com/bbc/videos/1537146119637842/,2017-04-05 04:31:00,16,0,5,13,0,1,0,2,0,0
1143803202301544_2239536819604793,"Lose yourself in a unique 360° dance experience, created in partnership with Scottish Ballet.",The Perfect Place,video,https://www.facebook.com/bbc/videos/2239536819604793/,2017-04-04 10:02:06,119,10,61,99,16,2,2,0,0,0
1143803202301544_1223849571070199,"Newsround is 45 years old today 🎂, so here's some classic John Craven from the archives.

(For rights reasons, we've had to edit this - just a tad 😉)",Classic John Craven's Newsround from 1972,video,https://www.facebook.com/bbc/videos/1223849571070199/,2017-04-04 06:36:00,42,3,7,41,1,0,0,0,0,0
1143803202301544_1857031867918234,All the players in this football team are deaf. The People's Cup has given them a chance to play competitively. 👏,The People's Cup has given this deaf community a chance to pla...,video,https://www.facebook.com/bbc/videos/1857031867918234/,2017-04-04 01:26:01,144,7,31,119,25,0,0,0,0,0
1143803202301544_10154643649225787,"""If you survive chemo, then you are a queen and you deserve a crown""",Amazing Humans: Bald is beautiful,video,https://www.facebook.com/bbc/videos/10154643649225787/,2017-04-03 01:23:00,1629,48,530,1274,319,33,0,3,0,0
1143803202301544_1709103635771495,One thing is for sure. It's either Oxford or Cambridge...,BBC - The Boat Race,video,https://www.facebook.com/bbc/videos/1709103635771495/,2017-04-02 10:04:00,46,4,9,46,0,0,0,0,0,0
1143803202301544_1703690549646137,Find out how you can make an egg bounce like this! Great fun for the school holidays.,BBC Terrific Scientific - How to make an egg bounce,video,https://www.facebook.com/bbc/videos/1703690549646137/,2017-04-01 05:03:00,1050,178,578,967,28,29,23,2,1,0
1143803202301544_10154638235900787,The swimming iguanas of the Galapagos that shrink their bones to survive.,Galapagos: Marine Iguanas,video,https://www.facebook.com/bbc/videos/10154638235900787/,2017-03-31 08:06:44,875,52,311,698,56,119,2,0,0,0
1143803202301544_1708140879201104,"Four candles? Fork handles? 

We remember Ronnie Corbett, who died a year ago today. Here are some of his very best jokes from across the decades 👉 http://bbc.in/2nQudoH",Fork handles - Remembering Ronnie Corbett,video,https://www.facebook.com/bbc/videos/1708140879201104/,2017-03-31 02:22:00,488,29,190,359,52,1,74,2,0,0
1143803202301544_10154531774747217,A deadly (and thirsty) cobra 🐍 is filmed drinking water from a bottle in a drought-hit Indian village. 😱,Thirsty snake,video,https://www.facebook.com/bbc/videos/10154531774747217/,2017-03-30 14:22:00,280,26,104,201,29,45,2,3,0,0
1143803202301544_10154900261360659,How Rio Ferdinand helped his children cope with their mother’s death.,How Rio Ferdinand helped his children cope with their mother’s...,video,https://www.facebook.com/bbc/videos/10154900261360659/,2017-03-30 12:41:14,224,8,47,150,32,2,0,40,0,0
1143803202301544_1162266087215891,Meet the astronaut of the future... 🤖,Stargazing Live Australia: Meet Valkyrie,video,https://www.facebook.com/bbc/videos/1162266087215891/,2017-03-30 04:40:54,138,6,45,125,2,10,1,0,0,0
1143803202301544_10155073658986763,"Pure goosebumps. Don't miss Sampha's stunning BBC Radio 1 Live Lounge performance of (No One Knows Me) Like the Piano 🎹💫

Watch in full 👉 http://bbc.in/2oan7MY",Sampha in the Live Lounge,video,https://www.facebook.com/bbc/videos/10155073658986763/,2017-03-29 15:28:16,27,2,24,22,5,0,0,0,0,0
1143803202301544_10154528304802217,"Seriously impressive skills! 

⛷ Swiss skier claims world first quad cork 1800. 🎿

(via BBC News)",Swiss skier claims world first quad cork 1800,video,https://www.facebook.com/bbc/videos/10154528304802217/,2017-03-29 11:36:02,301,21,83,220,9,71,0,1,0,0
1143803202301544_10154632599205787,Zoe overcame her eating disorder to become the first woman to join her American Football team.,Zoe the Lady Linebacker,video,https://www.facebook.com/bbc/videos/10154632599205787/,2017-03-29 02:05:07,71,5,20,55,12,4,0,0,0,0
1143803202301544_1160543490721484,Meet the man who has super strong bones...,Incredible Medicine: Strong bones,video,https://www.facebook.com/bbc/videos/1160543490721484/,2017-03-28 04:41:00,685,16,148,595,33,52,0,4,1,0
1143803202301544_1154875607954148,There's something lurking beneath the calm waters of Ireland's west coast...,Basking Sharks of Co. Donegal,video,https://www.facebook.com/bbc/videos/1154875607954148/,2017-03-27 14:02:00,959,74,304,779,98,82,0,0,0,0
1143803202301544_1432671016753312,"After the loss of his wife in 2015, Rio Ferdinand embarks on an intensely personal journey to explore how bereaved parents attempt to come to terms with loss.
Rio Ferdinand: Being Mum And Dad. Tuesday. 9pm. BBC One.",Rio Ferdinand: Being Mum And Dad,video,https://www.facebook.com/bbc/videos/1432671016753312/,2017-03-27 12:01:01,123,7,38,76,12,0,0,35,0,0
1143803202301544_1699515426730316,"Being a mum is challenging, even for elephants. Luckily when this little calf gets into trouble, Grandma's there to help... 🐘",Natural World - Archive clip,video,https://www.facebook.com/bbc/videos/1699515426730316/,2017-03-26 09:56:00,769,39,223,571,180,14,2,2,0,0
1143803202301544_1430969736923440,When Meryl Streep said the sweetest thing to Ryan Gosling's mum. 😍,Ryan Gosling on The Graham Norton Show,video,https://www.facebook.com/bbc/videos/1430969736923440/,2017-03-26 07:21:20,438,12,47,348,59,0,31,0,0,0
1143803202301544_1838830273000942,Joy is a single Mum doing her thing. She also happens to be registered blind. (Via BBC Like That),Life as a single blind mum,video,https://www.facebook.com/bbc/videos/1838830273000942/,2017-03-26 04:23:00,922,29,202,740,150,29,1,2,0,0
1143803202301544_10154622519685787,"""We have to make this happen for this child. He has to walk"" 

The British medical students helping people walk again.",Amazing Humans: Making prosthetic legs from recycled drainpipes,video,https://www.facebook.com/bbc/videos/10154622519685787/,2017-03-25 14:24:00,372,9,143,301,60,11,0,0,0,0
1143803202301544_1651681161528309,Imagine getting lost every time you left the house...,Incredible Medicine - the woman who can't help getting lost,video,https://www.facebook.com/bbc/videos/1651681161528309/,2017-03-25 12:23:00,151,67,71,108,4,36,2,0,1,0
1143803202301544_1152307524877623,These beautiful Icelandic swans make Lough Nahaltora in Ireland their home for winter.,Whooper Swans Migrate to Ireland,video,https://www.facebook.com/bbc/videos/1152307524877623/,2017-03-25 06:09:00,399,7,117,349,36,14,0,0,0,0
1143803202301544_1430284833658597,That moment when Hugh Grant dances to Hotline Bling...  #RedNoseDayActually,Hugh Grant - Red Nose Day Actually,video,https://www.facebook.com/bbc/videos/1430284833658597/,2017-03-24 16:58:23,228,10,47,163,40,0,25,0,0,0
1143803202301544_10156079005129968,In need of a moment of calm? Here are some clouds that have been officially recognised by the International Cloud Atlas for the first time. 😌,New cloud types recognised for the first time,video,https://www.facebook.com/bbc/videos/10156079005129968/,2017-03-24 06:23:00,156,20,92,135,6,15,0,0,0,0
1143803202301544_1156298507812649,Meet the girl with a left arm that won't stop growing...,The girl whose arm won't stop growing - Incredible Medicine,video,https://www.facebook.com/bbc/videos/1156298507812649/,2017-03-23 15:12:00,77,15,34,58,6,10,0,3,0,0
1143803202301544_1691922697489589,Rosbiati is one of very few female mahouts working to protect endangered elephants. 🐘,Project Hope,video,https://www.facebook.com/bbc/videos/1691922697489589/,2017-03-21 09:51:30,109,5,22,85,19,2,0,2,1,0
1143803202301544_10154607440920787,"People are abandoning hundreds of cats in Buenos Aires, and Eugenia is working tirelessly to save them.",Amazing Humans: Finding cats their forvever homes,video,https://www.facebook.com/bbc/videos/10154607440920787/,2017-03-20 07:38:00,208,17,45,143,42,2,0,20,1,0
1143803202301544_1239509102751056,In case you've ever wondered what Teletubbies looks like behind-the-scenes... (via CBeebies),Teletubbies behind the scenes,video,https://www.facebook.com/bbc/videos/1239509102751056/,2017-03-19 10:19:00,252,36,60,213,18,16,5,0,0,0
1143803202301544_2227182820840193,"Glaswegian photographer Dougie Wallace takes pictures of the super-rich at play in Knightsbridge, London.",Dougie Wallace and the super-rich,video,https://www.facebook.com/bbc/videos/2227182820840193/,2017-03-19 05:16:00,169,31,35,150,7,1,8,1,2,0
1143803202301544_1517110898308031,"As part of #BBCSchoolReport, BBC World Service asked a class of Swedish children and their guests from a nearby refugee camp what they thought of a new book about a young refugee hero.",The refugee hero,video,https://www.facebook.com/bbc/videos/1517110898308031/,2017-03-16 12:04:44,80,3,46,66,13,1,0,0,0,0
1143803202301544_1682228585125667,16 million people are on the brink of starvation in East Africa. Please help save lives with the Disasters Emergency Committee (DEC) crisis appeal. http://bit.ly/2nISA4p,DEC East Africa Crisis appeal,video,https://www.facebook.com/bbc/videos/1682228585125667/,2017-03-16 09:52:49,34,7,50,18,0,0,0,16,0,0
1143803202301544_10154857634075659,"In parts of Africa people with albinism are vulnerable to mutilation and murder. Festo was attacked when he was just seven years old.

Warning: Contains upsetting scenes.",Born too White,video,https://www.facebook.com/bbc/videos/10154857634075659/,2017-03-15 15:14:00,1366,81,454,730,76,20,0,419,121,0
1143803202301544_1297411827009694,"""Girls aren't the delicate flowers they used to be.""

Meet 'The Mighty Atom' - The first Women's World Boxing Champion. 💪",The Mighty Atom,video,https://www.facebook.com/bbc/videos/1297411827009694/,2017-03-15 07:45:01,141,0,51,127,12,2,0,0,0,0
1143803202301544_1107227836054305,Imagine the sugar rush after eating this! (Via BBC The Social),Amazing Elephant Cake,video,https://www.facebook.com/bbc/videos/1107227836054305/,2017-03-15 03:01:35,65,31,21,52,6,6,0,1,0,0
1143803202301544_10154484540192217,'BBC Dad' is back - this time his wife and children are meant to be in shot! 😉,The interrupted interview - take two,video,https://www.facebook.com/bbc/videos/10154484540192217/,2017-03-14 17:18:38,2886,239,626,2251,294,2,338,1,0,0
1143803202301544_1418079348212479,"For Comic Relief: Red Nose Day, People Just Do Nothing - Kurupt FM collaborated with ""one of the biggest urban artists in the world"" - Ed Sheeran. 😂",People Just Do Nothing's Kurupt FM feat. Ed Sheeran,video,https://www.facebook.com/bbc/videos/1418079348212479/,2017-03-12 07:33:16,47,7,16,37,4,1,5,0,0,0
1143803202301544_1145374498905050,"How to destroy a watermelon, a Volvo and a wooden shed with a single stream of water... 😱",Top Gear: Matt's Extreme Pressure Washer,video,https://www.facebook.com/bbc/videos/1145374498905050/,2017-03-12 03:05:00,1383,266,875,1092,23,43,223,0,2,0
1143803202301544_10154576386935787,How 6-year-old Zoe lives with brittle bone disease.,Our Baby Made Of Glass - on Youtube now,video,https://www.facebook.com/bbc/videos/10154576386935787/,2017-03-11 09:59:00,1710,83,726,1043,425,13,4,224,1,0
1143803202301544_1145230898919410,Meet the woman who can remember every single day as though it was yesterday...,Incredible Medicine: Superhuman Memory,video,https://www.facebook.com/bbc/videos/1145230898919410/,2017-03-10 10:22:00,2186,409,1160,1704,77,395,8,2,0,0
1143803202301544_1233766879991945,Sir David Attenborough narrates 5 new stories for CBeebies! 💚 🌎,Sir David Attenborough narrates for CBeebies Storytime app,video,https://www.facebook.com/bbc/videos/1233766879991945/,2017-03-10 07:01:00,67,7,8,57,10,0,0,0,0,0
1143803202301544_1414499368570477,Remember when Will Smith arranged this incredible The Fresh Prince of Bel-Air reunion on The Graham Norton Show?,The Fresh Prince of Bel-Air​ Reunion,video,https://www.facebook.com/bbc/videos/1414499368570477/,2017-03-09 12:23:00,1673,130,1047,1266,305,8,92,2,0,0
1143803202301544_10158231363635459,"Everything you ever wanted to know about Mars, narrated by William Shatner. (Yes, William Shatner). Via BBC Radio 4",Mars animation by Aardman Animation,video,https://www.facebook.com/bbc/videos/10158231363635459/,2017-03-09 10:16:15,76,6,45,61,8,1,6,0,0,0
1143803202301544_1475017209198497,"Introducing BBC Earth's Real Happiness Project! 

Their aim is to bring you #RealHappiness each day through a closer connection with nature. Click here to be inspired: http://realhappinessproject.com/",Introducing the Real Happiness Project,video,https://www.facebook.com/bbc/videos/1475017209198497/,2017-03-09 05:21:00,238,3,73,200,33,5,0,0,0,0
1143803202301544_1871601199764334,The app that helps blind people ‘see’.,How smartphones became ‘eyes’ for blind people,video,https://www.facebook.com/bbc/videos/1871601199764334/,2017-03-09 02:34:00,303,21,315,240,44,19,0,0,0,0
1143803202301544_1876326852603855,Today would have been Rik Mayall's 59th birthday. Here's a classic clip from his BBC Two sitcom 'Bottom'. (Via BBC Store).,Bottom on BBC Store,video,https://www.facebook.com/bbc/videos/1876326852603855/,2017-03-07 09:51:57,326,21,86,255,29,0,37,5,0,0
1143803202301544_1630811756932956,It's that time of year again: the UK wife carrying championship has taken place in Dorking!,Wife Carrying,video,https://www.facebook.com/bbc/videos/1630811756932956/,2017-03-07 07:49:00,369,116,301,265,13,12,78,0,1,0
1143803202301544_1667722803242912,"George is 88 years old, but that hasn't stopped him trying parkour for the first time. Some #MondayMotivation for you from BBC Get Inspired. 💪",Get Inspired - Pensioners do Parkour,video,https://www.facebook.com/bbc/videos/1667722803242912/,2017-03-06 02:38:51,236,29,80,188,38,9,1,0,0,0
1143803202301544_1409147735772307,"Tonight there will be high notes, high kicks, and a high chance of hilarity! 😂

#LetsSingAndDance for Comic Relief. BBC One. 6.45pm.",Let's Sing And Dance for Comic Relief,video,https://www.facebook.com/bbc/videos/1409147735772307/,2017-03-04 13:40:57,11,0,31,10,0,1,0,0,0,0
1143803202301544_1135984686510698,"Meet The Ice Man, who can do something truly remarkable with his body... ❄️",Incredible Medicine: The Ice Man,video,https://www.facebook.com/bbc/videos/1135984686510698/,2017-03-04 04:13:00,1897,289,2514,1610,69,206,9,1,2,0
1143803202301544_1664595073555685,"In celebration of World Wildlife Day, here's the great Sir David Attenborough in an archive clip from Life on Earth. 🌍","Life On Earth, 1979 - Clip from BBC's ReMarc",video,https://www.facebook.com/bbc/videos/1664595073555685/,2017-03-03 12:01:00,468,17,106,403,61,3,1,0,0,0
1143803202301544_372908343082202,"Before he found international fame, Ed Sheeran was interviewed way back in 2010!",2010: Look East: Ed Sheeran,video,https://www.facebook.com/bbc/videos/372908343082202/,2017-03-03 09:31:00,144,18,10,122,21,1,0,0,0,0
1143803202301544_1287134734685944,"When baby Sol had his arm amputated, his dad decided to do something amazing.",,video,https://www.facebook.com/bbc/videos/1287134734685944/,2017-03-03 07:33:00,585,6,62,466,87,28,1,3,0,0
1143803202301544_1662204613794731,"It might not feel like it, but today is the first day of spring, meteorologically speaking. 🌼",Spring explained by BBC Weather,video,https://www.facebook.com/bbc/videos/1662204613794731/,2017-03-01 09:06:16,23,2,6,22,0,1,0,0,0,0
1143803202301544_1361278377266912,A stunning time-lapse of the Welsh landscape. Dydd Gŵyl Dewi Hapus! Happy Saint David's Day!,March 1st: A time to celebrate Wales.,video,https://www.facebook.com/bbc/videos/1361278377266912/,2017-03-01 05:52:25,198,12,86,164,26,8,0,0,0,0
1143803202301544_1466055140094704,What 1.5 million penguins sound like. 🐧,Planet Earth II: Islands - Zavodovski Island,video,https://www.facebook.com/bbc/videos/1466055140094704/,2017-03-01 02:36:00,235,30,63,198,26,10,1,0,0,0
1143803202301544_1501814769837644,'I don't think there's anything that's not amazing'. BBC World Service takes a ride on a Mardi Gras float. 👀 🎊,BBC World Service on wthe Mardi Gras parade,video,https://www.facebook.com/bbc/videos/1501814769837644/,2017-02-28 13:58:00,24,3,4,22,1,1,0,0,0,0
1143803202301544_1948531335366249,Setting the bar high with a Mary Berry pancake. 😮😍,Mary Berry Pancake Art,video,https://www.facebook.com/bbc/videos/1948531335366249/,2017-02-28 03:12:00,549,108,85,452,27,55,15,0,0,0
1143803202301544_1443220199081748,"Salted caramel, chocolate and peanuts anybody? BBC Food has some great chocolate-topped pancake ideas! 😋",3 chocolate pancake toppings,video,https://www.facebook.com/bbc/videos/1443220199081748/,2017-02-27 14:16:00,21,3,10,20,1,0,0,0,0,0
1143803202301544_1127140617395105,Dread Mondays? Not anymore. 😍🍴 'Mary Berry Everyday' tomorrow 8.30pm BBC Two.,Mary Berry Everyday,video,https://www.facebook.com/bbc/videos/1127140617395105/,2017-02-26 12:12:00,179,19,17,152,26,1,0,0,0,0
1143803202301544_1400521443301603,Their future is in your hands! 👋👋The BBC Let It Shine finalists get a taste of what life would be like in a touring musical. Live final tomorrow 6.45pm BBC One. #LetItShine,Let It Shine finalists,video,https://www.facebook.com/bbc/videos/1400521443301603/,2017-02-25 09:33:33,9,5,0,8,0,1,0,0,0,0
1143803202301544_1400351379985276,"The conspiracy, the murder, the betrayal - it all ends here.

Don't miss the dramatic finale of Taboo. Tonight at 9.15pm on BBC One.",Taboo Finale - Trailer,video,https://www.facebook.com/bbc/videos/1400351379985276/,2017-02-25 07:17:00,49,5,5,42,4,3,0,0,0,0
1143803202301544_10154535737555787,Ambition. Passion. Determination. New BBC Three thriller 'Clique' starts Sun 5 March. 😱,Clique - starts 5 March,video,https://www.facebook.com/bbc/videos/10154535737555787/,2017-02-24 16:18:00,43,23,14,39,2,2,0,0,0,0
1143803202301544_10154967643196763,"New tracks. Old classics. Little Mix cover. A treat & a half, courtesy of Ed Sheeran. 😍",,video,https://www.facebook.com/bbc/videos/10154967643196763/,2017-02-24 07:01:52,56,3,6,50,6,0,0,0,0,0
1143803202301544_368329633540073,Apparently she's 'not a drinker.' 😂🍸 #LifeGoals #FridayFeeling,"BBC Archive 1976: That's Life: ""I'm not a drinker""",video,https://www.facebook.com/bbc/videos/368329633540073/,2017-02-24 02:48:00,1313,235,711,865,112,2,334,0,0,0
1143803202301544_1397647130255701,Comic Relief: Red Nose Day. 24 March on BBC One. 🙌,Red Nose Day is coming soon to BBC One.,video,https://www.facebook.com/bbc/videos/1397647130255701/,2017-02-23 14:24:06,56,7,10,48,4,1,3,0,0,0
1143803202301544_1129268303849003,What really happens in the House of Lords? 'Meet The Lords' starts Monday 9pm on BBC Two.,Meet the Lords: Trailer,video,https://www.facebook.com/bbc/videos/1129268303849003/,2017-02-23 12:12:01,26,1,5,24,0,2,0,0,0,0
1143803202301544_1612091545487271,The story of the girl born with her heart on the outside.,'Incredible Medicine' on BBC iPlayer,video,https://www.facebook.com/bbc/videos/1612091545487271/,2017-02-22 13:39:02,625,63,278,385,64,141,1,34,0,0
1143803202301544_10154525592735787,The man who leaves £10 notes in secret locations. It's the good deed that just keeps on giving. 💷 😍,,video,https://www.facebook.com/bbc/videos/10154525592735787/,2017-02-22 02:22:00,711,11,270,572,123,15,1,0,0,0
1143803202301544_1652221761459683,"Featuring Depeche Mode, Goldfrapp and loads more. BBC Radio 6 Music's 6 Music Festival. 24-26 March in Glasgow.",6 Music Festival tickets on sale Friday,video,https://www.facebook.com/bbc/videos/1652221761459683/,2017-02-21 08:59:24,17,0,2,15,2,0,0,0,0,0
1143803202301544_1396276153726132,Tom Hiddleston has come a long way since playing an elephant leg in the school play. Eddie Redmayne scooped the lead role back then. 😂,Tom Hiddleston​ and Eddie Redmayne's school play,video,https://www.facebook.com/bbc/videos/1396276153726132/,2017-02-21 02:36:01,163,7,10,117,10,0,36,0,0,0
1143803202301544_1126126537496513,"But the question remains, is it a cake or is it a biscuit?",,video,https://www.facebook.com/bbc/videos/1126126537496513/,2017-02-20 11:50:00,189,124,73,156,20,11,2,0,0,0
1143803202301544_10154777546480659,"'He's my eyes, I'm his judgement.' Professional cook David and kitchen assistant Peter make an extraordinary team. 🍴 👏",,video,https://www.facebook.com/bbc/videos/10154777546480659/,2017-02-20 02:44:00,223,8,69,154,54,14,1,0,0,0
1143803202301544_1602194729810286,"When planes are ready for the scrap heap, they get violently crushed to pieces. Like this... ✈️ 'City in the Sky' on BBC iPlayer.",,video,https://www.facebook.com/bbc/videos/1602194729810286/,2017-02-18 04:12:00,94,21,59,70,2,13,0,8,1,0
1143803202301544_1632952400053286,Find your #ScienceFace and experience moments of wonder with brilliant science activities this half-term from Terrific Scientific 👉 bbc.in/2kddk2X,BBC Terrific Scientific,video,https://www.facebook.com/bbc/videos/1632952400053286/,2017-02-17 02:03:14,205,28,71,194,8,3,0,0,0,0
