status_id,status_message,link_name,status_type,status_link,status_published,num_reactions,num_comments,num_shares,num_likes,num_loves,num_wows,num_hahas,num_sads,num_angrys,num_special
1143803202301544_1493074764055617,"Sharon Rooney (AKA Sophie) takes us behind the scenes on the set of 'Two Doors Down.' 🎬

The series returns tonight, 10pm on BBC Two.",Two Doors Down set tour with Sharon Rooney,video,https://www.facebook.com/bbc/videos/1493074764055617/,2016-11-21 12:02:00,15,1,2,14,1,0,0,0,0,0
1143803202301544_1529376463744214,"📺 📻 📱Running throughout November 2016 with programming and content across BBC TV, radio and online. The #BlackAndBritish season 👉 bbc.in/2fPqBRq",BBC's cover photo,photo,https://www.facebook.com/bbc/photos/a.1151155808232950.1073741827.1143803202301544/1514166841931843/?type=3,2016-11-21 07:13:21,25,3,8,24,0,1,0,0,0,0
1143803202301544_1489564827724317,This little one has friends in high places. 😍Goats in China befriend a monkey. And it's the cutest thing ever.🐒,Monkey and herd of goats make friends,video,https://www.facebook.com/bbc/videos/1489564827724317/,2016-11-21 02:42:00,890,102,278,729,119,6,36,0,0,0
1143803202301544_1516519641696563,'He was a sporting legend'. David Harewood nominates Cyrille Regis as his #blackbritishhero. More nominations 👉 bbc.in/2f7X9kc,,video,https://www.facebook.com/bbc/videos/1516519641696563/,2016-11-20 10:46:00,20,3,4,19,0,1,0,0,0,0
1143803202301544_1526008070747720,📱The new BBC+ app is here! Catch up every day on the things you love. Download it now via the App Store apple.co/2fA9I9L or Google Play bit.ly/2fFlbUa.,Timeline Photos,photo,https://www.facebook.com/bbc/photos/a.1191091087572755.1073741830.1143803202301544/1526008070747720/?type=3,2016-11-20 09:12:02,4,1,2,4,0,0,0,0,0,0
1143803202301544_1525950147420179,"🐯🌍 Featuring more than 1,000 of Sir David Attenborough's most memorable moments. Download the Story of Life app. 📱",The greatest wildlife moments ever filmed,video,https://www.facebook.com/bbc/videos/1525950147420179/,2016-11-20 08:02:00,136,8,29,109,27,0,0,0,0,0
1143803202301544_10154248370070787,"After being diagnosed with terminal cancer, 91-year-old Norma decided to go on on a 13,000-mile roadtrip around the USA. 🇺🇸 🚌 🌍",Amazing Humans: Norma,video,https://www.facebook.com/bbc/videos/10154248370070787/,2016-11-20 04:12:00,1376,47,290,1133,204,7,0,32,0,0
1143803202301544_1033751360067365,"📺The extraordinary story of Bill Richmond, a former slave, and an 18th century boxing champ. #BlackAndBritish bbc.in/2f7zsf5",Black and British A Forgotten History: Ep 2,video,https://www.facebook.com/bbc/videos/1033751360067365/,2016-11-19 07:12:01,41,3,12,39,2,0,0,0,0,0
1143803202301544_1522751831073344,"'So poised, so articulate, so professional'. Newsreader Reeta Chakrabarti on why Moira Stuart is her #blackbritishhero.",,video,https://www.facebook.com/bbc/videos/1522751831073344/,2016-11-18 12:12:00,37,0,2,37,0,0,0,0,0,0
1143803202301544_323068341399536,The Battle of the Somme ended #onthisday 100 years ago. Find out what your role might have been with 'Your Somme' 👉 bbc.in/2fbcNOX,"The Battle of the Somme, 100 years on",video,https://www.facebook.com/bbc/videos/323068341399536/,2016-11-18 08:32:00,96,7,38,67,3,0,0,26,0,0
1143803202301544_1281665495187199,"📺 Featuring exclusives from Fantastic Beasts, Doctor Who, BBC EastEnders & more. The BBC Children in Need Appeal Show tonight 7.30pm on BBC One. #ChildrenInNeed",BBC Children In Need Appeal Show,video,https://www.facebook.com/bbc/videos/1281665495187199/,2016-11-18 07:44:00,19,0,6,17,1,1,0,0,0,0
1143803202301544_1525855157429678,📱Check out the new BBC+ App. It’s great for whatever you’re into. Download it now via the App Store apple.co/2fA9I9L or Google Play bit.ly/2fFlbUa.,"The BBC+ App, for whatever you're into.",video,https://www.facebook.com/bbc/videos/1525855157429678/,2016-11-18 06:39:59,9,2,0,8,0,0,1,0,0,0
1143803202301544_10154645776696763,📚 When The Vamps had a go at explaining Harry Potter. In just one minute... 😬 😂 bbc.in/2f4OdiG,The Vamps on BBC Radio 1,video,https://www.facebook.com/bbc/videos/10154645776696763/,2016-11-18 02:52:00,61,5,16,49,2,0,10,0,0,0
1143803202301544_10154663810063895,BBC Strictly Come Dancing's Ed Balls does Gangnam Style take two. This time his dance partner is BBC Radio 4's Nick Robinson. Enough said. 😮 😂,Ed Balls shows off his dancing skills...,video,https://www.facebook.com/bbc/videos/10154663810063895/,2016-11-17 12:12:00,50,1,4,37,4,0,9,0,0,0
1143803202301544_10154490465010659,Tinie Tempah & more celebs reveal their #blackbritishhero. More on the BBC's #BlackandBritish season 👉bbc.in/2fZgYN4,,video,https://www.facebook.com/bbc/videos/10154490465010659/,2016-11-17 02:51:00,18,1,5,14,4,0,0,0,0,0
1143803202301544_1523718627643331,The BBC newsroom has a go at the #MannequinChallenge. Look out for a familiar yellow bear making a special appearance. 🙌 😂 #CiN,BBC News,video,https://www.facebook.com/bbcnews/videos/10154100897887217/,2016-11-16 07:12:01,104,8,0,92,1,5,6,0,0,0
1143803202301544_1522758067739387,'The first black face to be regularly on TV'. Cy Grant is BBC Radio 2 presenter Ken Bruce's #blackbritishhero. More nominations 👉 bbc.in/2ffQzsJ,,video,https://www.facebook.com/bbc/videos/1522758067739387/,2016-11-16 04:53:42,7,3,2,7,0,0,0,0,0,0
1143803202301544_1032028566906311,📺It may seem like Natalie has the perfect life. But there's more to her than meets the eye. An adaptation of Zadie Smith's best-selling novel. 'NW' now on BBC iPlayer.,'NW',video,https://www.facebook.com/bbc/videos/1032028566906311/,2016-11-15 16:02:00,7,1,3,7,0,0,0,0,0,0
1143803202301544_1522706447744549,🌑 Picture perfect. 🔭👀 BBC Weather Watcher snaps the #supermoon in all its glory. More pics 👉 bbc.in/2fc6bNI,Timeline Photos,photo,https://www.facebook.com/bbc/photos/a.1191091087572755.1073741830.1143803202301544/1522706447744549/?type=3,2016-11-15 07:02:01,149,5,9,142,6,1,0,0,0,0
1143803202301544_1521786964503164,"Seriously, if you haven't seen this yet...where have you been?! 😱😂 👏",BBC Strictly Come Dancing,video,https://www.facebook.com/bbcstrictly/videos/10153845512176619/,2016-11-14 15:12:01,504,57,0,372,47,23,60,1,1,0
1143803202301544_1516427641705763,Trevor Nelson recalls the inspiration of seeing his #blackbritishhero Daley Thompson win gold in the 1980s. More nominations 👉 bbc.in/2fqzdwa,,video,https://www.facebook.com/bbc/videos/1516427641705763/,2016-11-14 13:42:00,6,0,1,5,1,0,0,0,0,0
1143803202301544_1521386047876589,📱Download the BBC+ app. For whatever you're into. bbc.in/2ewUG7k,BBC's cover photo,photo,https://www.facebook.com/bbc/photos/a.1151155808232950.1073741827.1143803202301544/1521385994543261/?type=3,2016-11-14 07:32:09,10,0,0,10,0,0,0,0,0,0
1143803202301544_1516437305038130,📱The new BBC+ app is here! Catch up every day on the things you love. Download it now via the App Store apple.co/2fA9I9L or Google Play bit.ly/2fFlbUa.,"BBC+, for whatever you're into",video,https://www.facebook.com/bbc/videos/1516437305038130/,2016-11-14 07:13:00,14,1,1,8,2,0,4,0,0,0
1143803202301544_1337909699575916,"As long as she gets her rewards, Mishka happily takes her inhaler. 😍 Meet the world's first known asthmatic otter.",,video,https://www.facebook.com/bbc/videos/1337909699575916/,2016-11-14 02:55:00,397,58,102,312,69,12,1,3,0,0
1143803202301544_1517907091557818,BBC Four's 'We're here because we're here' features the live nationwide memorial that captured the country's imagination in July. Tonight 8pm. #WeAreHere,Documentary 'We're here because we're here',video,https://www.facebook.com/bbc/videos/1517907091557818/,2016-11-13 05:16:00,70,1,15,62,6,1,0,1,0,0
1143803202301544_1026959260746575,"📺 Francis Barber was born a slave but died a free man in the 1700s. Meet his great, great, great, great, great grandson. #blackandbritish bbc.in/2fV6q4y",Black and British: A Forgotten History,video,https://www.facebook.com/bbc/videos/1026959260746575/,2016-11-12 12:12:00,271,6,111,246,14,10,0,1,0,0
1143803202301544_1516464591702068,Reggie Yates on why Idris Elba is his  #blackbritishhero. More hero nominations 👉 bbc.in/2fJRBPk,,video,https://www.facebook.com/bbc/videos/1516464591702068/,2016-11-12 07:01:00,45,0,8,45,0,0,0,0,0,0
1143803202301544_1480731298623297,These starlings are big believers in 'safety in numbers'. And they're not taking any chances. 😮,A murmuration of starlings over Gretna,video,https://www.facebook.com/bbc/videos/1480731298623297/,2016-11-12 04:01:00,103,2,19,87,4,11,1,0,0,0
1143803202301544_1095570110559713,"4 hours, 7 mins: the shortest day in Reykjavik. 😱 The science behind why our days get shorter and longer...",,video,https://www.facebook.com/bbc/videos/1095570110559713/,2016-11-11 08:02:00,48,0,17,42,0,6,0,0,0,0
1143803202301544_1113408425361125,"CBeebies & CBBC commissioned this 2 minute film, ‘Poppies’. 

It will be broadcast on Friday at 11am and Sunday at 11am as the channels’ act of Remembrance. For more info on why it was made, how and when to view it, visit: bbc.in/2fH5Oyp",'Poppies' for Remembrance Day,video,https://www.facebook.com/bbc/videos/1113408425361125/,2016-11-11 05:28:18,563,15,499,473,65,0,0,25,0,0
1143803202301544_1274695599217522,BBC One just knocked it out of the park. 🙌 Bear boogies to a dancefloor filler. 🎶😂Turn up the volume. 🎧 #PlanetEarth2,Dancing bear,video,https://www.facebook.com/bbc/videos/1274695599217522/,2016-11-11 03:26:00,2738,736,6113,2130,201,8,398,1,0,0
1143803202301544_10154622389486763,🎤🎶When your mum fails to recognise your own song lyrics. 😮😂 Olly Murs & his mum in 'Popstar Parents Evening'. On BBC iPlayer.,BBC Radio 1's Greg James hosts 'Popstar Parents Evening',video,https://www.facebook.com/bbc/videos/10154622389486763/,2016-11-10 13:48:50,22,1,1,22,0,0,0,0,0,0
1143803202301544_1516514191697108,"🎷🎺 Featuring Gregory Porter, Will Young & more. 96 hours of jazz for everyone, from novices to connoisseurs. #BBCMusicJazz starts today. 🎤 🎶 📻",BBC Music Jazz,video,https://www.facebook.com/bbc/videos/1516514191697108/,2016-11-10 09:21:21,7,0,3,7,0,0,0,0,0,0
1143803202301544_1515646291783898,"🎤Izzy Bizu nominates Laura Mvula as her #blackbritishhero.🎶
Get involved by nominating yours below.",,video,https://www.facebook.com/bbc/videos/1515646291783898/,2016-11-10 07:13:13,4,4,1,4,0,0,0,0,0,0
1143803202301544_1337768962923323,A heart-in-your-mouth moment you'll just want to watch again and again and again. 😮😱 Behind-the-scenes on #PlanetEarth2.,Iguana vs Snakes behind-the-scenes,video,https://www.facebook.com/bbc/videos/1337768962923323/,2016-11-10 02:42:00,336,36,109,256,7,55,3,13,2,0
1143803202301544_1272513522769063,How Ben Affleck & his son accidentally bumped into British royalty. 😂 👑,Ben Affleck on an unexpected encounter,video,https://www.facebook.com/bbc/videos/1272513522769063/,2016-11-09 13:32:00,1005,14,49,874,27,0,104,0,0,0
1143803202301544_1514335735248287,Today the BBC launches #blackbritishhero – a month of content celebrating black Britons who've made a big impact on our society. Get involved by nominating your #blackbritishhero. bbc.in/2fy0MBF,,video,https://www.facebook.com/bbc/videos/1514335735248287/,2016-11-09 08:02:00,10,1,6,10,0,0,0,0,0,0
1143803202301544_10154621845931763,"BBC Radio 1 DJs take on the #MannequinChallenge, with a little help from Cookie Monster. 🍪 😂",BBC Radio 1 does the #MannequinChallenge,video,https://www.facebook.com/bbc/videos/10154621845931763/,2016-11-09 07:02:00,62,2,5,56,2,0,4,0,0,0
1143803202301544_10157586491955459,BBC Radio 4 explains the origin and enduring appeal of the American flag.🇺🇸,How The Stars and Stripes became an emotional symbol of a nation,video,https://www.facebook.com/bbc/videos/10157586491955459/,2016-11-07 04:48:00,22,1,13,22,0,0,0,0,0,0
1143803202301544_10154215127270787,"12 year old Campbell, from Australia, taught himself to sew, and has made over 800 bears for children in hospital. 🐻 

He believes that always being kind would change the world a lot. A simply Amazing Human.

Via BBC Three.",Amazing Humans: Campbell,video,https://www.facebook.com/bbc/videos/10154215127270787/,2016-11-07 02:32:00,2277,73,959,1668,540,65,2,1,1,0
1143803202301544_1105724639462837,Sir David Attenborough investigates the creatures at CBeebies' 'The Furchester Hotel'. Is this the next Planet Earth? 🌍🐤🌍,David Attenborough at The Furchester Hotel,video,https://www.facebook.com/bbc/videos/1105724639462837/,2016-11-06 14:26:00,23,0,6,21,2,0,0,0,0,0
1143803202301544_10154603768186763,"A year ago on BBC Radio 1, Greg James convinced Sir David Attenborough to narrate Adele's 'Hello'. 😍

Planet Earth II returns tonight at 8pm on BBC One.",When Sir David Attenborough narrated Adele's Hello,video,https://www.facebook.com/bbc/videos/10154603768186763/,2016-11-06 06:19:00,21297,1836,9832,15624,2933,57,2673,4,1,5
1143803202301544_1509249215756939,You won't believe your eyes. 👀 🖍 CBBC's Blue Peter step-by-step make for Bonfire Night. 🙌 🎉 🔥,A Blue Peter make for Bonfire Night,video,https://www.facebook.com/bbc/videos/1509249215756939/,2016-11-05 04:12:00,44,4,16,41,2,1,0,0,0,0
1143803202301544_1509161195765741,"Across TV, radio & online we're encouraging everyone to put aside some time to curl up with a book this weekend. #LovetoRead 📚
bbc.in/2foSNWu",BBC's cover photo,photo,https://www.facebook.com/bbc/photos/a.1151155808232950.1073741827.1143803202301544/1509161139099080/?type=3,2016-11-04 09:51:37,29,2,13,28,1,0,0,0,0,0
1143803202301544_1508004965881364,Prankster Jack Jones TV has been up to his old tricks! 😂 This time it's all in the name of the BBC's #LovetoRead season. 📖 🙌,Jack Jones plays pranks for #LovetoRead,video,https://www.facebook.com/bbc/videos/1508004965881364/,2016-11-04 07:02:00,407,24,57,355,14,1,34,1,2,0
1143803202301544_1508795662468961,Do ink pens and handwritten signatures belong in a museum? 🖋,Has the hand-written signature had its day?,link,http://bbc.in/2ednblt,2016-11-04 03:00:05,13,4,2,9,0,0,0,4,0,0
1143803202301544_1507585662589961,📚 In need of some serious chill time this weekend? 🙌 Take a page out of Alesha Dixon's book. 📖  #LovetoRead bbc.in/2eXHPKj,,video,https://www.facebook.com/bbc/videos/1507585662589961/,2016-11-04 02:52:00,284,18,11,258,15,2,9,0,0,0
1143803202301544_10154603331856763,🎤🎶 Adele's 'All I Ask'...with a Bruno Mars twist to it. 😎 🙌 🙌 🙌  More 👉 bbc.in/2fkV6tq,Bruno Mars on BBC Radio 1's Live Lounge,video,https://www.facebook.com/bbc/videos/10154603331856763/,2016-11-03 14:47:00,97,9,23,78,19,0,0,0,0,0
1143803202301544_1267463103274105,"Tonight's the night.🙌 Michael Bublé at the BBC.

BBC One, 8pm.",Bublé at the BBC,video,https://www.facebook.com/bbc/videos/1267463103274105/,2016-11-03 05:07:36,99,12,37,83,14,1,1,0,0,0
1143803202301544_1266902799996802,"6 episodes. 6 habitats. Your Planet Earth... closer than ever before. 
#PlanetEarth2, narrated by Sir David Attenborough starts this Sunday. 8pm. BBC One.",Planet Earth II,video,https://www.facebook.com/bbc/videos/1266902799996802/,2016-11-03 04:45:00,118,15,38,104,11,2,1,0,0,0
1143803202301544_314815132224857,"📺 80 years ago today, 'lookers in' 👀 (as TV viewers were then called!) witnessed the launch of the BBC's television service. 🙌",Marking 80 years of BBC Television,video,https://www.facebook.com/bbc/videos/314815132224857/,2016-11-02 12:01:00,82,4,36,79,3,0,0,0,0,0
1143803202301544_1506493902699137,📺 Meet the new presenters joining the BBC Watchdog team. Series starts tonight 8pm BBC One. bbc.in/2fvkrGh,New series of Watchdog,video,https://www.facebook.com/bbc/videos/1506493902699137/,2016-11-02 09:44:00,21,4,10,21,0,0,0,0,0,0
1143803202301544_1265935343426881,"""Hi I'm Benedict... but you can call me Big Ben."" 😯

Benedict Cumberbatch, Eddie Redmayne and Bryan Cranston try out their best (and rudest!) chat-up lines. #TheGNShow on BBC One.","Benedict Cumberbatch, Eddie Redmayne and Bryan Cranston's chat...",video,https://www.facebook.com/bbc/videos/1265935343426881/,2016-11-02 06:05:00,489,79,106,343,51,0,95,0,0,0
1143803202301544_10154200016200787,"BBC Three meets Gabi Shull, a dancer who had her leg amputated and her foot reattached backwards as a knee joint. She's an Amazing Human.💃

Do you have an Amazing Human in your life?",Amazing Human: Gabi Shull,video,https://www.facebook.com/bbc/videos/10154200016200787/,2016-11-02 02:48:00,574,23,199,443,65,63,0,3,0,0
1143803202301544_1505230559492138,📺 The enduring relationship between Britain & the peoples whose origins lie in Africa. David Olusoga's  BBC Two series headlines the BBC's #BlackAndBritish season. bbc.in/2fB7h9O,Black and British: A Forgotten History,video,https://www.facebook.com/bbc/videos/1505230559492138/,2016-11-01 13:01:40,27,0,14,27,0,0,0,0,0,0
1143803202301544_1017032948405873,"📺 Greenland’s ice sheet is losing 110,000 swimming pools of water every year. #ArcticLive tonight 8pm BBC Two.",Arctic Live: Global Warming,video,https://www.facebook.com/bbc/videos/1017032948405873/,2016-11-01 12:22:21,105,7,76,68,1,8,0,26,2,0
1143803202301544_1505304046151456,"📺 BBC One's long-awaited 'Planet Earth II', presented by Sir David Attenborough, starts Sunday 8pm. 🙌 🐯 bbc.in/2ew1T3F",BBC's cover photo,photo,https://www.facebook.com/bbc/photos/a.1151155808232950.1073741827.1143803202301544/1505303972818130/?type=3,2016-11-01 10:38:16,292,24,48,251,36,5,0,0,0,0
1143803202301544_1500530969962097,"Introducing Conor Maynard. Singer, actor...and bookworm. Yes, really. 🙌 📚 More on #LovetoRead 👉 bbc.in/2f9f36l",Get recommendations & send us your book selfies,video,https://www.facebook.com/bbc/videos/1500530969962097/,2016-11-01 02:52:00,3094,469,346,2703,350,3,35,3,0,0
1143803202301544_1503821136299747,"🎃 👻 A bone-chilling forecast from BBC Weather. ⚡️If you're a scaredy-cat, turn away now. 😱🐱",BBC Weather's gone spooky,video,https://www.facebook.com/bbc/videos/1503821136299747/,2016-10-31 07:12:00,141,12,28,102,1,6,32,0,0,0
1143803202301544_1013201562122345,"🎤 Hopefuls from all walks of life in Gareth Malone's new BBC Two series, 'The Choir'. 😂 🎧",'The Choir: Gareth's Best in Britain' starts 9pm Tuesday,video,https://www.facebook.com/bbc/videos/1013201562122345/,2016-10-30 03:12:00,90,2,14,75,7,0,8,0,0,0
1143803202301544_10154183254175787,"'Age is just a number' (her own words!) 🐾 Meet Sally, the pawsome 97-year-old dog walker turned internet star. 🐶❤️",The world's most famous dog walker?,video,https://www.facebook.com/bbc/videos/10154183254175787/,2016-10-28 01:41:00,1021,58,401,824,165,31,1,0,0,0
1143803202301544_1499398533408674,Had a bad day? 😱 Funny animal pics are just what you need. 🐰🐧,There photos will make you feel cheery in no time,link,http://bbc.in/2eRhWKb,2016-10-27 11:06:05,210,11,63,179,5,1,25,0,0,0
1143803202301544_1181179118642261,"🕷Trying to hog the limelight or what? 😮 If there's such a thing as a beautiful creepy-crawly, this is surely it... 👀 #Autumnwatch","Once thought extinct, ladybird spiders are back!",video,https://www.facebook.com/bbc/videos/1181179118642261/,2016-10-27 06:17:25,99,3,40,80,9,10,0,0,0,0
1143803202301544_1260163084004107,📺 For one lucky baker tonight will be the icing on the cake. 🍰 Grab your spot on the sofa for the #GBBOFinal. 8pm on BBC One.,The Final of The Great British Bake Off,video,https://www.facebook.com/bbc/videos/1260163084004107/,2016-10-26 11:01:00,33,2,3,30,3,0,0,0,0,0
1143803202301544_1497948716886989,Keep up to date on all the latest from RSPB Arne with the BBC Springwatch Autumnwatch team: http://bbc.in/2eQuEYy 🍂,BBC's cover photo,photo,https://www.facebook.com/bbc/photos/a.1151155808232950.1073741827.1143803202301544/1497948670220327/?type=3,2016-10-26 06:23:56,30,0,3,29,1,0,0,0,0,0
1143803202301544_1490910460924148,"Black and British. Bold, vibrant and provocative – a landmark season of programming across the BBC. #blackandbritish bbc.in/2eG6RNc",Black and British: a landmark season across the BBC,video,https://www.facebook.com/bbc/videos/1490910460924148/,2016-10-26 06:08:00,869,55,1885,757,112,0,0,0,0,0
1143803202301544_1496821746999686,"Singer Tom Parker, as you've never seen him before. 😮 🙌 Go on, take a leaf out of his book. 📚 👉 #LovetoRead ❤️ bbc.in/2ergtia",BBC Love to Read,video,https://www.facebook.com/bbc/videos/1496821746999686/,2016-10-26 01:52:00,1159,199,244,971,182,0,5,0,1,0
1143803202301544_10154570816516763,The crowd went wild. 😱❤️ Obviously. 🙌 When Niall Horan turned up at BBC Radio 1's #R1TeenAwards...🎤,NIALL HORAN makes a surprise appearance,video,https://www.facebook.com/bbc/videos/10154570816516763/,2016-10-25 11:21:00,13,2,2,13,0,0,0,0,0,0
1143803202301544_10154570761021763,🎤 Shawn Mendes at BBC Radio 1's #R1TeenAwards. A seriously WOW moment. 😍,Shawn Mendes - Mercy - Radio 1 Teen Awards,video,https://www.facebook.com/bbc/videos/10154570761021763/,2016-10-24 11:10:54,39,2,3,35,4,0,0,0,0,0
1143803202301544_1495659170449277,"Celebrate the pleasure of reading with the BBC.
bbc.in/2eK3QKQ
#LovetoRead",BBC's cover photo,photo,https://www.facebook.com/bbc/photos/a.1151155808232950.1073741827.1143803202301544/1495659060449288/?type=3,2016-10-24 05:48:19,28,0,4,25,3,0,0,0,0,0
1143803202301544_1493184480696746,🎶 The perfect lazy Saturday morning activity. 🙌 🛌,Quiz: guess what BBC Radio 1 DJs got up to as teens,link,http://bbc.in/2eOcxr3,2016-10-22 03:46:05,2,0,1,2,0,0,0,0,0,0
1143803202301544_10154560483816763,🎸ICYMI: Kings Of Leon covering Selena Gomez. Watch their incredible BBC Radio 1 Live Lounge 👉 bbc.in/2e6RsGj,Kings of Leon in the Live Lounge,video,https://www.facebook.com/bbc/videos/10154560483816763/,2016-10-22 02:05:00,33,0,1,32,1,0,0,0,0,0
1143803202301544_1490111804337347,"📚 Alesha Dixon, Conor Maynard, Katie Melua & other famous faces launch the BBC's #LovetoRead  campaign. 📖 Get involved & find out more: bbc.in/2emshi9",,video,https://www.facebook.com/bbc/videos/1490111804337347/,2016-10-21 01:52:00,471,14,222,397,64,2,8,0,0,0
1143803202301544_1037199129735245,🐶 When CBBC's Hacker T Dog 'interviewed' Team GB and ParalympicsGB heroes. Pure gold. 🏅😂,Hacker gatecrashes the Heroes Parade,video,https://www.facebook.com/bbc/videos/1037199129735245/,2016-10-20 06:02:00,23,0,2,18,3,0,2,0,0,0
1143803202301544_1490853930929801,"Joining us this morning is Lee Child, author of the Jack Reacher novels discussing writing and his love of books. Send us your questions. #LovetoRead",,video,https://www.facebook.com/bbc/videos/1490853930929801/,2016-10-20 03:34:16,121,29,43,99,19,2,1,0,0,0
1143803202301544_1490824097599451,"📚 Join us at 9.30am today for a Facebook LIVE with Lee Child, author of the Jack Reacher novels. Send us your questions below. #LovetoRead 👇",Timeline Photos,photo,https://www.facebook.com/bbc/photos/a.1191091087572755.1073741830.1143803202301544/1490824097599451/?type=3,2016-10-20 02:47:01,16,2,1,16,0,0,0,0,0,0
1143803202301544_1876911152528268,Do we even know what's real or fake anymore? Adam Curtis' HyperNormalisation. Now on BBC iPlayer. bbc.in/2eplYIo,HyperNormalisation,video,https://www.facebook.com/bbc/videos/1876911152528268/,2016-10-19 15:02:00,120,16,54,112,7,0,0,1,0,0
1143803202301544_1488926351122559,📻 New presenters & shows are coming to BBC Asian Network. bbc.in/2ehhvZH,BBC Asian Network announcement,video,https://www.facebook.com/bbc/videos/1488926351122559/,2016-10-19 13:21:00,13,0,1,13,0,0,0,0,0,0
1143803202301544_1490186254329902,"📚 Join us tomorrow morning for a Facebook LIVE with Lee Child, author of the Jack Reacher novels. Send us your questions. 👇#LovetoRead",Timeline Photos,photo,https://www.facebook.com/bbc/photos/a.1191091087572755.1073741830.1143803202301544/1490186254329902/?type=3,2016-10-19 12:11:22,6,0,3,6,0,0,0,0,0,0
1143803202301544_1488691594479368,Turning over a new leaf is no mean feat. The science behind those autumnal shades. 🍂,Ever wondered why leaves change colour?,video,https://www.facebook.com/bbc/videos/1488691594479368/,2016-10-19 01:48:00,52,2,34,51,1,0,0,0,0,0
1143803202301544_1487405091274685,Parade to celebrate the stars of Team GB and ParalympicsGB this afternoon in Manchester.  🙌,Live coverage starts at 4.15pm on BBC One,link,http://bbc.in/2e0FOz8,2016-10-17 06:22:11,16,0,2,15,1,0,0,0,0,0
1143803202301544_1482719201743274,When daddy protects you from the baddies. And wins. 👏 'Animal Babies' on BBC One.,Gorilla guard in BBC One's 'Animal Babies',video,https://www.facebook.com/bbc/videos/1482719201743274/,2016-10-17 01:41:00,80,1,20,67,12,1,0,0,0,0
1143803202301544_1484088428273018,📺 Secrets unravel in the new series of 'Ordinary Lies'. Starts Tuesday 9pm on BBC One.,New series of 'Ordinary Lies',video,https://www.facebook.com/bbc/videos/1484088428273018/,2016-10-16 14:22:00,23,1,2,23,0,0,0,0,0,0
1143803202301544_1484137221601472,📺 Great cities & landscapes that have inspired some of our most-loved books. 📚 'Books That Made Britain' on BBC One at 3.45pm. #LovetoRead,Chris Packham's book recommendation,video,https://www.facebook.com/bbc/videos/1484137221601472/,2016-10-16 07:12:00,32,0,5,28,4,0,0,0,0,0
1143803202301544_1483840151631179,"'Nigel Mole'. Doesn't have quite the same ring to it, does it? 'The Secret Life of Sue Townsend (Aged 68 3/4)'. Tonight 9pm BBC Two. 📚✒️",Stephen Mangan uncovers hand-written manuscripts,video,https://www.facebook.com/bbc/videos/1483840151631179/,2016-10-15 11:12:00,19,0,2,18,1,0,0,0,0,0
