status_id,status_message,link_name,status_type,status_link,status_published,num_reactions,num_comments,num_shares,num_likes,num_loves,num_wows,num_hahas,num_sads,num_angrys,num_special
1143803202301544_1705492212808323,Recognise any of these furry faces? 🐻 Staff at Glasgow airport are trying to reunite lost teddies with the young travellers who left them behind. (Via BBC Scotland News),Lost cuddly toys at Glasgow Airport,video,https://www.facebook.com/bbc/videos/1705492212808323/,2017-09-21 06:23:00,297,13,115,214,65,1,2,15,0,0
1143803202301544_1316372638471901,"These remote tribes from around the world have never seen Morris Dancing before.

Their reaction is just brilliant... (Via BBC Two)",Seeing Morris Dancing for the first time,video,https://www.facebook.com/bbc/videos/1316372638471901/,2017-09-20 09:24:00,504,61,164,362,64,4,72,0,1,1
1143803202301544_1719534951398957,"""How I conquered the world's hardest cliff."" 

King of climbing, Adam Ondra describes his toughest challenge. (Via BBC World Service)",The man who climbed 'the world's hardest cliff',video,https://www.facebook.com/bbc/videos/1719534951398957/,2017-09-19 05:05:00,209,29,46,180,8,20,0,1,0,0
1143803202301544_10155457478635659,Is enough being done to tackle mental health issues at university? (Via BBC Stories),,video,https://www.facebook.com/bbc/videos/10155457478635659/,2017-09-18 12:45:00,101,10,47,79,11,1,0,9,0,1
1143803202301544_1572141659515562,"An inspiring story about breaking free from labels & stereotypes. 🎓 
(Via BBC Family & Education News)",The blind refugee Cambridge graduate,video,https://www.facebook.com/bbc/videos/1572141659515562/,2017-09-17 13:15:00,1099,19,297,853,198,43,0,2,0,3
1143803202301544_10156764671459968,"⛷🤸‍♂️ Swiss skier Andri Ragettli's acrobatic skills are UNREAL!
(Via Newsbeat)",Amazing skills from 19-year-old skier Andri Ragettli,video,https://www.facebook.com/bbc/videos/10156764671459968/,2017-09-17 11:12:01,1427,152,488,1037,47,338,3,0,0,2
1143803202301544_1713203088698810,They both changed gymnastics - but 40 years apart. 🤸 (Via BBC World Service),The Gymnasts in Conversation,video,https://www.facebook.com/bbc/videos/1713203088698810/,2017-09-16 08:33:00,255,5,122,214,36,4,0,0,0,1
1143803202301544_10155448107660659,"Proving I'm more than 'that girl from Alton Towers'.
(Via BBC Stories)",,video,https://www.facebook.com/bbc/videos/10155448107660659/,2017-09-16 06:03:00,226,9,18,192,26,7,0,1,0,0
1143803202301544_1929953643686492,"‘These individuals care more about their families than they do themselves.'

Prince Harry meets the inspirational ex-servicemen & women competing at the 2017 Invictus Games.",Battle to the Start Line,video,https://www.facebook.com/bbc/videos/1929953643686492/,2017-09-16 04:50:24,337,11,60,266,68,2,0,0,0,1
1143803202301544_10155545847807696,"TJILI is 16 years old and an amazing artist. She also has cerebral palsy and is profoundly deaf. 🎨❤️️
(Via The One Show)",,video,https://www.facebook.com/bbc/videos/10155545847807696/,2017-09-15 11:03:02,262,5,59,219,50,22,1,1,0,-31
1143803202301544_1604509759569436,"""It's every parent's worst nightmare""
Benedict Cumberbatch on The Child In Time.

More from Benedict here: bbc.in/2wZsWAJ",Benedict Cumberbatch on The Child In Time,video,https://www.facebook.com/bbc/videos/1604509759569436/,2017-09-15 04:15:00,254,41,57,266,20,3,0,52,0,-87
1143803202301544_1690619830971566,"This is what a healthy reef looks like. 🐠

(Via BBC Earth & BBC Two)","Tribes, Predators & Me: Shark People of the Pacific",video,https://www.facebook.com/bbc/videos/1690619830971566/,2017-09-14 12:36:28,420,19,96,335,69,16,0,0,0,0
1143803202301544_1310862799022885,"Want to travel the globe in less than a minute? 😍🌇
(Via BBC Two)",Time Lapse Tour: World's Busiest Cities,video,https://www.facebook.com/bbc/videos/1310862799022885/,2017-09-13 14:20:00,49,1,18,43,4,0,0,2,0,0
1143803202301544_476742792691881,"Wayne is cleaning up Britain, one beach at a time. 🏖🗑 (Via BBC News)",Wayne's walk,video,https://www.facebook.com/bbc/videos/476742792691881/,2017-09-13 11:02:00,784,48,175,632,133,19,0,0,0,0
1143803202301544_1600960963257649,"When love turns sour, revenge tastes sweet. 

The battle lines have been drawn. And #DoctorFoster won't go down without a fight. (Via BBC One)",Doctor Foster: Episode Two Trailer,video,https://www.facebook.com/bbc/videos/1600960963257649/,2017-09-12 12:35:00,36,2,10,34,0,2,0,0,0,0
1143803202301544_10155126746660787,Yoga changed 9-year-old Daniel's life. ❤️️ (Via BBC Three),,video,https://www.facebook.com/bbc/videos/10155126746660787/,2017-09-12 04:04:00,1069,72,738,799,253,16,0,1,0,0
1143803202301544_1488916597865592,What an adventure! This family took four years to travel the world together in a truck. ❤️️ (Via BBC South Today),The family who travelled the world,video,https://www.facebook.com/bbc/videos/1488916597865592/,2017-09-11 09:35:00,892,99,267,698,127,67,0,0,0,0
1143803202301544_1923111814370675,"⚓️🇬🇧 Rule, Britannia! Britannia, rule the waves. 🇬🇧⚓️ #BBCProms #LNOP",,video,https://www.facebook.com/bbc/videos/1923111814370675/,2017-09-09 16:24:16,321,62,66,253,57,4,4,1,2,0
1143803202301544_1922597447755445,The Proms Podcast is live with Vikki Stone at BBC Proms in the Park with piano virtuoso & YouTube sensation Peter Bence #LNOP,,video,https://www.facebook.com/bbc/videos/1922597447755445/,2017-09-09 06:23:37,62,7,25,52,10,0,0,0,0,0
1143803202301544_1540045239390853,Creepy or awesome? 🤖 (Via BBC Future),Meet Sophia the robot,video,https://www.facebook.com/bbc/videos/1540045239390853/,2017-09-09 04:02:00,442,79,328,304,19,109,8,1,1,0
1143803202301544_1382273375227817,Here's what happened when Dani Harmer sat down to watch back the first ever episode of Tracy Beaker! 😂 (Via CBBC),Dani Harmer watches back the first ever Tracy Beaker 👌,video,https://www.facebook.com/bbc/videos/1382273375227817/,2017-09-08 09:35:00,180,66,29,156,17,0,7,0,0,0
1143803202301544_1920597507955439,We're just so proud. 😢❤️️,6 Ways BBC Three is Winning,video,https://www.facebook.com/bbc/videos/1920597507955439/,2017-09-07 11:22:00,27,3,2,26,1,0,0,0,0,0
1143803202301544_10155792094083648,"Should every child have to wear trousers to school? This headteacher has introduced a ""gender neutral"" uniform. (Via BBC South East Today)",,video,https://www.facebook.com/bbc/videos/10155792094083648/,2017-09-07 06:15:00,486,198,62,372,25,7,24,6,52,0
1143803202301544_1919476881400835,This is the view from a plane flying through Hurricane Irma. 🌧 Via BBC Weather.,This what Hurricane Irma looks like from a plane,video,https://www.facebook.com/bbc/videos/1919476881400835/,2017-09-06 13:05:00,123,10,48,58,1,59,0,5,0,0
1143803202301544_1707352005950585,"Scientists 'amazed' 1970s space probe Voyager 1 still works, 40 years after launch! (Via BBC World Service)",Experts 'amazed' by 1970s spacecraft,video,https://www.facebook.com/bbc/videos/1707352005950585/,2017-09-06 04:46:29,374,9,180,306,39,29,0,0,0,0
1143803202301544_10155646965738895,Previously unseen sketches of Winnie-the-Pooh reveal the true inspiration behind A.A. Milne's famous bear. (Via The Today Programme),The true inspiration behind Winnie the Pooh,video,https://www.facebook.com/bbc/videos/10155646965738895/,2017-09-05 08:57:00,406,33,139,317,78,9,2,0,0,0
1143803202301544_10155603991661763,"What a beautiful way to start the week. 💛 

Coldplay's Chris Martin performs 'Yellow' for BBC Radio 1 Live Lounge Month.",Chris Martin performs for Radio 1's Live Lounge Month,video,https://www.facebook.com/bbc/videos/10155603991661763/,2017-09-04 13:35:00,159,9,33,127,30,1,1,0,0,0
1143803202301544_10155416483700659,"""We need more raves""

Shane, an aspiring DJ, is looking forward to going to his first ever rave for people with learning disabilities. (Via BBC Stories)",,video,https://www.facebook.com/bbc/videos/10155416483700659/,2017-09-04 12:14:00,443,45,104,356,83,2,0,1,1,0
1143803202301544_1594343250586087,"When this #DoctorFoster scene aired 2 years ago, 10 million people squirmed on their sofas.

Most. Awkward. Dinner. Party. Ever. (Via BBC One)",Doctor Foster: Dinner Party Revenge,video,https://www.facebook.com/bbc/videos/1594343250586087/,2017-09-03 10:46:33,610,100,55,517,68,18,7,0,0,0
1143803202301544_1702452169773902,This telescope sees stars and planets being born. ✨ (Via BBC World Service),Seeing the birth of solar systems,video,https://www.facebook.com/bbc/videos/1702452169773902/,2017-09-03 03:54:00,156,2,42,141,5,10,0,0,0,0
1143803202301544_10155513142137696,"Nujeen wants the world to know she is not just a number, but a human. (Via The One Show)",,video,https://www.facebook.com/bbc/videos/10155513142137696/,2017-09-02 09:26:00,134,1,18,114,10,1,0,9,0,0
1143803202301544_10159157812305459,"This is how you swear like a Swede. (You'll want your 🔊 on for this)! 

Via BBC Radio 4",How to swear like a Swede,video,https://www.facebook.com/bbc/videos/10159157812305459/,2017-09-02 07:36:00,2929,1146,3128,1787,130,5,1007,0,0,0
1143803202301544_1480501735373745,The sea of discarded tents at the Reading Festival site are now helping the homeless. (Via BBC South Today),Festival-goers 'rubbish' helping the homeless,video,https://www.facebook.com/bbc/videos/1480501735373745/,2017-09-01 04:21:00,436,69,86,356,39,28,0,7,6,0
1143803202301544_1300203870088778,What happens when you only get one day off a week... but you have nowhere to go? (Via BBC Two),The Women With Nowhere To Go,video,https://www.facebook.com/bbc/videos/1300203870088778/,2017-08-31 02:03:00,5848,436,14638,4350,105,329,15,1017,32,0
1143803202301544_1700384826647303,From refugee to $3m businessman: This Syrian man is making millions from shoes. 👡 (via BBC World Service),The Syrian refugee earning millions from shoes,video,https://www.facebook.com/bbc/videos/1700384826647303/,2017-08-30 07:23:10,92,5,13,82,3,6,1,0,0,0
1143803202301544_1299472266828605,This looks terrifying. Could you escape from a capsule submerged underwater? 🌊,Could you escape from an underwater capsule? | Astronauts,video,https://www.facebook.com/bbc/videos/1299472266828605/,2017-08-30 04:48:00,66,19,28,58,0,7,1,0,0,0
1143803202301544_1839465786067551,A dancing policeman has become the star of this year's #NottingHillCarnival after this video went viral. 💃,,video,https://www.facebook.com/bbc/videos/1839465786067551/,2017-08-29 13:46:00,778,42,147,611,99,11,57,0,0,0
1143803202301544_10155428544566265,"Ba-ba-ba-baaaaaaaa 🎶

Beethoven's Symphony No 5, courtesy of BBC Proms: http://www.bbc.co.uk/programmes/p0581k9v",,video,https://www.facebook.com/bbc/videos/10155428544566265/,2017-08-29 11:38:00,106,14,14,86,12,5,3,0,0,0
1143803202301544_10155089636145787,"Meet Sally, the pawsome 97-year-old dog walker. 🐶❤️ (Via BBC Three)",The world's most famous dog walker?,video,https://www.facebook.com/bbc/videos/10155089636145787/,2017-08-29 07:13:00,1064,89,1611,790,250,24,0,0,0,0
1143803202301544_1490121554414681,When you've had an extra day off but feel even more exhausted than usual. 😴 (Via BBC Springwatch),Sleepy little owl,video,https://www.facebook.com/bbc/videos/1490121554414681/,2017-08-29 01:55:00,1043,133,380,750,153,1,139,0,0,0
1143803202301544_10156704963739968,"British sign language interpreters helped deaf or hard of hearing fans at Reading Festival enjoy music sets more. Amazing. 🙌

(Via Newsbeat)","Kate, a sign language interpreter at Reading Festival",video,https://www.facebook.com/bbc/videos/10156704963739968/,2017-08-28 15:01:25,451,32,155,348,93,7,3,0,0,0
1143803202301544_1295759427199889,BREAKING: A Northerner has been accused of terrifying Londoners by walking around saying hello... (Via BBC Two),Northerner Accused of Saying Hello in London,video,https://www.facebook.com/bbc/videos/1295759427199889/,2017-08-28 08:35:00,749,121,392,421,17,3,305,2,1,0
1143803202301544_1951700368386990,There are already 166 million pieces of space debris. Are we turning space in to a scrapyard?,Have we trashed space?,video,https://www.facebook.com/bbc/videos/1951700368386990/,2017-08-28 06:34:00,119,27,60,79,0,22,0,11,7,0
1143803202301544_1674796979220518,"This little bird uses a ridiculously cute technique to catch its dinner. 🐛

(#EarthCapture by Greg Gard via BBC Earth)",Earth Capture: Piping Plover,video,https://www.facebook.com/bbc/videos/1674796979220518/,2017-08-27 13:08:00,400,31,108,330,56,5,9,0,0,0
1143803202301544_1674745849225631,"👀  Your eyes probably are deceiving you. This moth, is a bat! (Via BBC Earth)",The painted bat,video,https://www.facebook.com/bbc/videos/1674745849225631/,2017-08-27 09:51:00,457,41,433,333,54,69,1,0,0,0
1143803202301544_10155386095335659,These girls grew up as sex workers' daughters in Mumbai's red light district. Now they're telling their stories at Edinburgh Festival Fringe. (Via BBC Stories),"""My background can never be my weakness""",video,https://www.facebook.com/bbc/videos/10155386095335659/,2017-08-26 14:03:00,1135,33,623,823,179,11,0,119,3,0
1143803202301544_1695657020453417,This is the 'Land of the Mutts' - a place in Costa Rica which more than 600 rescued dogs call home. Happy #NationalDogDay!,'Land of the Mutts',video,https://www.facebook.com/bbc/videos/1695657020453417/,2017-08-26 06:48:00,355,57,101,271,70,13,0,0,1,0
1143803202301544_10155077636295787,"BBC Three meets Gabi Shull, a dancer who had her leg amputated and her foot reattached backwards as a knee joint. 💃",Amazing Human: Gabi Shull,video,https://www.facebook.com/bbc/videos/10155077636295787/,2017-08-25 01:31:00,1372,42,455,958,215,191,1,7,0,0
1143803202301544_1833450393351384,"Could gingers be the last great mythical creatures of the British Isles?

From Alasdair Beckett-King at BBC at the Edinburgh Festivals 😂 (Via BBC Scotland)",Short Stuff - Fringe Funnies - Alasdair Beckett-King,video,https://www.facebook.com/bbc/videos/1833450393351384/,2017-08-24 15:27:00,807,170,519,488,36,0,283,0,0,0
1143803202301544_10155383124275659,“You’re never too old to start a new life.” Be inspired - Charles took up sprinting at 95! (Via BBC Stories),"Charles, a world athletics champion at 97.",video,https://www.facebook.com/bbc/videos/10155383124275659/,2017-08-24 10:15:10,4267,468,12003,3170,855,213,9,19,1,0
1143803202301544_1512872968769804,"Would your child know what to do in an emergency? 

Listen to this as little Emma from Nailsea called for help for her mum. 👏 (Via BBC Radio Bristol)",,video,https://www.facebook.com/bbc/videos/1512872968769804/,2017-08-24 07:38:01,119453,9625,51193,81769,32462,4716,56,441,8,1
1143803202301544_1956309904626796,This is how to keep mums in work.👇(Via BBC World Hacks),Meet the female doctors practising from home,video,https://www.facebook.com/bbc/videos/1956309904626796/,2017-08-24 03:53:49,373,9,100,330,34,9,0,0,0,0
1143803202301544_10155036334922217,"Prince Harry has some harsh words for the paparazzi, 20 years on from his mother, Princess Diana's death.

bbc.in/2w1TQVK",Harry criticises paparazzi for not helping Diana,video,https://www.facebook.com/bbc/videos/10155036334922217/,2017-08-23 15:03:00,514,35,54,192,20,8,2,273,19,0
1143803202301544_1629760017055054,"Three massive sharks have been spotted by a kayaker near the Isle of Man!
(Via BBC North West)",,video,https://www.facebook.com/bbc/videos/1629760017055054/,2017-08-23 11:43:00,371,102,53,250,34,83,2,2,0,0
1143803202301544_10159116777385459,"What advice would you give to your younger self? BBC Woman's Hour asked Elisabeth Moss, Mary Portas and more. 💕 (Via BBC Radio 4)",,video,https://www.facebook.com/bbc/videos/10159116777385459/,2017-08-23 07:07:00,778,88,617,658,118,0,2,0,0,0
1143803202301544_10156683719889968,"Oops. 

(Via Newsbeat)",Motorist using mobile phone doesn't notice massive sinkhole,video,https://www.facebook.com/bbc/videos/10156683719889968/,2017-08-22 14:54:00,91,12,37,58,0,28,5,0,0,0
1143803202301544_10155072042890787,The 23 year old on a mission to solve the world's plastic problem. (Via BBC Three),The contraption on a mission to clean the world's oceans,video,https://www.facebook.com/bbc/videos/10155072042890787/,2017-08-22 08:15:44,516,14,406,439,58,17,0,1,1,0
1143803202301544_1582274381792974,Cormoran Strike is not your average private investigator. (Via BBC One),Strike - The Cuckoo's Calling Trail,video,https://www.facebook.com/bbc/videos/1582274381792974/,2017-08-22 04:31:00,288,59,63,243,31,13,1,0,0,0
1143803202301544_1670914776275405,These orphaned baby otters are learning to swim and it is otterly adorable... 😍,Natural World: Orphaned otters learn to swim,video,https://www.facebook.com/bbc/videos/1670914776275405/,2017-08-21 10:39:00,407,72,67,308,97,2,0,0,0,0
1143803202301544_1289177547858077,"Meet Hunter, the puppy helping four-year-old Alfie cope with his autism. 🐶 (Via BBC Two)",Hunter the Therapy Dog | 10 Puppies And Us,video,https://www.facebook.com/bbc/videos/1289177547858077/,2017-08-20 03:25:00,554,44,76,424,128,2,0,0,0,0
1143803202301544_1579391472081265,A wild orangutan takes on a carpentry challenge. And wins. (Via BBC One),Amazing orangutan masters a saw,video,https://www.facebook.com/bbc/videos/1579391472081265/,2017-08-19 10:04:45,1385,126,584,1039,154,164,28,0,0,0
1143803202301544_1894676377214219,This orangutan mother and her child have a very special bond. 💕 #OrangutanDay,,video,https://www.facebook.com/bbc/videos/1894676377214219/,2017-08-19 05:05:00,81,3,14,65,14,1,0,1,0,0
1143803202301544_1894518180563372,This cat adopted a puppy in need. ❤️,,video,https://www.facebook.com/bbc/videos/1894518180563372/,2017-08-17 07:28:00,1269,106,248,900,337,23,3,6,0,0
1143803202301544_1671733459517532,There is a new World Pipe Band Champion - and they are Scottish! Congratulations to Inveraray & District Pipe Band. (Via BBC Scotland News),Scots band triumphs at World Pipe Band Championships,video,https://www.facebook.com/bbc/videos/1671733459517532/,2017-08-16 04:32:00,249,22,51,206,34,7,2,0,0,0
1143803202301544_1663396690397430,"😍 What's better than one custard biscuit? Two custard biscuits filled with rhubarb ripple ice cream, eh Nadiya Hussain?",Nadiya's rhubarb and custard ice cream sandwiches,video,https://www.facebook.com/bbc/videos/1663396690397430/,2017-08-16 02:17:00,129,26,19,108,15,6,0,0,0,0
1143803202301544_1287717258004106,"Sweet or savoury?

The stars of all-new #CookingShowdown are quizzed by BBC Two...",Cooking Showdown Q&A,video,https://www.facebook.com/bbc/videos/1287717258004106/,2017-08-15 14:21:00,30,7,8,26,2,0,1,0,1,0
1143803202301544_1665310373502512,Happy #NationalRelaxationDay 😴 💚 (Via BBC Earth),National Relaxation Day,video,https://www.facebook.com/bbc/videos/1665310373502512/,2017-08-15 12:20:00,353,48,90,267,67,0,19,0,0,0
1143803202301544_10155357262440659,Iftkahr made a death-defying journey 70 years ago - and now he's told his son the story. #PartitionVoices (Via BBC Stories),"""The bodies were lying on the roads like leaves""",video,https://www.facebook.com/bbc/videos/10155357262440659/,2017-08-15 08:35:31,98,10,56,63,3,10,0,22,0,0
1143803202301544_1823891084307315,This Scottish teenager was talent-spotted at school in Glasgow - now he's the hottest property in fashion. 🔥 (Via BBC Scotland),Scotland's Model Teenager,video,https://www.facebook.com/bbc/videos/1823891084307315/,2017-08-15 06:34:00,336,27,38,305,25,6,0,0,0,0
1143803202301544_1536849576402070,Was this hedgehog the real hero of the World Championships?!  👏,,video,https://www.facebook.com/bbc/videos/1536849576402070/,2017-08-14 11:45:00,476,25,91,378,52,1,45,0,0,0
1143803202301544_10155345009290659,Nepal has criminalised a practice that forces women from their homes during their periods. Watch BBC Stories powerful film on it from earlier this year.,Banished for bleeding,video,https://www.facebook.com/bbc/videos/10155345009290659/,2017-08-14 07:24:00,509,52,200,267,6,36,0,99,101,0
1143803202301544_1575639709123108,How do cats always land on their feet? Discover the secret of the African caracal...,Cats Defying Gravity,video,https://www.facebook.com/bbc/videos/1575639709123108/,2017-08-14 05:45:00,128,4,27,113,10,5,0,0,0,0
1143803202301544_1501333549923746,"If you have children or grandchildren, this will melt your heart. ❤️

Thanks to Bristol Royal Hospital for Children, (Via BBC Radio Bristol)",,video,https://www.facebook.com/bbc/videos/1501333549923746/,2017-08-13 04:01:00,357,11,62,246,96,0,0,15,0,0
1143803202301544_1533355720084789,So many amazing memories. Jermain Defoe says his days with Bradley Lowery were some of the best in his life. (Via BBC Sport),,video,https://www.facebook.com/bbc/videos/1533355720084789/,2017-08-12 05:01:00,39,4,8,32,4,0,0,3,0,0
1143803202301544_1661228077244075,Watch what happens when a baby elephant loses its mum... (Via BBC Earth) #WorldElephantDay,'Spy in the Wild': Naughty baby elephant gets lost,video,https://www.facebook.com/bbc/videos/1661228077244075/,2017-08-12 03:45:00,1298,69,1390,961,271,37,13,15,1,0
1143803202301544_1571194319567647,Remember the time Tom Hanks did THAT line from Forrest Gump for none other than Mo Farah? 😂👏🏅 (Via BBC One),Tom Hanks as Forrest + Mo Farah!,video,https://www.facebook.com/bbc/videos/1571194319567647/,2017-08-09 08:57:32,618,34,76,478,101,1,38,0,0,0
1143803202301544_1570379966315749,How about a locust for a high protein snack to eat on the fly? 🐜 (via BBC One),The Bug Grub Couple: How to cook a locust,video,https://www.facebook.com/bbc/videos/1570379966315749/,2017-08-09 01:36:00,75,53,31,61,3,9,1,0,1,0
1143803202301544_10154828497211200,Can you be a fan of both Sherlock and Shakespeare? Absolutely says Andrew Scott. (Via BBC Newsnight),Can you be a fan of both Sherlock and Shakespeare?,video,https://www.facebook.com/bbc/videos/10154828497211200/,2017-08-08 11:07:04,224,13,31,190,34,0,0,0,0,0
1143803202301544_1883416961673494,This cat adopted a puppy in need. ❤️ #InternationalCatDay,,video,https://www.facebook.com/bbc/videos/1883416961673494/,2017-08-08 07:43:00,3364,311,877,2265,985,79,12,23,0,0
1143803202301544_1654013621335737,🍊Nadiya Hussain's orange and polenta cake really does taste as good as it looks. (Via BBC Food),How to make Nadiya's orange and polenta cake,video,https://www.facebook.com/bbc/videos/1654013621335737/,2017-08-08 02:51:33,183,18,54,149,22,12,0,0,0,0
1143803202301544_1280757472033418,Is it safe to be gay in the UK? These harrowing experiences of homophobia show we’ve still got a long way to go… #GayBritannia (Via BBC Two),Is It Safe To Be Gay In The UK? | Gay Britannia,video,https://www.facebook.com/bbc/videos/1280757472033418/,2017-08-07 11:02:00,311,28,81,60,3,3,4,163,78,0
1143803202301544_1521479617915886,Meet the dad who's hacking fatherhood and whose videos have gone viral in the process... 😂,LadBaby  - the dad hacking fatherhood,video,https://www.facebook.com/bbc/videos/1521479617915886/,2017-08-06 15:43:09,673,30,103,541,85,1,46,0,0,0
1143803202301544_1274427745998933,Some people go for a nice walk to clear their head. Samantha loves to fight. (Via BBC Northern Ireland),Samantha loves to fight,video,https://www.facebook.com/bbc/videos/1274427745998933/,2017-08-06 05:05:00,37,3,4,36,1,0,0,0,0,0
1143803202301544_1876127479372913,Wow. Eight years of glacier retreat in seconds. (Via BBC Wild Alaska Live),Glacier time-lapse,video,https://www.facebook.com/bbc/videos/1876127479372913/,2017-08-05 05:10:00,331,8,130,149,2,65,0,114,1,0
1143803202301544_1878287455519778,Your favourite University Challenge contestants are back with THEIR OWN SHOW. 🙌,Monkman and Seagull's Polymathic Adventure,video,https://www.facebook.com/bbc/videos/1878287455519778/,2017-08-04 06:28:12,107,45,36,97,9,1,0,0,0,0
1143803202301544_10155320369760659,Can two orphans who survived the Boxing Day tsunami help two teenage brothers who have recently lost their mum? (Via BBC Stories),A life-changing gift for brothers who lost their mum,video,https://www.facebook.com/bbc/videos/10155320369760659/,2017-08-03 04:13:03,571,16,105,317,165,3,1,85,0,0
1143803202301544_10155317910510659,James and Dain were enjoying a night out together when they were followed out of a nightclub and attacked. (Via BBC Stories),Beaten up for being gay,video,https://www.facebook.com/bbc/videos/10155317910510659/,2017-08-02 06:54:46,2203,146,692,520,43,9,6,1106,512,7
1143803202301544_1274565875985911,WARNING: This video will make you want to eat ALL the biscuits. 🍪 (Via BBC Two),How biscuits are made | Inside The Factory,video,https://www.facebook.com/bbc/videos/1274565875985911/,2017-08-02 04:01:00,361,93,122,299,49,11,2,0,0,0
1143803202301544_1809316142431476,Lucy is the youngest person with motor neurone disease in Scotland. (Via BBC Scotland),MND and 22-year-old me,video,https://www.facebook.com/bbc/videos/1809316142431476/,2017-08-01 13:14:00,187,15,31,98,26,0,0,63,0,0
1143803202301544_1645178772219222,Crisps and chocolate together in a tart? Don't knock it 'til you've tried it! (Via BBC Food),"Crisp, chocolate and salted peanut tart",video,https://www.facebook.com/bbc/videos/1645178772219222/,2017-08-01 10:30:18,230,83,69,193,17,20,0,0,0,0
1143803202301544_10159016722320459,"This week it's 70 years since the partition of the Indian subcontinent in 1947. 

(Via BBC Radio 4)",Moving first-hand accounts of partition,video,https://www.facebook.com/bbc/videos/10159016722320459/,2017-08-01 06:17:48,105,6,64,78,0,1,0,23,3,0
1143803202301544_1562487447105001,Challenge: try to get to the end of this video without... *yawns* (via BBC Wild Alaska Live) 🐻,Bearly Awake,video,https://www.facebook.com/bbc/videos/1562487447105001/,2017-08-01 02:19:00,60,8,14,50,5,1,4,0,0,0
