status_id,status_message,link_name,status_type,status_link,status_published,num_reactions,num_comments,num_shares,num_likes,num_loves,num_wows,num_hahas,num_sads,num_angrys,num_special
86680728811_10155902025288812,"Rep. Roger Williams: ""This is America...If you punch us, we will punch back. And we're going to play baseball tomorrow."" http://abcn.ws/2ssfLq6",Rep Williams: America Punches Back,video,https://www.facebook.com/ABCNews/videos/10155902025288812/,2017-06-14 16:16:14,938,325,53,778,69,7,66,7,11,0
86680728811_10155901713273812,"Rep. Mike Doyle, Democratic team manager: ""It shouldn't take an incident like this to bring us together...when the leadership of this country is civil toward one another, maybe the public will start being civil toward one another."" http://abcn.ws/2ssfLq6",Doyle: Shouldn't Take Tragedy to Bring Us Together,video,https://www.facebook.com/ABCNews/videos/10155901713273812/,2017-06-14 15:10:21,4684,902,567,4112,353,28,35,126,22,8
86680728811_10155901671223812,"Congressional baseball team managers: ""We are going to play the annual charity baseball game tomorrow."" http://abcn.ws/2soZjWY",Congressional Team Leaders: Game Will Go On,video,https://www.facebook.com/ABCNews/videos/10155901671223812/,2017-06-14 15:01:36,155,46,7,121,15,9,4,3,2,1
86680728811_10155901440673812,"Congressional baseball team managers hold news conference following a shooting this morning at a practice that left several injured, including GOP Whip Steve Scalise. Scalise is currently in critical condition. http://abcn.ws/2ssfLq6",Congressional Team Managers Brief Press,video,https://www.facebook.com/ABCNews/videos/10155901440673812/,2017-06-14 14:56:52,1102,1011,218,595,139,31,26,261,43,7
86680728811_10155900900623812,"Man who knew suspected Virginia shooter says he had ""no inclination"" he was capable of of violence, and that his political expression was nothing ""out of the ordinary."" http://abcn.ws/2ssfLq6",Man Who Knows Shooter Says He Has 'No Inclination' of Violence,video,https://www.facebook.com/ABCNews/videos/10155900900623812/,2017-06-14 12:05:23,580,446,87,319,9,31,14,119,88,0
86680728811_10155900850998812,"President Trump on GOP baseball practice shooting: Rep. Scalise is ""a patriot, and he's a fighter. He will recover from this assault."" abcn.ws/2ssfLq6",Pres. Trump on GOP baseball practice shooting,video,https://www.facebook.com/ABCNews/videos/10155900850998812/,2017-06-14 11:52:32,1110,695,101,746,65,15,122,32,125,5
86680728811_10155900819188812,"Video shows authorities arriving at the house of suspected shooter James T. Hodgkinson in Belleville, Illinois. abcn.ws/2ssfLq6",Authorities arrive at suspected shooter's house,video,https://www.facebook.com/ABCNews/videos/10155900819188812/,2017-06-14 11:44:21,435,201,146,314,4,75,8,26,8,0
86680728811_10155900577758812,"Suspected Virginia shooter spoke out against President Trump in recent social media postings, Brian Ross reports. abcn.ws/2tlIOIc",Suspected Virginia shooter spoke out against Pres. Trump,video,https://www.facebook.com/ABCNews/videos/10155900577758812/,2017-06-14 10:50:01,387,444,104,244,8,21,28,32,52,2
86680728811_10155900542193812,"JUST IN: President Donald J. Trump says suspected gunman in Virginia shooting ""has now died from his injuries."" http://abcn.ws/2ssfLq6",Trump Says Suspected Gunman Has Died,video,https://www.facebook.com/ABCNews/videos/10155900542193812/,2017-06-14 10:40:28,1135,605,179,785,84,29,25,46,162,4
86680728811_10155900168563812,"Congressman Steve Scalise, in a video from Monday, expressed his excitement about upcoming baseball game. ""Couldn't even make my high school team, but I kind of bloomed later in life."" abcn.ws/2t1IZZS",Rep Scalise expresses excitement about baseball game,video,https://www.facebook.com/ABCNews/videos/10155900168563812/,2017-06-14 09:13:46,337,77,51,220,6,15,7,87,2,0
86680728811_10155899895133812,"Sen. Rand Paul praises Capitol Police following shooting in Virginia: ""These guys were real heroes, and without them I think everyone would have been killed."" http://abcn.ws/2tlNONg",Sen. Paul Praises Capitol Police,video,https://www.facebook.com/ABCNews/videos/10155899895133812/,2017-06-14 07:47:20,918,254,278,565,12,100,8,212,21,0
86680728811_10155899875138812,"Sen. Rand Paul recounts shooting at Virginia ball field in which Rep. Steve Scalise was injured: ""I'm seeing shots skipping off of the warning track...at least 50 or 60 shots."" http://abcn.ws/2tlNONg",Rand Paul Describes Virginia Shooting,video,https://www.facebook.com/ABCNews/videos/10155899875138812/,2017-06-14 07:43:46,436,175,288,190,3,99,5,121,18,0
86680728811_10155899112033812,"4,000-ton rockslide blocks one of the main roads into Yosemite; expected to remain closed at least through weekend. http://abcn.ws/2sqQxIN",Rockslide blocks popular entrance to Yosemite National Park,video,https://www.facebook.com/ABCNews/videos/10155899112033812/,2017-06-14 01:32:09,1079,101,459,477,2,529,1,67,1,2
86680728811_10155899051288812,Dramatic video provided to ABC News by a neighborhood resident shows fire at 24-story London high-rise not long after it broke out early Wednesday morning. http://abcn.ws/2rfNsHb,Massive fire engulfs London high-rise,video,https://www.facebook.com/ABCNews/videos/10155899051288812/,2017-06-14 00:46:58,1427,126,493,532,4,257,2,625,7,0
86680728811_10155897356018812,"Urban climber Alain Robert, also known as the “French Spiderman,” climbs one of Barcelona's tallest skyscrapers - over 272 feet tall - without a harness. abcnews.com",Man climbs skyscraper without a harness,video,https://www.facebook.com/ABCNews/videos/10155897356018812/,2017-06-13 17:30:00,820,167,420,578,11,217,8,1,3,2
86680728811_10155896982313812,"Testy exchange between Attorney General Sessions and Senator Wyden over accusations of ""stonewalling."" abcn.ws/2reZNLN","AG Sessions on ""stonewalling"" accusations",video,https://www.facebook.com/ABCNews/videos/10155896982313812/,2017-06-13 15:26:58,1441,619,335,1038,130,30,163,11,63,6
86680728811_10155896367073812,"Asked if he'd fire special counsel Bob Mueller on Pres. Donald J. Trump's orders, Deputy Attorney General Rod Rosenstein says he won't follow any orders unless they are ""lawful and appropriate."" http://abcn.ws/2s6yOTQ",Rosenstein Says HE Won't Obey Unlawful Orders,video,https://www.facebook.com/ABCNews/videos/10155896367073812/,2017-06-13 13:25:11,141,42,24,116,9,4,8,0,4,0
86680728811_10155895871638812,Chicago police officer arrives just in the nick of time to rescue a dog that fell into Lake Michigan in Chicago. http://abcn.ws/1gBong2,"Dog falls into Lake Michigan, rescued by Police officer",video,https://www.facebook.com/ABCNews/videos/10155895871638812/,2017-06-13 11:30:00,68342,2218,24945,45221,19426,3192,101,337,8,57
86680728811_10155895651503812,Fireworks light up the skies in Oakland as Golden State Warriors fans dance in the street to celebrate their team's victory in the NBA Finals. http://abcn.ws/2s6h4be,Golden State Warriors fans celebrate Finals win,video,https://www.facebook.com/ABCNews/videos/10155895651503812/,2017-06-13 11:00:00,528,17,81,474,27,20,6,0,1,0
86680728811_10155895643213812,"Director Oscar Eustis delivers powerful message before the opening of his controversial production of Julius Caesar in New York's Central Park. ""Neither Shakespeare nor the Public Theater could possibly advocate violence as a solution to political problems, and certainly not assassination."" http://abcn.ws/2teOOTh",'Julius Caesar' director gives powerful speech before controve...,video,https://www.facebook.com/ABCNews/videos/10155895643213812/,2017-06-13 10:00:00,403,290,78,265,50,7,5,2,74,0
86680728811_1299253490172874,"Newt Gingrich calls special counsel team, charged with investigating possible Trump-Russia ties, ""bad people"" on Good Morning America: ""These are people who are going to be after Trump."" http://abcn.ws/2rmDKXI",Newt Gingrich calls special counsel team 'bad people',video,https://www.facebook.com/ABCNews/videos/1299253490172874/,2017-06-13 08:05:17,2539,1481,336,858,42,109,674,43,807,6
86680728811_10155893736813812,VP Mike Pence on hand for dignified transfer ceremony in Delaware after three U.S. soldiers killed in Afghanistan attack. http://abcn.ws/2rcxLAK,Dignified transfer of soldiers killed in Afghanistan,video,https://www.facebook.com/ABCNews/videos/10155893736813812/,2017-06-12 22:37:41,11579,1142,12138,4657,681,37,10,6122,69,3
86680728811_10155893002993812,We're in downtown Orlando as mourners gather on anniversary of the Pulse nightclub shooting that claimed 49 lives. http://abcn.ws/2sVOHN3,Orlando residents gather for anniversary of Pulse nightclub sh...,video,https://www.facebook.com/ABCNews/videos/10155893002993812/,2017-06-12 19:30:40,5346,1511,1015,2114,1696,33,37,362,41,1063
86680728811_1298559780242245,"Press Secretary Sean Spicer declines to say whether Pres. Donald J. Trump has tapes of conversations with James Comey, says announcement on any taps will come ""when the president's ready to make it."" http://abcn.ws/2sUT4b3",Spicer Declines to Say Whether Trump Has Oval Office Recordings,video,https://www.facebook.com/ABCNews/videos/1298559780242245/,2017-06-12 13:28:20,1475,870,83,452,25,28,664,18,286,2
86680728811_1298406263590930,"Washington, D.C., Maryland attorneys general announce suit against Pres. Donald J. Trump for emoluments violations: He's ""fragrantly violating the Constitution"" http://abcn.ws/2raJSyb",AGs Announce Suit Against Pres. Trump,video,https://www.facebook.com/ABCNews/videos/1298406263590930/,2017-06-12 11:35:21,14247,1865,2769,10488,1809,287,1174,30,404,55
86680728811_10155890954198812,"Woman escapes car swallowed up by a sinkhole in a parking lot in Ocala, Florida. “She just walked out of the car; she was shaking."" http://abcn.ws/2rSb6wj",Woman escapes car swallowed by sinkhole,video,https://www.facebook.com/ABCNews/videos/10155890954198812/,2017-06-12 11:30:00,5746,780,2753,1903,19,3528,50,239,5,2
86680728811_10155889308078812,"Moving day at The White House: First Lady Melania Trump and son Barron have officially moved to Washington, D.C., the Trump administration confirmed Sunday night. http://abcn.ws/2s1fJCC",Melania and Barron Trump move to the White House,video,https://www.facebook.com/ABCNews/videos/10155889308078812/,2017-06-11 21:54:59,17769,4580,2735,13717,1803,142,1619,119,314,55
86680728811_10155888884083812,"United States Senator Mike Lee: ""I don't see any indication that there was even a potential"" for obstruction of justice, even if former FBI Director James Comey's testimony is true. http://abcn.ws/2sRF95K","Time to 'move on' from probe of Russia collusion, Trump obstru...",video,https://www.facebook.com/ABCNews/videos/10155888884083812/,2017-06-11 18:52:30,1748,774,110,606,46,67,458,22,545,4
86680728811_10155888696953812,"GOP strategist Sara Fagen says strategically Pres. Donald J. Trump is 'undisciplined.' ""Every day we talk about James Comey means we're not talking about tax reform, healthcare."" http://abcn.ws/2rfnGqA",Powerhouse Roundtable weighs in on James Comey's dramatic test...,video,https://www.facebook.com/ABCNews/videos/10155888696953812/,2017-06-11 17:40:27,717,277,58,568,23,7,99,3,14,3
86680728811_1296534230444800,"Conservative commentator Tara Setmayer tells Good Morning America: ""I'll be shocked"" if Pres. Donald J. Trump testifies under oath voluntarily—but ""he may now be compelled to do so."" http://abcn.ws/2sOi8QW",Setmayer: Testifying Under Oath Probably Against Legal Advice,video,https://www.facebook.com/ABCNews/videos/1296534230444800/,2017-06-10 11:30:40,1178,522,97,806,26,15,275,3,46,7
86680728811_1449383245105113,"Former New York U.S. Attorney Preet Bharara, a friend and former colleague of James Comey, weighs in on the ousted FBI director's testimony, exclusively on This Week Sunday. http://abcn.ws/2r5mTVc",Sunday on 'This Week': Preet Bharara,video,https://www.facebook.com/ABCNews/videos/1449383245105113/,2017-06-10 09:30:37,553,188,117,469,49,7,25,1,1,1
86680728811_10155881896978812,Fiona the hippo reunites with her mom after being born prematurely in January at the Cincinnati Zoo & Botanical Garden. http://abcn.ws/2raD33O,,video,https://www.facebook.com/ABCNews/videos/10155881896978812/,2017-06-09 22:48:37,21043,797,2162,15664,4770,70,12,483,14,30
86680728811_10155880802943812,Animal welfare activists work to bring attention to orca breeding programs that are popping up in Asia. More on Nightline.,Orca breeding programs popping up in Asia,video,https://www.facebook.com/ABCNews/videos/10155880802943812/,2017-06-09 17:30:00,892,83,175,412,5,14,3,159,297,2
86680728811_10155880210488812,"Pres. Donald J. Trump tells Jonathan Karl he would ""100%"" be willing to testify under oath on his conversations with Comey after saying ""some"" of what he said wasn't ""true."" abcnews.com/politics",,video,https://www.facebook.com/ABCNews/videos/10155880210488812/,2017-06-09 14:39:41,2495,1530,362,1049,65,51,985,17,323,5
86680728811_10155879270823812,Albuquerque Police officers help save the life of a choking puppy after responding to reports of a stolen vehicle. http://abcn.ws/2s4SM3D,Police officers save dog from choking,video,https://www.facebook.com/ABCNews/videos/10155879270823812/,2017-06-09 11:27:30,3260,117,576,2185,856,168,3,44,2,2
86680728811_10155875879273812,"EVERLASTING LOVE: Couple married 63 years share advice on marriage. ""I can't imagine living any other way."" abcnews.com",Couple married 63 years share marriage advice,video,https://www.facebook.com/ABCNews/videos/10155875879273812/,2017-06-08 17:00:00,7266,444,2038,5174,2052,31,2,4,0,3
86680728811_10155875256448812,Record amounts of rainfall in South Florida left water levels so high in some places that people attached surfboards to their cars and surfed through the streets. http://abcn.ws/1c0VIdW,Surfing in the street through south flORIDA,video,https://www.facebook.com/ABCNews/videos/10155875256448812/,2017-06-08 15:30:00,2018,244,735,1259,30,229,498,2,0,0
86680728811_10155875287578812,A who's who in the Trump-Russia probe as investigators try to determine if Trump associates colluded with Russian officials to sway election: http://abcn.ws/2sHg5hs,,video,https://www.facebook.com/ABCNews/videos/10155875287578812/,2017-06-08 15:18:32,604,375,304,393,12,63,94,7,35,0
86680728811_10155875115403812,Footage released by the Arlington Police Department shows a suspected burglar getting scared off by a small dog named Sadie barking at him. abcnews.com,Suspected burglar scared off by small dog,video,https://www.facebook.com/ABCNews/videos/10155875115403812/,2017-06-08 15:00:00,3302,268,328,2109,230,37,919,0,6,1
86680728811_10155874156133812,"Comey on if Pres. Donald J. Trump taped convos: ""All I can do is hope…if he did my feelings aren't hurt. Release all the tapes. I'm good with it” abcnews.com/politcs",,video,https://www.facebook.com/ABCNews/videos/10155874156133812/,2017-06-08 11:01:49,714,132,53,594,81,3,35,0,1,0
86680728811_10155873913203812,"Former FBI director James Comey says he took notes on meetings with President Donald J. Trump because he feared the president would ""lie"" about nature of meeting. abcn.ws/2sj8BE3",Comey on why he took notes on meetings with Pres. Trump,video,https://www.facebook.com/ABCNews/videos/10155873913203812/,2017-06-08 10:11:41,2180,568,286,1717,171,80,153,10,48,1
86680728811_10155873814983812,"Comey: Former Pres. Bill Clinton and Attorney General Lynch's tarmac meeting convinced him in ""ultimately conclusive way"" to go public with email probe to protect credibility of investigation. abcnews.com/politics",,video,https://www.facebook.com/ABCNews/videos/10155873814983812/,2017-06-08 09:45:03,331,135,47,264,19,24,11,2,11,0
86680728811_10155871295878812,Argentinian naval vessels successfully escorted an adult whale and calf back out to sea after the pair swam into shallow waters near port of Buenos Aires. http://abcn.ws/2sVacNb,Lost whales swim into Buenos Aires port,video,https://www.facebook.com/ABCNews/videos/10155871295878812/,2017-06-07 20:00:49,1631,22,303,1396,176,58,0,1,0,0
86680728811_10155868796973812,"Pres. Donald J. Trump makes remarks on healthcare in Cincinnati, Ohio. abcnews.com/politics",,video,https://www.facebook.com/ABCNews/videos/10155868796973812/,2017-06-07 11:59:05,3580,2792,298,1155,332,37,96,63,1897,0
86680728811_10155868063113812,Police air and marine units rescue two stranded jet skiers who went missing for more than 12 hours. Both men suffered from sun exposure and one had a minor stingray barb in his foot. abcnews.com,Police rescue jet skiers stranded for over 12 hours,video,https://www.facebook.com/ABCNews/videos/10155868063113812/,2017-06-07 09:30:00,1917,83,324,1632,42,219,17,7,0,0
86680728811_10155864495883812,"NASA - National Aeronautics and Space Administration debuts their new Mars rover concept vehicle, a scientifically-themed outreach tool “designed for navigating the demanding landscape of Mars."" abcnews.com",NASA debuts new Mars rover concept vehicle,video,https://www.facebook.com/ABCNews/videos/10155864495883812/,2017-06-06 15:30:00,8131,666,2979,6609,474,1014,24,4,6,0
86680728811_10155864057083812,Peacock causes about $500 in damage in a liquor store in California. The peacock was captured and released to a nearby botanic garden. http://abcn.ws/1gBong2,Peacock causes $500 in damage at liquor store,video,https://www.facebook.com/ABCNews/videos/10155864057083812/,2017-06-06 13:10:34,10077,1735,5410,5168,94,1552,3192,59,12,0
86680728811_10155860118198812,"London Mayor: ""I've really not got time to respond to tweets from Donald J. Trump...we aren't going to allow anybody, whether it's Donald Trump or anybody else, to divide our communities."" http://abcn.ws/2qUAmmA",,video,https://www.facebook.com/ABCNews/videos/10155860118198812/,2017-06-05 16:40:54,25694,2630,4316,20427,4248,86,614,70,249,0
86680728811_10155858295853812,"Video shows a phenomenon known as ""midnight sun"" in Alaska; as the summer solstice approaches, the amount of daylight in the northern part of Alaska approaches a full 24 hours. http://abcn.ws/1c0VIdW",Midnight Sun phenomenon takes place in Alaska,video,https://www.facebook.com/ABCNews/videos/10155858295853812/,2017-06-05 08:30:00,3136,139,941,2546,116,467,4,2,1,0
86680728811_10155855485463812,"Police in northern Italy say firecracker may have triggered stampede that injured more than 1,500 after soccer game. Three people, including a young boy, in serious condition, authorities say. http://abcn.ws/2sty0Iu","More than 1,500 injured in panic after soccer game in Italy",video,https://www.facebook.com/ABCNews/videos/10155855485463812/,2017-06-04 18:09:33,3006,304,1157,1038,16,665,36,1146,105,0
86680728811_1443348492375255,"On This Week, U.S. Environmental Protection Agency chief Scott Pruitt still won't say whether President Donald J. Trump believes climate change is a hoax. http://abcn.ws/2rT1674",Scott Pruitt Won't Say Whether Trump Believes Climate Change i...,video,https://www.facebook.com/ABCNews/videos/1443348492375255/,2017-06-04 09:28:06,626,523,59,237,15,31,122,17,204,0
86680728811_1443298959046875,"ABC News Chief White House Correspondent Jonathan Karl tells This Week there is ""no plan"" to invoke executive privilege to block former FBI Director James Comey's testimony this week, as The White House aides believe ""politically it would be a disaster."" http://abcn.ws/2ssl19U",Karl: 'No Plan' to Invoke Executive Privilege to Block Comey T...,video,https://www.facebook.com/ABCNews/videos/1443298959046875/,2017-06-04 08:43:21,328,151,35,256,12,7,53,0,0,0
86680728811_1289763077788582,"British Prime Minister Theresa May calls for defeating the ""evil ideology of Islamist extremism"" following recent attacks: ""We cannot and must not pretend that things can continue as they are."" http://abcn.ws/2s6PJZ3",May Condemns 'Islamist Extremism' Following Recent Attacks,video,https://www.facebook.com/ABCNews/videos/1289763077788582/,2017-06-04 07:39:19,2284,482,447,1841,143,19,9,247,25,0
86680728811_10155850219973812,"Two lost paddlers used flashlights and wrote ""SOS"" in the sand to help direct air crew's attention to their location; Minnesota State Patrol pilots helped to rescue them from the Boundary Waters Canoe Area Wilderness after the pair hadn't been heard from in four days. http://abcn.ws/2qLDr49",Lost paddlers in Minnesota write 'SOS' in the sand to help res...,video,https://www.facebook.com/ABCNews/videos/10155850219973812/,2017-06-03 15:03:32,661,8,81,580,19,61,0,0,1,0
86680728811_10155849437568812,"Dramatic video shows monstrous tornado touching down near highway in Alberta, Canada http://abcn.ws/2rw0Ish",Tornado touches down near highway in Canada in dramatic video,video,https://www.facebook.com/ABCNews/videos/10155849437568812/,2017-06-03 11:13:37,17396,1139,7522,6956,119,9588,35,683,15,0
86680728811_10155845636198812,"RANDOM ACT OF KINDNESS: Lifelong Pittsburgh Penguins fans receive a text to the wrong number offering them tickets to a Stanley Cup Finals game, gives them the tickets anyway. ""Whoever you are, thank you!"" abcn.ws/2rALLqM",Wrong number text leads to free Stanley Cup Finals tickets,video,https://www.facebook.com/ABCNews/videos/10155845636198812/,2017-06-02 17:00:00,615,26,51,507,80,27,0,0,1,0
86680728811_10155844291788812,"Kathy Griffin gets emotional when talking about fallout over photo: ""I've had everybody turn on me and I just want to make people laugh. That's all I want to do, so I screwed up."" abcnews.com",,video,https://www.facebook.com/ABCNews/videos/10155844291788812/,2017-06-02 11:21:57,8591,6134,870,3644,421,133,2337,288,1768,0
86680728811_10155844203043812,"We're live as Kathy Griffin holds a press conference with her attorney after fallout over photo of her holding fake, bloody head. abcnews.com/live",,video,https://www.facebook.com/ABCNews/videos/10155844203043812/,2017-06-02 11:03:05,18472,34803,3252,6159,4227,275,1465,274,6071,1
86680728811_10155843893998812,U.S. Navy releases video of the USS Carl Vinson and the USS Ronald Reagan aircraft carriers operating alongside two Japanese ships in the Sea of Japan. abcnews.com,U.S. aircraft carriers operate alongside Japanese ships,video,https://www.facebook.com/ABCNews/videos/10155843893998812/,2017-06-02 09:24:49,23123,1427,19065,19936,1395,1675,45,40,32,0
86680728811_10155840305318812,Passenger films the moment the engine on the United Airlines plane he's on catches fire; the flight was forced to return to Chicago shortly after takeoff. abcnews.com,United Airlines plane engine catches fire,video,https://www.facebook.com/ABCNews/videos/10155840305318812/,2017-06-01 16:30:00,12655,2105,5930,4643,29,7279,80,571,53,0
86680728811_10155839761263812,"BREAKING: Pres. Donald J. Trump announces he is withdrawing the U.S. from Paris Agreement, a UN sponsored accord to help slow climate change. abcn.ws/2rvBxbb",President Trump announces he is withdrawing from Paris Agreement,video,https://www.facebook.com/ABCNews/videos/10155839761263812/,2017-06-01 14:38:42,10535,2386,1197,2856,635,122,107,385,6430,0
86680728811_10155839534328812,At least 36 people died from smoke inhalation after a gunman stormed Resorts World Manila in the Philippines and set fire to gambling tables. abcn.ws/2qFyCcB,"Gunmen open fire, start blaze at Resorts World Manila",video,https://www.facebook.com/ABCNews/videos/10155839534328812/,2017-06-01 13:53:56,543,76,213,240,2,80,7,198,16,0
86680728811_10155838593403812,"Aaron Maher, a player on East Tennessee State University's baseball team, shares an epic handshake with the team's bat boy after scoring. http://abcn.ws/2okpzAt",Baseball player shares epic handshake with bat boy,video,https://www.facebook.com/ABCNews/videos/10155838593403812/,2017-06-01 10:34:12,36014,706,7479,26942,7593,201,1275,0,3,0
86680728811_10155838220433812,Dashcam video released by the Jupiter Police Department shows golfer Tiger Woods being arrested after Woods was found sleeping in his car. http://abcn.ws/2qCvuT8,Dashcam video of Tiger Woods arrest,video,https://www.facebook.com/ABCNews/videos/10155838220433812/,2017-06-01 09:02:50,10340,3556,3273,5387,45,1623,563,2523,199,0
86680728811_10155835837603812,"""IS THERE ANYBODY ELSE IN HERE?"" Orlando Police Department releases body cam footage recorded during Pulse nightclub shooting. More tonight on a special edition of Nightline. http://abcn.ws/2rqeC14",Orlando police releases Pulse nightclub body cam footage,video,https://www.facebook.com/ABCNews/videos/10155835837603812/,2017-05-31 19:45:00,712,32,104,371,6,58,1,273,3,0
86680728811_10155835043313812,President Donald J. Trump welcomes Vietnamese PM Nguyen Xuan Phuc at the White House. http://abcn.ws/1tLATRZ,President Trump welcomes Vietnamese PM to White House,video,https://www.facebook.com/ABCNews/videos/10155835043313812/,2017-05-31 14:06:22,7316,647,776,6293,292,75,519,14,123,0
86680728811_10155834961143812,OFF TO THE RACES: Carriage horse breaks loose and runs through the streets of New York City before eventually returning to the stable on her own. http://abcn.ws/1gBong2,"Horse breaks loose, runs through NYC streets",video,https://www.facebook.com/ABCNews/videos/10155834961143812/,2017-05-31 13:59:02,14129,1526,3152,8534,538,2531,1947,506,73,0
86680728811_10155832465843812,"JUST IN: Video shows smoke after explosion in diplomatic area of central Kabul that has killed at least 64 people and wounded at least 300, Afghan health officials say. http://abcn.ws/2rjjK4W",Explosion rocks central Kabul,video,https://www.facebook.com/ABCNews/videos/10155832465843812/,2017-05-31 00:03:47,5223,205,1003,1768,15,568,10,2576,286,0
