status_id,status_message,link_name,status_type,status_link,status_published,num_reactions,num_comments,num_shares,num_likes,num_loves,num_wows,num_hahas,num_sads,num_angrys,num_special
86680728811_10155527361539818,FAIRY TALE STORY: A new chapter begins for newly engaged royal couple Prince Harry and American actress Meghan Markle. David Muir with their fairy-tale romance and the role Harry's late mother Princess Diana played in their engagement. http://abcn.ws/2BhFMZz,"Prince Harry, Megan Markle discuss Queen Elizabeth, Princess D...",video,https://www.facebook.com/ABCNews/videos/10155527361539818/,2017-11-27 22:24:19,4559,147,404,3642,878,17,18,2,1,1
86680728811_10156609048008812,The confirmation that Donald J. Trump has raised doubts about the video to advisers in recent weeks stands in contrast to at least two instances in which he discussed the video’s content without denying it or raising questions about its veracity.,What Trump previously said about 'Access Hollywood' tape he's now questioning,link,http://abcn.ws/2zJLU0C,2017-11-27 22:19:05,980,658,117,291,14,47,386,18,224,0
86680728811_10156609011178812,NEW: Two planes clipped each other on the taxiway at John F. Kennedy International Airport. No injuries reported.,Planes' wings clip each other at JFK Airport in New York,link,http://abcn.ws/2zKHhDz,2017-11-27 22:10:14,295,25,32,156,6,124,6,2,1,0
86680728811_10156608954033812,"COOL RUNNING: 55 athletes competed in this year's Antarctic Ice Marathon, where the temperature was a balmy -13°. They all finished the course. Congratulations! abcnews.com",Runners compete in freezing marathon at Antarctica exploration...,video,https://www.facebook.com/ABCNews/videos/10156608954033812/,2017-11-27 21:55:52,6535,1906,2521,4858,350,1287,32,5,1,2
86680728811_10156608938223812,"U.S. Supreme Court rejected an appeal from an African-American attorney who called the Confederate battle emblem on the Mississippi flag ""an official endorsement of white supremacy.""",Justices reject appeal over Mississippi Confederate emblem,link,http://abcn.ws/2BiyncB,2017-11-27 21:49:00,811,338,75,442,86,20,51,27,179,6
86680728811_10156608868708812,"Victims of bullying appear to be much more likely to bring a weapon to school, according to a new study published today in the journal Pediatrics.","Bullied kids are more likely to bring weapons to school, study says",link,http://abcn.ws/2zKcyX2,2017-11-27 21:26:03,996,536,477,587,12,66,12,297,19,3
86680728811_10156608817068812,33-year-old man rescued after being buried inside a garbage truck after the dumpster he was sleeping in was emptied. http://abcn.ws/2zKX6da,Man rescued after being buried inside garbage truck,video,https://www.facebook.com/ABCNews/videos/10156608817068812/,2017-11-27 21:05:43,2972,255,490,788,13,825,34,1306,5,1
86680728811_10156608771228812,"Three of the four women who have accused Sen. Al Franken of groping them have told similar accounts of the alleged incidents, while the fourth presented photographic evidence.",Sen. Al Franken's accusers and the accusations they made against him,link,http://abcn.ws/2iaffK6,2017-11-27 20:45:06,266,352,23,162,11,13,41,16,23,0
86680728811_10156608735183812,"U.S. Navy P-8 surveillance plane had an “unsafe interaction” with a Russian SU-30 fighter jet on Saturday in international airspace over the Black Sea, U.S. official says.",US Navy plane has unsafe encounter with Russian fighter over Black Sea,link,http://abcn.ws/2zL9uK9,2017-11-27 20:30:09,432,64,75,263,11,91,4,4,59,0
86680728811_10156608720308812,"The last time this happened, the king abdicated his thrown and the United Kingdom was launched into a constitutional crisis.",The history of British royals marrying divorced women,link,http://abcn.ws/2zKLEOA,2017-11-27 20:23:05,1089,301,107,919,22,58,79,6,4,1
86680728811_10156608676768812,"Ever wanted to own a 15,000-year-old mammoth skeleton? Now you can. (For $500,000.) http://abcn.ws/2zL8Hc4","15,000-year-old mammoth skeleton up for auction in France",video,https://www.facebook.com/ABCNews/videos/10156608676768812/,2017-11-27 20:05:40,442,122,119,322,21,86,7,4,2,0
86680728811_10156608643538812,Aladdin was released 25 years ago this past weekend and the film's stars took to social media to pay homage to the film's characters and the impact the animated classic had on fans.,Zelda Williams honors late father Robin on 25th anniversary of 'Aladdin',link,http://abcn.ws/2i9LbxW,2017-11-27 19:51:03,4997,94,746,3872,918,38,3,164,1,1
86680728811_10156608634013812,Prince Harry and Meghan Markle took the world by storm  when it was announced that the famous duo were engaged. http://abcn.ws/2hVUz4y,Read the full transcript of Prince Harry and Meghan Markle's engagement interview,link,http://abcn.ws/2hVUz4y,2017-11-27 19:47:06,912,45,42,763,143,5,1,0,0,0
86680728811_10156608628523812,"Pope Francis's trip will be dominated by how to address the country’s ongoing crackdown on its Muslim Rohingya minority, which has included mass shootings, systemic rape and the burning of villages by the armed forces. The military's actions amount to ethnic cleansing, according to the United States and United Nations.","Pope Francis arrives in Myanmar to cheers, Rohingya diplomatic test",link,http://abcn.ws/2ibCx26,2017-11-27 19:45:13,108,16,23,93,8,1,1,3,2,0
86680728811_10156608589048812,"Senate Republicans are racing to approve their tax overhaul, with a possible floor vote as early as Thursday. But it's unclear if they have enough support.",Senate Republicans are racing to approve tax bill but unclear if they have the votes,link,http://abcn.ws/2Bsq52O,2017-11-27 19:31:06,371,163,23,110,13,4,27,9,208,0
86680728811_10156608574263812,"Senate candidate Roy Moore says allegations against him are 'simply dirty politics.' ""It's a sign of the immorality of our time."" http://abcn.ws/2hWKows",Roy Moore says allegations against him are 'simply dirty polit...,video,https://www.facebook.com/ABCNews/videos/10156608574263812/,2017-11-27 19:26:17,2494,1595,135,644,47,64,632,33,1074,0
86680728811_10156608558983812,"Denying the very existence of a tape Donald J. Trump knows full well to be of him carries larger—and potentially far more troubling—meaning than a typical baseless claim, ABC News Political Director Rick Klein writes.","ANALYSIS: In questioning tape's authenticity, Trump seeks to define own reality",link,http://abcn.ws/2hUBO1l,2017-11-27 19:19:01,1304,592,209,545,19,68,285,29,357,1
86680728811_10156608532313812,,ABC News Politics,video,https://www.facebook.com/ABCNewsPolitics/videos/1463230287108526/,2017-11-27 19:07:53,1037,368,0,248,48,8,93,11,629,0
86680728811_10156608511853812,"98-year-old veteran Mickey Ganitch, who survived Pearl Harbor and fought in two wars, receives hero's welcome during Sunday's The Oakland Raiders game. http://abcn.ws/2hX6JKG",Oakland Raiders honor 98-year-old Pearl Harbor veteran,video,https://www.facebook.com/ABCNews/videos/10156608511853812/,2017-11-27 19:00:15,4246,194,563,3395,803,41,5,2,0,0
86680728811_10156608443928812,"""Anybody who thinks that a Trump administration CFPB would be the same as an Obama administration is simply being naïve.""",Defiant Mulvaney pledges to run CFPB 'differently' amid leadership fight,link,http://abcn.ws/2hW1SJy,2017-11-27 18:30:05,325,173,23,124,19,5,10,9,158,0
86680728811_10156608415498812,"Massive fireball illuminates the night sky above Wilcot, England. http://abcn.ws/2zHjIv1",Huge Fireball Spotted in UK Sky,video,https://www.facebook.com/ABCNews/videos/10156608415498812/,2017-11-27 18:20:31,3195,229,827,1766,78,1329,17,3,1,1
86680728811_10156608364608812,"According to the Defense Manpower Data Center's quarterly report, there were 1,720 American troops in Syria through September—three times as many as the 503 troops in Syria that U.S. military spokesmen have told reporters.",Thousands more US military service members in Iraq and Syria than believed,link,http://abcn.ws/2hWUUEi,2017-11-27 18:03:49,229,39,53,129,7,41,5,3,43,1
86680728811_10156608256133812,"JUST KEEP SWIMMING: Diver gets up close and personal with a rare whale shark in Cabo San Lucas, Mexico. http://abcn.ws/2BtjIfJ",Rare Whale Shark Sighted off Cabo San Lucas,video,https://www.facebook.com/ABCNews/videos/10156608256133812/,2017-11-27 17:27:45,1897,105,225,1427,235,234,0,0,0,1
86680728811_10156608241313812,"Newly released bodycam footage shows an NYPD officer shooting a man in the leg after he came at officers with knives: ""Put the knife down!"" The man was hospitalized with non-life threatening injuries. http://abcn.ws/2zu99r2",Bodycam footage shows NYPD shooting man with knives,video,https://www.facebook.com/ABCNews/videos/10156608241313812/,2017-11-27 17:26:23,1773,730,297,1395,132,182,55,5,4,0
86680728811_10156608152218812,"INSPIRING: Mikayla Holmgren makes history as the first woman with Down syndrome to compete for the Miss USA Pageant. ""I'm so proud of myself."" http://abcn.ws/2BiaJwI",Miss Minnesota contestant with Down syndrome makes pageant his...,video,https://www.facebook.com/ABCNews/videos/10156608152218812/,2017-11-27 16:54:35,19442,311,4387,13599,5674,150,12,3,2,2
86680728811_10156608041318812,"NEW: Barack Obama and Michelle Obama wish Prince Harry and Meghan Markle ""a lifetime of joy and happiness together."" http://abcn.ws/2k6yjcp",Timeline Photos,photo,https://www.facebook.com/ABCNews/photos/a.10150095914943812.286215.86680728811/10156608041318812/?type=3,2017-11-27 16:28:23,9791,434,272,7742,1928,8,91,0,19,3
86680728811_10156608016893812,One male student was taken into protective custody; at least five other students are being questioned.,Schools close after 'Columbine-style' threat to shoot students discussed on Snapchat,link,http://abcn.ws/2zHI7k7,2017-11-27 16:20:07,756,27,140,292,13,240,2,159,50,0
86680728811_10156608004318812,"In 1941 and 1942, the Marine Corps began recruiting from the Navajo Tribe at the suggestion of Philip Johnston, a World War I veteran who had grown up on a Navajo reservation. The 29 recruited Navajos were tasked with developing a code using their tribal language that could be used to transmit messages across the battlefield without being intercepted.",Who are the Native American code talkers?,link,http://abcn.ws/2zJVi4p,2017-11-27 16:17:03,4179,204,1126,3200,880,78,7,4,7,3
86680728811_10156607943423812,"Logan Mott—who was found Friday in Buffalo, New York—is set to appear for an extradition hearing after Florida police found a body in a shallow grave Friday afternoon in the backyard of a home belonging to Logan Mott's father.",Teen who's person of interest in grandmother's death to appear in court,link,http://abcn.ws/2hZ0INf,2017-11-27 16:01:15,204,24,16,145,8,28,0,15,8,0
86680728811_10156607865323812,"The White House Press Sec. Sarah Sanders says questions about infamous Access Hollywood tape were ""litigated and certainly answered during the election by the overwhelming support for the president."" abcn.ws/2hZc6st",Sanders Says Questions About Access Hollywood Tape Litigated D...,video,https://www.facebook.com/ABCNews/videos/10156607865323812/,2017-11-27 15:37:00,3680,1821,299,1163,91,89,1120,73,1139,5
86680728811_10156607615033812,"We're at The White House as Press Sec. Sarah Sanders briefs reporters amid a congressional push for tax reform, and as pressure mounts from GOP lawmakers over Pres. Donald J. Trump's comments about embattled candidate Roy Moore. http://abcn.ws/2Brf3uu",White House Press Sec. Briefs Reporters,video,https://www.facebook.com/ABCNews/videos/10156607615033812/,2017-11-27 15:23:02,1258,1475,229,417,156,23,68,21,573,0
86680728811_10156607811978812,"Look-ups of the word increased nearly 300 percent over last year as ""complicit"" hit just about every hot button from politics to natural disasters.",Dictionary.com chooses 'complicit' as its word of the year,link,http://abcn.ws/2zJzNRa,2017-11-27 15:21:29,230,26,62,165,21,2,41,1,0,0
86680728811_10156607728448812,"Pres. Donald J. Trump, at event honoring Native American code talkers: ""We have a representative in Congress who they say was here a long time ago. They call her Pocahontas."" http://abcn.ws/2k26amT",Trump Makes Pocahontas Joke at Native American Event,video,https://www.facebook.com/ABCNews/videos/10156607728448812/,2017-11-27 14:54:23,51853,25715,100858,14945,1306,7965,3890,1563,22175,9
86680728811_10156607649638812,"Prince Harry on what his mother, Princess Diana, would have thought about his fiancée Meghan Markle: ""I think she would be over the moon and jumping up and down."" abcn.ws/2hWtf6c",Prince Harry says Princess Diana and Meghan Markle would be 't...,video,https://www.facebook.com/ABCNews/videos/10156607649638812/,2017-11-27 14:26:29,45782,1525,7771,31954,13144,120,53,489,19,3
86680728811_10156607605628812,Zimbabwe's former finance minister and a leader of the ruling ZANU-PF party's youth league have been denied bail in cases that have raised concerns about the military's actions during its recent takeover.,The Latest: Zimbabwe's ex-finance minister denied bail,link,http://abcn.ws/2i9LJEd,2017-11-27 14:07:26,77,10,12,66,5,0,5,0,0,1
86680728811_10156607552218812,"With lawmakers in Washington facing a deluge of agenda items to address before their December holiday recess, President Donald J. Trump kicked off the week by pitching a contest to determine ""the most dishonest, corrupt and/or distorted"" news network.","As lawmakers return to the Hill, Trump suggests fake news 'contest'",link,http://abcn.ws/2zIHSFJ,2017-11-27 13:47:06,1248,1041,92,385,43,42,231,28,517,2
86680728811_10156607543548812,"Meghan Markle says she's met the Queen a couple of times in interview following her engagement to Prince Harry: ""She's an incredible woman.""  abcn.ws/2k54I32","Markle Says She's Met the Queen, Calls Her 'Incredible Woman'",video,https://www.facebook.com/ABCNews/videos/10156607543548812/,2017-11-27 13:44:28,6219,270,588,4747,1315,18,126,7,4,2
86680728811_10156607530858812,"JUST IN: The lawyer for Pres. Donald J. Trump’s former national security adviser Michael Flynn met Monday morning with members of Special Counsel Robert Mueller’s team, the latest indication that both sides are discussing a possible plea deal, ABC News  has learned.","Flynn's lawyer meets members of special counsel's team, raising specter of plea deal",link,http://abcn.ws/2k6jCX7,2017-11-27 13:38:35,1163,174,290,835,134,35,145,2,8,4
86680728811_10156607520908812,"U.S. Senator Al Franken on any question of resignation: ""I'm not going to get into that...I've been trying to take responsibility by apologizing."" abcn.ws/2zJSfZS",Franken on Resignation: 'I'm Not Going to Get Into That',video,https://www.facebook.com/ABCNews/videos/10156607520908812/,2017-11-27 13:34:21,1464,1002,104,956,140,27,231,13,95,2
86680728811_10156607482358812,"An entertainment figure in her own right, and an outspoken woman comfortable talking about her background and her passions, American actress Meghan Markle will be a new type of royal when she weds Prince Harry in the spring. http://abcn.ws/2k1DBGb",American actress Meghan Markle to be a new kind of royal,link,http://abcn.ws/2k1DBGb,2017-11-27 13:21:45,808,72,28,680,96,11,16,2,1,2
86680728811_10156607369838812,We're on Capitol Hill as U.S. Senator Al Franken makes a statement and takes questions following allegations of sexual misconduct. http://abcn.ws/2hUjFAR,Al Franken Makes Statement Following Allegation,video,https://www.facebook.com/ABCNews/videos/10156607369838812/,2017-11-27 13:19:18,1386,1426,184,765,328,21,34,27,211,0
86680728811_10156607453873812,"Meghan Markle describes Prince Harry's proposal: ""I could barely let you finish proposing. I was like, 'Can I say yes now?'"" http://abcn.ws/2k54I32","Meghan Markle, Prince Harry Recount Proposal",video,https://www.facebook.com/ABCNews/videos/10156607453873812/,2017-11-27 13:12:40,17256,753,2119,12339,4747,41,113,8,5,3
86680728811_10156607413468812,"Bruno Mars took home awards for best R&B/soul male artist, video of the year, album of the year, song of the year and best dance performance at the Soul Train Awards.",Bruno Mars wins big at 2017 Soul Train Awards,link,http://abcn.ws/2hUc4Cf,2017-11-27 12:54:47,2287,67,137,1951,310,20,3,0,1,2
86680728811_10156607342193812,"U.S. Senator Al Franken on sexual misconduct allegations: ""I have to regain the trust of people I've let down...I am going to continue fighting for the things that I believe in."" http://abcn.ws/2hUjFAR",Franken Says He Must 'Regain Trust' Following Allegations,video,https://www.facebook.com/ABCNews/videos/10156607342193812/,2017-11-27 12:33:31,1970,967,118,1316,271,27,210,24,120,2
86680728811_10156607334078812,"The New York Stock Exchange got a little more magical this morning, when Mickey Mouse rang the opening bell. http://abcn.ws/2BtGDaC",Mickey Mouse Rings NYSE Opening Bell,video,https://www.facebook.com/ABCNews/videos/10156607334078812/,2017-11-27 12:27:18,2802,95,270,2403,338,10,50,0,1,0
86680728811_10156607274513812,The deputy director of the Consumer Financial Protection Bureau has sued the Trump administration in an effort to stop Pres. Donald J. Trump's pick from taking over control of the watchdog agency.,Obama-era official sues to stop Trump's consumer protection bureau appointment,link,http://abcn.ws/2BgOeIP,2017-11-27 12:03:28,559,95,38,445,64,8,32,0,8,2
86680728811_10156607204788812,"'TIS THE SEASON: The Capitol Christmas Tree arrives in Washington, D.C., completing a 3,000-mile journey from Yaak, Montana. http://abcn.ws/2hYeCj3",Capitol Christmas Tree Arrives in D.C.,video,https://www.facebook.com/ABCNews/videos/10156607204788812/,2017-11-27 11:40:53,2935,220,355,2576,200,126,10,8,14,1
86680728811_10156607138463812,"The ring's center stone hails from Botswana, a country with personal significance for the couple, and is flanked by two diamonds from the personal collection of Prince Harry's mother, the late Princess Diana.",1st look at Meghan Markle's engagement ring from Prince Harry,link,http://abcn.ws/2BpMJbP,2017-11-27 11:15:59,6091,118,236,4749,1217,106,8,4,4,3
86680728811_10156607132658812,"Hawaii is reinstating a statewide nuclear attack warning signal in December to prepare for a potential attack from North Korea. The alarm, which has not been used since the Cold War, will be reinstated on Dec. 1 as part of a ballistic missile preparedness program.",Hawaii reinstates Cold-War era nuclear attack warning signal amid North Korea tension,link,http://abcn.ws/2zIFQ8C,2017-11-27 11:14:10,1768,138,788,741,9,403,8,569,36,2
86680728811_10156607062748812,DECK THE HALLS: First lady Melania Trump shows off The White House holiday decorations for her family's first Christmas in office. http://abcn.ws/2jt4sXJ,First Lady Shows off White House Holiday Decorations,video,https://www.facebook.com/ABCNews/videos/10156607062748812/,2017-11-27 10:54:15,37118,4194,6957,27221,7065,2246,258,65,257,6
86680728811_10156607001218812,"House Democratic Leader Nancy Pelosi's defense of Congressman John Conyers, Jr.  – calling him ""an icon in our country"" who ""has done a great deal to protect women,"" and declining to say she believes Conyers' accusers – makes the partisan nature of reactions to the sexual harassment scandals bipartisan.",ANALYSIS: Democrats can't blame Trump for mess in their own house,link,http://abcn.ws/2zIJrU8,2017-11-27 10:31:16,227,122,33,164,8,9,22,4,19,1
86680728811_10156606955788812,"Surveillance footage captures the moment Mexico’s Popocatépetl volcano erupted in spectacular fashion, sending volcanic fragments at least 3,280 feet into the air over the volcano’s crater. http://abcn.ws/2hVr6aQ",Mexico’s Popocatepetl volcano erupts,video,https://www.facebook.com/ABCNews/videos/10156606955788812/,2017-11-27 10:18:07,7858,383,2491,4090,198,3499,28,40,3,0
86680728811_10156606942443812,"While Republican Senate leaders have criticized their party's nominee, Pres. Donald J. Trump plunged into the Alabama Senate race with a pair of tweets bashing Democrat Doug Jones.",Trump doubles down on Roy Moore in Alabama Senate race,link,http://abcn.ws/2hVQDRw,2017-11-27 10:08:45,656,338,27,185,28,12,54,21,353,3
86680728811_10156606871028812,"""God save the Queen!"" A town crier announces the engagement of Prince Harry and Meghan Markle. abcn.ws/4brxl0",Unofficial Town Crier Proclaims Royal Engagement,video,https://www.facebook.com/ABCNews/videos/10156606871028812/,2017-11-27 09:47:14,15939,507,3869,12308,2872,154,583,14,6,2
86680728811_10156606872388812,Indian police on Monday took the unusual step of using elephants in an attempt to evict hundreds of people living illegally in a protected forest area in the country's remote northeast.,Indian police use elephants to clear their protected habitat,link,http://abcn.ws/2BsVemG,2017-11-27 09:46:01,187,12,16,145,11,24,3,1,2,1
86680728811_10156606765718812,"ROYAL COUPLE: Prince Harry and Meghan Markle make first appearance since their engagement was announced. Congrats, you two! abcn.ws/4brxl0",Royal Couple Appears For First Time Since Engagement,video,https://www.facebook.com/ABCNews/videos/10156606765718812/,2017-11-27 09:26:02,52317,2575,11756,40033,11590,538,85,46,23,2
86680728811_10156606747503812,"Taxes, spending, immigration and more top a lengthy to-do list when lawmakers return to Capitol Hill on Monday after their Thanksgiving break.",Highlights of Washington's jam-packed year-end agenda,link,http://abcn.ws/2k2obBK,2017-11-27 09:15:59,130,50,17,78,9,2,6,0,34,1
86680728811_10156606706253812,We're at Buckingham Palace as the newly-engaged royal couple makes their first appearance.,,video,https://www.facebook.com/ABCNews/videos/10156606706253812/,2017-11-27 09:04:26,4938,984,479,3338,1530,52,13,3,3,-1
86680728811_10156606667513812,"People surrounded a Texas Highway Patrol vehicle with candles, teddy bears and star-shaped balloons with the colors of the American flag on them. Others placed cards, photos and handwritten posters, including some that hailed Allen as ""a true hero,"" on the black and white cruiser.",Mourners remember slain Texas state trooper as 'true hero',link,http://abcn.ws/2zH8g2y,2017-11-27 08:50:34,577,34,28,279,42,3,2,249,1,1
86680728811_10156606643658812,"Video shows crews preparing a U.S. Navy deep sea vessel to assist in searching for missing Argentine submarine with 44 crew members aboard. The submarine vanished twelve days ago, but Argentine officials are not ruling out a ""situation of extreme survival."" http://abcn.ws/2k3X8FU",Crews Prepare US Navy Vessel for Submarine Search,video,https://www.facebook.com/ABCNews/videos/10156606643658812/,2017-11-27 08:47:04,678,29,105,490,28,24,1,135,0,0
86680728811_10156606567513812,"The police were notified early Monday that some dozen windows were smashed during the night in the center that was opened in 2015 and includes a mosque, a meeting center, a shop and a restaurant. No one was hurt.",Unknown attackers smash windows in Warsaw's Muslim center,link,http://abcn.ws/2zI4HsU,2017-11-27 08:13:46,471,79,21,178,13,14,11,121,131,3
86680728811_10156606541298812,"""It's like winning the lottery."" A homeless veteran says he's been given a second chance after receiving over $360,000 for helping a stranded woman buy gas. http://abcn.ws/2k1KS94",Homeless veteran who received over $360K now wants to pay it f...,video,https://www.facebook.com/ABCNews/videos/10156606541298812/,2017-11-27 07:59:20,9820,163,1276,7277,2390,137,4,10,0,2
86680728811_10156606480343812,"A Tennessee dad who died from pancreatic cancer in 2013 arranged to send his daughter flowers every year on her birthday until she turns 21. ""He was just an overall great person.""",Daughter gets flowers on her birthday every year from dad who died from cancer 4 years ago,link,http://abcn.ws/2hVIMmU,2017-11-27 07:28:02,6838,39,268,4464,1610,46,2,710,1,5
86680728811_10156606471328812,"Sen. Al Franken said in a radio interview yesterday he is ""ashamed"" of the photo with Leeann Tweeden. ""She didn’t have any ability to consent. She had every right to feel violated by that photo."" http://abcn.ws/2zGowks","Sen. Franken is 'ashamed' of Tweeden photo, says 'she didn’t h...",video,https://www.facebook.com/ABCNews/videos/10156606471328812/,2017-11-27 07:25:21,420,348,33,284,39,9,22,12,53,1
86680728811_10156606380358812,A Georgia restaurant employee is being praised for her kind deed after she helped a customer cut his pancakes.,Restaurant worker helps man struggling to cut pancakes in sweet video,link,http://abcn.ws/2hVBCPw,2017-11-27 06:30:21,1441,24,73,1130,300,4,1,1,1,4
86680728811_10156606338968812,"More than 500 black bears have returned to parts of their historic range in the Great Basin of Nevada where the species disappeared about 80 years ago, scientists say.",Black bears back in eastern Nevada after 80-year absence,link,http://abcn.ws/2hVKnco,2017-11-27 06:04:30,1708,43,163,1443,199,57,2,2,1,4
86680728811_10156606288853812,"BREAKING: Prince Harry and Meghan Markle are engaged, Clarence House announces. The couple got engaged in London earlier this month; the wedding will take place in Spring 2018.",Prince Harry and Meghan Markle are engaged,link,http://abcnews.go.com/Entertainment/prince-harry-meghan-markle-engaged/story?id=46148130,2017-11-27 05:34:04,5958,180,271,4896,962,71,12,7,4,6
86680728811_10156606267123812,"BREAKING: Prince Harry and Meghan Markle are engaged, Clarence House announces. abcn.ws/2zuDPbF",Timeline Photos,photo,https://www.facebook.com/ABCNews/photos/a.10150095914943812.286215.86680728811/10156606267123812/?type=3,2017-11-27 05:17:38,24472,955,2731,19548,4508,332,34,31,12,7
