status_id,status_message,link_name,status_type,status_link,status_published,num_reactions,num_comments,num_shares,num_likes,num_loves,num_wows,num_hahas,num_sads,num_angrys,num_special
86680728811_10155099954928812,Underwater in Pearl Harbor exploring Japanese mini submarines involved in the attack that took place 75 years ago today. abcn.ws/2hiV5Hz,Underwater in Pearl Harbor,video,https://www.facebook.com/ABCNews/videos/10155099954928812/,2016-12-07 11:48:22,18530,3619,7683,13047,1246,2463,63,1596,115,0
86680728811_10155099575958812,"Pearl Harbor survivors remember the attack: ""All I could do was hold on. The ship was all on fire."" http://abcn.ws/2hiV5Hz",Pearl Harbor Survivors: In Their Own Words,video,https://www.facebook.com/ABCNews/videos/10155099575958812/,2016-12-07 10:34:55,1741,51,1201,1263,64,28,1,385,0,0
86680728811_10155097853488812,"Texas A&M University police say two non-students were arrested during protest against campus appearance by Richard Spencer, the leader of a white nationalist organization. http://abcn.ws/2h1E7OA",Hundreds Protest White Nationalist's Speech at Texas A&M,video,https://www.facebook.com/ABCNews/videos/10155097853488812/,2016-12-07 02:35:57,563,164,205,360,12,78,17,7,89,0
86680728811_10155097677863812,"North Dakota blizzard with 50 mph wind gusts forces schools, businesses, and even a 230-mile stretch of Interstate 94 to shut down. http://abcn.ws/2g6WqVM",Heavy Blizzard Conditions in North Dakota,video,https://www.facebook.com/ABCNews/videos/10155097677863812/,2016-12-07 01:29:55,13150,1833,14636,7697,163,4793,89,397,11,0
86680728811_10155096755663812,"President-elect Donald J. Trump: ""We will be the administration that ended illegal immigration."" http://abcn.ws/2g7O5RA",Donald Trump Continues Thank-You Tour in North Carolina,video,https://www.facebook.com/ABCNews/videos/10155096755663812/,2016-12-06 20:36:42,5171,873,303,3530,406,48,931,29,227,0
86680728811_10155096722463812,"JUST IN: James ""Mad Dog"" Mattis thanks President-elect Donald J. Trump for ""the opportunity to return to our troops"" after Trump formally announced that he intends to nominate the retired U.S. Marine Corps general as secretary of defense. http://abcn.ws/2h0LXIi",Trump Announces James Mattis as Secretary of Defense Pick,video,https://www.facebook.com/ABCNews/videos/10155096722463812/,2016-12-06 20:24:45,1915,263,182,1415,224,14,28,15,219,0
86680728811_10155096713138812,JUST IN: Pres.-elect Donald J. Trump formally announces that he intends to nominate retired Marine Gen. James Mattis as secretary of defense. http://abcn.ws/2gQdizm,Trump Announces Mattis As Defense Secretary Pick,video,https://www.facebook.com/ABCNews/videos/10155096713138812/,2016-12-06 20:20:30,1123,184,59,749,138,10,18,15,193,0
86680728811_10155096365648812,"President-elect Donald J. Trump continues his ""Thank You"" tour tonight in North Carolina, where he is expected to announce retired Marine Gen. James Mattis as secretary of defense. http://abcn.ws/2gPN1Bg",President-Elect Trump Holds 'Thank You' Rally in North Carolina,video,https://www.facebook.com/ABCNews/videos/10155096365648812/,2016-12-06 19:41:30,5753,7121,474,2953,1040,68,166,102,1424,0
86680728811_10155096086263812,U.S. Capitol Christmas tree from the Payette National Forest in Idaho is lit for the holiday season. abcnews.com,U.S. Capitol Christmas Tree is Lit,video,https://www.facebook.com/ABCNews/videos/10155096086263812/,2016-12-06 19:33:51,946,27,201,865,56,18,5,1,1,0
86680728811_10155095932488812,"Pres. Barack Obama in his final national security speech: ""If we act like this is a war between the U.S. and Islam, we're not just going to lose more Americans to terrorist attacks, but we'll also lose sight of the very principles we claim to defend...the United States of America is not a country that imposes religious tests as a price for freedom."" http://abcn.ws/2gLklct",POTUS: Terrorists Do Not Speak for the 1B Muslims Around World,video,https://www.facebook.com/ABCNews/videos/10155095932488812/,2016-12-06 16:46:47,5053,1312,978,3865,783,28,188,32,157,0
86680728811_10155095825448812,"Pres. Barack Obama in final national security speech: ""These terrorists want to cast themselves as the vanguard of a new world order - they are not. They are thugs and they are murderers and they should be treated that way."" http://abcn.ws/2gLklct",Pres. Obama: Terrorists Are Thugs and Murderers,video,https://www.facebook.com/ABCNews/videos/10155095825448812/,2016-12-06 16:25:00,1081,215,84,911,108,4,35,8,15,0
86680728811_10155095790768812,"Pres. Barack Obama in final national security speech: ""I believe that the United States military can achieve any mission. That we are and must remain the strongest fighting force the world has ever known...Even as we focus relentlessly on dismantling terrorist networks like Al-Qaeda and ISIL, we should ask allies to do their share."" http://abcn.ws/2gLklct",POTUS: We Must Remain 'Strongest Fighting Force' in World,video,https://www.facebook.com/ABCNews/videos/10155095790768812/,2016-12-06 16:16:22,622,138,45,506,73,0,13,2,28,0
86680728811_10155095389008812,"Donald J. Trump announces that Masayoshi Son, CEO of SoftBank, has agreed to invest $50 billion in the U.S. and create 50,000 new jobs. http://abcn.ws/2h3XPfr",Trump Announces CEO of SoftBank Has Agreed to Invest $50B in US,video,https://www.facebook.com/ABCNews/videos/10155095389008812/,2016-12-06 14:26:48,64447,5484,36911,56523,4661,1245,1661,39,318,0
86680728811_10155095377633812,"Driver mows down biker and drives into a river after accidentally hitting the gas while trying to stop runaway car. Thankfully, nobody was hurt. http://abcn.ws/2heqdfp",Driver Mistakenly Reverses Car Into River,video,https://www.facebook.com/ABCNews/videos/10155095377633812/,2016-12-06 14:20:15,1527,121,534,798,10,505,166,41,7,0
86680728811_10155095316758812,PANDAMONIUM: One-month-old twin giant panda cubs make their public debut at the Shanghai Wild Animal Park. http://abcn.ws/2h3sFVj,One-Month-Old Baby Panda Twins Make Debut,video,https://www.facebook.com/ABCNews/videos/10155095316758812/,2016-12-06 13:58:26,4400,180,1747,3551,795,43,9,1,1,0
86680728811_10155094856603812,"Drone footage captures an aerial view of the sinkhole in San Antonio, Texas that swallowed two cars and claimed the life of a sheriff's deputy. http://abcn.ws/2g5GV0q","Aerial View of Sinkhole in San Antonio, Texas",video,https://www.facebook.com/ABCNews/videos/10155094856603812/,2016-12-06 11:14:06,3947,136,1025,1232,16,1197,9,1482,11,0
86680728811_10155094608658812,"Pres.-elect Donald J. Trump on Boeing contract for new Air Force One: ""The plane is totally out of control...we want Boeing to make money, but not that much money."" http://abcn.ws/2h1GiSx","Trump on Boeing: ""The plane is totally out of control""",video,https://www.facebook.com/ABCNews/videos/10155094608658812/,2016-12-06 09:44:47,3430,718,434,2537,154,69,299,12,359,0
86680728811_10155094599578812,"President-elect Donald J. Trump on meetings at Trump Tower today: ""We're going to talk about a lot of things to a lot of people."" http://abcn.ws/2h1GiSx",Donald Trump To Hold Meetings At Trump Tower Today,video,https://www.facebook.com/ABCNews/videos/10155094599578812/,2016-12-06 09:41:23,1406,540,140,820,65,21,312,14,174,0
86680728811_10155094186458812,"Construction crew surprises friendly neighbor – whose 2012  stroke left him unable to speak well – with Green Bay Packers tickets.  ""It was just the most wonderful thing they could do for him, especially this time of year."" http://abcn.ws/2hbC25P",Construction Crew Surprises Friendly Neighbor With Packers Tic...,video,https://www.facebook.com/ABCNews/videos/10155094186458812/,2016-12-06 07:28:48,3796,65,490,2868,883,41,2,2,0,0
86680728811_10155093491623812,"In besieged Aleppo, one hospital receives more than 300 injured people each day, doctor says. ""The situation is madness."" http://abcn.ws/2h1mjWH",Aleppo Medics Struggle to Treat the Injured,video,https://www.facebook.com/ABCNews/videos/10155093491623812/,2016-12-06 01:58:50,1144,77,291,515,11,67,1,498,52,0
86680728811_10155093364823812,TIGER TRIPLETS: Three endangered tiger cubs make their debut at the Milwaukee County Zoo. http://abcn.ws/2gvlj9A,Endangered Tiger Cubs Debut at Milwaukee Zoo,video,https://www.facebook.com/ABCNews/videos/10155093364823812/,2016-12-06 00:55:16,4003,50,572,3338,601,51,7,3,3,0
86680728811_10155092720768812,"Vice President Biden gets emotional as portion of bill to speed up drug approvals is renamed after his son, Beau, who died of cancer last year at age 46. Biden said Mitch McConnell's gesture ""validates all the years"" he spent in Senate and ""makes me realize all the support I've had since my Beau died."" http://abcn.ws/2gwjTMh",Portion of Bill Speeding Federal Drug Approvals Renamed for Bi...,video,https://www.facebook.com/ABCNews/videos/10155092720768812/,2016-12-05 20:34:22,21165,331,2045,15908,3455,38,14,1742,8,0
86680728811_10155092308423812,"Chris Stewart, attorney representing the family of Walter Scott, responds to declared mistrial for former South Carolina police officer Michael Slager: He dodged conviction ""by a hair; he's not dodging it again."" abcn.ws/2h8kxzs",Scott Family Attorney Responds to Slager Mistrial,video,https://www.facebook.com/ABCNews/videos/10155092308423812/,2016-12-05 17:34:35,406,141,122,257,7,6,8,51,77,0
86680728811_10155092094068812,"PANDA WATCH: Many worried about how these two giant pandas would handle their first cold winter. Luckily, they're having the time of their lives. http://abcn.ws/2gHpXEq",Pandas Adjust to Their First Cold Winter,video,https://www.facebook.com/ABCNews/videos/10155092094068812/,2016-12-05 16:34:17,1348,42,181,1161,159,6,20,2,0,0
86680728811_10155091912438812,"BREAKING: Judge declares mistrial in trial of former North Charleston, South Carolina, police officer Michael Slager in the shooting death of Walter Scott. http://abcn.ws/2gZh3Ax",Judge Declares Mistrial in Michael Slager Trial,video,https://www.facebook.com/ABCNews/videos/10155091912438812/,2016-12-05 15:44:09,1266,315,442,493,21,163,4,50,535,0
86680728811_10155091629358812,"Former US Ambassador to China and Governor Jon Huntsman , a contender for secretary of state in the Trump administration, says President-elect Donald J. Trump was ""absolutely right"" to take a phone call from Taiwanese President Tsai Ing-wen, a breach of diplomatic protocol. http://abcn.ws/2h0aznm",Huntsman: Trump 'Absolutely Right' on Taiwan Phone Call,video,https://www.facebook.com/ABCNews/videos/10155091629358812/,2016-12-05 14:26:24,473,193,49,352,23,8,18,4,68,0
86680728811_10155089023088812,Cubans mourn as late leader Fidel Castro's ashes are interred at end four-day journey across the island http://abcn.ws/2gpvSeA,Cuba Mourns Death of Fidel Castro,video,https://www.facebook.com/ABCNews/videos/10155089023088812/,2016-12-04 19:52:55,245,91,45,165,13,9,14,20,24,0
86680728811_10155088728263812,"20,000 people fill tiny stadium under umbrellas and plastic ponchos to say goodbye to members of the Associação Chapecoense de Futebol soccer club who died in a plane crash. http://abcn.ws/2fWNJNT",Rain and Sorrow Accentuate Memorial for Dead at Brazil Club,video,https://www.facebook.com/ABCNews/videos/10155088728263812/,2016-12-04 17:41:36,3285,34,174,1669,163,16,0,1434,3,0
86680728811_10155087875413812,"Donald J. Trump, Kellyanne Conway attend lavish ""Villains and Heroes"" costume party at donor's NY estate abcn.ws/2gCNruw",Trump Hits Up Lavish NY Party,video,https://www.facebook.com/ABCNews/videos/10155087875413812/,2016-12-04 12:51:35,841,369,71,514,42,10,102,9,164,0
86680728811_10155087293358812,"Mike Pence tells This Week: Donald Trump deciding to intervene with companies over jobs is not ""picking winners and losers"" http://abcn.ws/2goIeDE",Pence: Trump Intervening Not 'Picking Winners and Losers',video,https://www.facebook.com/ABCNews/videos/10155087293358812/,2016-12-04 09:24:26,469,232,38,274,23,11,64,5,92,0
86680728811_10155084868083812,"NEW: Firefighters responding to 10-alarm blaze involving at least seven buildings in Cambridge, MA, Cambridge fire union says",Fireifighters Respond to 10-Alarm Blaze in Cambridge,video,https://www.facebook.com/ABCNews/videos/10155084868083812/,2016-12-03 17:03:40,1373,82,365,570,8,398,3,391,3,0
86680728811_10155081469493812,"Surveillance video captures brazen home invasion; one suspect, dressed as a UPS worker, entered the home, before three armed robbers stormed in. The suspects remain at large. 
http://abcn.ws/2gPMpMf",Men Rob Houston Home Wearing UPS Uniform,video,https://www.facebook.com/ABCNews/videos/10155081469493812/,2016-12-02 18:41:13,1816,295,1351,737,13,354,4,38,670,0
86680728811_10155080639473812,"Moment of silence held in honor of victims of San Bernardino terror attack, which took place one year ago today. http://abcn.ws/2fPFXFe",Moment of Silence Held for Victims of San Bernadino Terror Attack,video,https://www.facebook.com/ABCNews/videos/10155080639473812/,2016-12-02 16:51:42,2398,41,135,1472,113,9,1,801,2,0
86680728811_10155079223328812,This tiny horse playing with a big exercise ball will make your day. http://abcn.ws/2fM2jr4,"Tiny Horse, Big Exercise Ball",video,https://www.facebook.com/ABCNews/videos/10155079223328812/,2016-12-02 07:28:34,17404,2378,8492,13899,2359,26,1117,3,0,0
86680728811_10155078588683812,"Hundreds gather for vigil honoring slain Tacoma police officer, lighting candles, singing songs and sharing memories. Washington Gov. Jay Inslee said ""all of Washington grieves with Tacoma."" http://abcn.ws/2gN01Yp",Vigil Held for Slain Tacoma Police Officer,video,https://www.facebook.com/ABCNews/videos/10155078588683812/,2016-12-02 02:09:45,2307,40,90,1170,93,4,0,1034,6,0
86680728811_10155078472513812,Niagara Falls' $4 million lighting makeover unveiled in ceremony that showed off the Falls' bright new colors. The new LED lighting is part of the first upgrade at the famous bi-national tourist attraction in more than 20 years. http://abcn.ws/2geLSzV,Niagara Falls Gets $4M Lighting Makeover,video,https://www.facebook.com/ABCNews/videos/10155078472513812/,2016-12-02 01:13:46,12686,517,3196,10771,1097,804,7,4,3,0
86680728811_10155077173613812,"President Obama, First Family light National Christmas Tree. http://abcn.ws/2gRnmoz",Pres. Obama and First Family Light the National Christmas Tree,video,https://www.facebook.com/ABCNews/videos/10155077173613812/,2016-12-01 17:27:11,23019,723,2487,18902,3862,69,36,27,123,0
86680728811_10155076945833812,"President Barack Obama, First Lady Michelle Obama and the First Family light the National Christmas Tree. abcnews.com/live",First Family Lights National Christmas Tree,video,https://www.facebook.com/ABCNews/videos/10155076945833812/,2016-12-01 17:21:24,17844,4879,3148,10766,6432,140,144,111,251,0
86680728811_10155076761013812,"Thousands line the streets in Havana, Cuba, as they wait to pay their respects to former Cuban leader Fidel Castro. http://abcn.ws/2fQqpwk",Thousands Line Streets to Pay Respects to Fidel Castro,video,https://www.facebook.com/ABCNews/videos/10155076761013812/,2016-12-01 15:44:05,9022,2556,1263,6824,314,658,370,125,731,0
86680728811_10155076704888812,"Pres.-elect Donald J. Trump at Carrier facility in Indianapolis: ""Companies are not going to leave the United States anymore without consequences."" http://abcn.ws/2gNjdTt",Trump: Companies Not Going To Leave U.S. Without Consequences,video,https://www.facebook.com/ABCNews/videos/10155076704888812/,2016-12-01 15:17:22,2257,809,254,1595,200,22,331,10,99,0
86680728811_10155076665123812,"JUST IN: Carrier says it will keep 1,100 jobs at its Indianapolis plant after deal with incoming Trump administration. http://abcn.ws/2gNjdTt","Carrier to keep 1,100 jobs at Indianapolis plant",video,https://www.facebook.com/ABCNews/videos/10155076665123812/,2016-12-01 15:01:42,3096,550,298,2532,222,31,89,12,210,0
86680728811_10155076629278812,How the world is still fighting AIDS 35 years after its discovery http://abcn.ws/2gLhcKh #WorldAIDSDay,World AIDS Day: How The World Is Still Fighting AIDS,video,https://www.facebook.com/ABCNews/videos/10155076629278812/,2016-12-01 14:48:30,297,19,111,192,10,32,1,61,1,0
86680728811_10155076428103812,“No damage at all”: Mississippi family's home miraculously survives tornado that destroyed nearly everything else nearby. http://abcn.ws/2gMNXEf,Family's Home Miraculously Survives Tornado in Mississippi,video,https://www.facebook.com/ABCNews/videos/10155076428103812/,2016-12-01 13:27:07,425,23,66,249,13,116,1,46,0,0
86680728811_10155076399253812,JUST IN: Russian space agency says its unmanned cargo ship bound for the International Space Station is a total loss and burned up in the atmosphere. Video shows the launch earlier today. http://abcn.ws/2gZwgV9,Russian Cargo Ship Launches to Int'l Space Station,video,https://www.facebook.com/ABCNews/videos/10155076399253812/,2016-12-01 13:14:00,1584,138,336,605,7,481,30,452,9,0
86680728811_10155076302353812,"Powerful waterspout forms off the coast of Fort Walton Beach, Florida. ""It's coming right at us!"" http://abcn.ws/2gZijq1",Waterspout Forms off Coast of Florida,video,https://www.facebook.com/ABCNews/videos/10155076302353812/,2016-12-01 12:41:46,544,42,171,346,8,181,2,7,0,0
86680728811_10155076237278812,"WATCH: Mexico’s Popocatépetl volcano, dubbed “El Popo” by locals, spewed lava and ash as it erupted early Thursday morning. The local airport was forced to halt operations as a result of the eruption. http://abcn.ws/2gMzyYw",Mexico’s Popocatépetl Volcano Erupts,video,https://www.facebook.com/ABCNews/videos/10155076237278812/,2016-12-01 12:19:47,6625,213,2079,3879,91,2582,23,50,0,0
86680728811_10155075798863812,Progress 65 cargo craft lifts off with nearly three tons of supplies for the International Space Station. abcnews.com/live,Cargo Craft Launches For Int'l Space Station,video,https://www.facebook.com/ABCNews/videos/10155075798863812/,2016-12-01 09:50:40,2894,757,528,2356,245,245,25,12,11,0
86680728811_10155074961278812,"A Michigan woman still teaching yoga at 105 celebrated her birthday with her class, a group of people in their 70s and 80s young enough to be her children. http://abcn.ws/2gIqaHQ",Michigan Woman Still Teaching Yoga Class at 105,video,https://www.facebook.com/ABCNews/videos/10155074961278812/,2016-12-01 04:30:53,107216,9115,105608,86820,14764,5462,144,21,5,0
86680728811_10155074812153812,"Thanks to a Canadian animal shelter, a dog once left for dead now has a twin in the form of a stuffed version of himself. ""Justice was definitely a 'spokes-dog' for awareness of animal cruelty."" http://abcn.ws/2gmtZ5e",Dog Once Left for Dead Now Has His Own Mascot,video,https://www.facebook.com/ABCNews/videos/10155074812153812/,2016-12-01 03:02:11,7856,137,734,5218,1328,34,7,1136,133,0
86680728811_10155074212483812,Associação Chapecoense de Futebol players who weren't on the team's ill-fated flight to Colombia join memorial service at their home stadium in emotional tribute to fallen teammates. http://abcn.ws/2gXFwJm,Brazilian Soccer Fans Fill Stadium in Vigil for Chapecoense Team,video,https://www.facebook.com/ABCNews/videos/10155074212483812/,2016-11-30 22:28:49,25531,460,3188,12130,1777,54,10,11547,13,0
86680728811_10155073788378812,Dramatic footage shows devastation from recent tornado activity in Alabama; At least 5 are dead across Alabama and Tennessee. http://abcn.ws/2g7vYY4,Devastation Caused by Tornado in Alabama,video,https://www.facebook.com/ABCNews/videos/10155073788378812/,2016-11-30 19:12:06,1258,54,167,360,3,161,0,728,6,0
86680728811_10155073649043812,STONE COLD: Runners in the Antarctica Ice Marathon take place in a mannequin challenge with temperatures reaching -4 degrees. http://abcn.ws/2gL4E1O,Antarctica Ice Marathon Mannequin Challenge,video,https://www.facebook.com/ABCNews/videos/10155073649043812/,2016-11-30 18:02:50,1497,88,209,1193,78,192,34,0,0,0
86680728811_10155073593573812,NYPD officers are searching for a quick-thinking thief who lifted a bucket filled with $1.6 million worth of gold flakes off an armored truck. http://abcn.ws/2g7fijr,Man Steals $1.6 Million of Gold From Truck,video,https://www.facebook.com/ABCNews/videos/10155073593573812/,2016-11-30 17:38:02,3958,810,2219,2162,52,821,877,15,31,0
86680728811_10155073209943812,Somber scene: Fans of Brazil's Chapecoense soccer team gather to remember the victims of Tuesday's fatal charter plane crash that killed 71. http://abcn.ws/2g7cmDu,Soccer Team Fans Gather To Remember Victims of Plane Crash,video,https://www.facebook.com/ABCNews/videos/10155073209943812/,2016-11-30 15:37:08,880,19,92,455,49,2,0,373,1,0
86680728811_10155071685038812,NYPD is looking for quick-thinking thief who lifted an 86-pound bucket of gold flakes worth $1.6 million off an armored truck when the guard wasn't looking. Authorities say the suspect is believed to be hiding out in Florida. http://abcn.ws/2gvYFi0,NYPD: Thief Stole 86-Pound Bucket of Gold Flakes Worth $1.6 Mi...,video,https://www.facebook.com/ABCNews/videos/10155071685038812/,2016-11-30 06:31:07,16468,3395,12718,8686,237,3742,3639,46,118,0
86680728811_10155071059178812,"Several hundred people gathered Tuesday night for tribute on the Wayne State University campus to slain police officer Collin Rose. Officials announced Rose will be posthumously promoted to sergeant and will have a $25,000 scholarship created in his name. http://abcn.ws/2gI4rwj",Tribute to Slain Wayne State University Officer,video,https://www.facebook.com/ABCNews/videos/10155071059178812/,2016-11-30 00:44:31,4488,44,413,2733,321,10,2,1419,3,0
86680728811_10155070897428812,GIVING IN AMERICA: The bucket that helped spark the The ALS Association Ice Bucket Challenge is now on display at the Smithsonian National Museum of American History. The philanthropic effort raised more than $50 million for ALS research. http://abcn.ws/2gGuHH6,Ice Bucket That Sparked Charity Blitz Comes to Smithsonian,video,https://www.facebook.com/ABCNews/videos/10155070897428812/,2016-11-29 23:29:03,733,20,67,665,54,13,1,0,0,0
86680728811_10155070820998812,"Fans of Club Atlético Nacional Oficial, the Colombian team that was set to face Associação Chapecoense de Futebol in the Copa Sudamericana finals, held a vigil Wednesday night in Bogotá following plane crash that killed 71 people. http://abcn.ws/2g4bwY5",Fans of Colombian Team Set to Face Chapecoense Hold Vigil,video,https://www.facebook.com/ABCNews/videos/10155070820998812/,2016-11-29 22:50:58,2334,65,347,1310,157,8,2,854,3,0
86680728811_10155070432108812,"Watch as one of six survivors is removed from the wreckage of a plane that crashed in Colombia . Officials now say 71 people were killed in the crash, down from 75, as they’ve now been able to confirm 4 people did not board the flight. http://abcn.ws/2gGDWXQ",Survivor Removed from Wreckage of Plane Crash in Colombia,video,https://www.facebook.com/ABCNews/videos/10155070432108812/,2016-11-29 19:51:35,3735,121,301,1449,45,383,2,1852,4,0
86680728811_10155069704203812,"""You're bleeding!"" Victim recounts chaotic scene during The Ohio State University attack http://abcn.ws/2gSVSCH",OSU Victim Recounts Chaotic Scene During Attack,video,https://www.facebook.com/ABCNews/videos/10155069704203812/,2016-11-29 15:20:21,191,15,23,115,3,9,1,61,2,0
86680728811_10155069474873812,"""HIT THE GAS!”: Harrowing video captures two Tennessee residents and a dog racing to escape raging wildfires in the Great Smoky Mountains. http://abcn.ws/2ggw7vg",Tennessee Residents Record Escape From Raging Wildfire,video,https://www.facebook.com/ABCNews/videos/10155069474873812/,2016-11-29 14:02:26,8399,976,6021,2375,33,3076,5,2891,19,0
86680728811_10154842770968812,Video released by the Syrian military shows the extent of the destruction to the city of Aleppo after days of heavy airstrikes. http://abcn.ws/2ddsCEe,Syrian Military Video Shows Aleppo Reduced to Ruins,video,https://www.facebook.com/ABCNews/videos/10154842770968812/,2016-09-29 16:49:18,518,62,94,255,2,15,3,203,40,0
86680728811_10154842041848812,New Jersey Governor Chris Christie says 108 people were injured in the NJ Transit train crash; 1 person has died. abcn.ws/2dtTm5E,NJ Gov. Christie Updates on NJ Train Crash,video,https://www.facebook.com/ABCNews/videos/10154842041848812/,2016-09-29 12:58:37,661,88,120,279,5,58,1,314,4,0
86680728811_10154841615913812,"WATCH: ABC News Special Report: At least 1 dead, 100 injured, several critically, in NJ train crash in Hoboken. abcn.ws/2dtTm5E","ABC News Special Report: NJ Train Crash in Hoboken, NJ",video,https://www.facebook.com/ABCNews/videos/10154841615913812/,2016-09-29 10:11:50,954,70,459,353,4,143,1,453,0,0
86680728811_10154839946833812,"Donald J. Trump jokes about non-conservative Christians at Iowa rally. ""Raise your hand if you are not a Christian conservative - I want to see this. Oh, there’s a couple of people. That’s alright, I think we'll keep them, right? Should we keep them in the room?"" http://abcn.ws/2cD7lVC",Trump Jokes About Non-Conservative Christians at Iowa Rally: '...,video,https://www.facebook.com/ABCNews/videos/10154839946833812/,2016-09-28 21:37:00,1191,558,222,532,22,79,133,18,407,0
86680728811_10154839792703812,"Teen suspect's motive in South Carolina school shooting unclear at this point, sheriff says. ""We can only speculate."" http://abcn.ws/2cX62ws","Motive Unclear in South Carolina School Shooting, Sheriff Says",video,https://www.facebook.com/ABCNews/videos/10154839792703812/,2016-09-28 20:25:00,642,74,53,349,3,14,0,185,91,0
